title,url
‘AS SOON AS POSSIBLE’: China’s surprise reaction to Putin’s nuke threat,https://www.news.com.au/world/europe/world-leaders-react-to-vladimir-putins-latest-chilling-speech-on-ukraine-conflict/news-story/fd96338e0a1dcc21850479066f452301
Trump and his kids sued for $250 million,https://www.news.com.au/world/north-america/us-politics/donald-trump-and-three-of-his-children-are-sued-for-fraud-by-new-yorks-attorney-general/news-story/fa2daad5f7f485bf314ce29ab1b7a1ce
Covid outbreak after Queen’s funeral,https://www.news.com.au/entertainment/celebrity-life/royals/queen-margrethe-of-denmark-tests-positive-for-covid-after-queens-funeral/news-story/3e9a305b2a0973bbdb3fa37d95442eb2
AFL hero’s ‘heartbreaking’ live TV reveal,https://www.news.com.au/sport/afl/heartbreaking-eddie-betts-desperate-plea-to-afl-clubs-after-hawthorn-hawks-allegations/news-story/113305f0ca7f0262596d1934901d31c1
Australian family abandoned in ocean,https://www.news.com.au/travel/travel-updates/warnings/australian-mum-and-sons-surface-from-scuba-dive-to-find-boat-vanished/news-story/45cf0003ddeac4f0b9cfb818e615cec7
Jerry Maguire kid is totally unrecognisable,https://www.news.com.au/entertainment/movies/why-jerry-maguires-jonathan-lipnicki-quit-acting/news-story/f8f049060276b17dd5a9b861cdd19c32
Woman compared to centipede for long torso,https://www.news.com.au/lifestyle/real-life/news-life/woman-with-long-torso-compared-to-worm-aliens-from-men-in-black/news-story/e7a5dfafc5b3fea22447646bd64b0f8a
Reality star’s cruel blow aired on special day,https://www.news.com.au/entertainment/tv/reality-tv/james-weir-recaps-farmer-wants-a-wife-2022-episode-8/news-story/c0d585dfc16c57b46ef011051622c284
Robbie: ‘Most humiliating moment of my life’,https://www.news.com.au/entertainment/movies/upcoming-movies/margot-robbie-was-mortified-by-the-attention-barbie-shoot-generated/news-story/230326ac7fb0750e8a109cd1cccc1d0c
Exact date Charles could be crowned,https://www.news.com.au/entertainment/celebrity-life/royals/exact-date-king-charles-iii-could-be-crowned/news-story/2ab266067e391f4c147e82cc13b191eb
Amazing act of kindness after bus crash,https://www.news.com.au/technology/motoring/on-the-road/student-seriously-injured-in-school-bus-crash-outside-of-melbourne/news-story/709d27012fe0bb0ea0d8359754afbbe5
Tiny Aussie town about to boom,https://www.escape.com.au/destinations/australia/surprise-spot-named-australias-top-tourist-town/news-story/09d03dc81fe5febad6b77247f7778ea0
"Trump, children sued for ‘incredible’ fraud in New York",https://www.news.com.au/breaking-news/trump-children-sued-for-fraud-in-new-york/news-story/4098994e8c3f54b75a134376a1f20c8d
Biden vows solidarity with Iran women as protests spread,https://www.news.com.au/breaking-news/six-reported-killed-as-iran-protests-spread-over-womans-death/news-story/687feb4e205858ada000cd2dddd84032
Biden lashes Putin as he backs reformed UN,https://www.news.com.au/breaking-news/biden-lashes-putin-as-he-backs-reformed-un/news-story/f19ac8e7685c590bd086a6906661d13a
Prison staffer spills on most chilling confession she heard,https://www.news.com.au/national/ive-got-news-for-you/podcast/addc2b261d7ffa5efaf36d1dc52803c0
Levine cheating saga gets even worse,https://www.news.com.au/entertainment/celebrity-life/hook-ups-break-ups/adam-levines-former-yoga-instructor-comes-forward-with-explosive-claims/news-story/0e0695b4a0fa6258fec5534b2d143b82
Sad reason star’s moving family to Australia,https://www.news.com.au/entertainment/celebrity-life/peter-andre-reveals-hes-moving-his-family-to-australia/news-story/3ea803bca3072dda241d7eea1e605497
Star Wars: ‘We were meant to be different’,https://www.news.com.au/entertainment/tv/streaming/diego-luna-says-andor-was-meant-to-be-different-to-other-star-wars-titles/news-story/5f57b48e839dad9a3a7c9aef7dc13341
Man arrested over TV star’s death,https://www.news.com.au/entertainment/tv/reality-tv/man-arrested-over-helicopter-crash-which-killed-outback-wrangler-star/news-story/87aaf0dbdcf6c1d8fffae2be76d2afa5
TV host mocks Nine’s Queen funeral gaffe,https://www.news.com.au/entertainment/celebrity-life/royals/world-reacts-to-gaffe-during-australian-coverage-of-queens-funeral/news-story/b79fb56a99023753a696e49fb8d61d83
Why Markle is at centre of Sunrise lawsuit,https://www.news.com.au/national/nsw-act/courts-law/why-meghan-markle-is-at-centre-of-sunrise-lawsuit/news-story/b0c1d850023ac7abd93d2921f4ad666f
Harry’s secret phone calls with Queen,https://www.news.com.au/entertainment/celebrity-life/royals/prince-harrys-secret-phone-calls-to-queen-reveal-sad-truth/news-story/9b5538d8dc1498ea0619ab7d714bc3cc
One female royal who’ll never accept Meghan,https://www.news.com.au/entertainment/celebrity-life/royals/one-female-royal-wholl-never-be-friends-with-meghan/news-story/f9caef7c73819538ccc3cf2efee43f7c
’Forever tainted’: Nine hosts blast AFL drama,https://www.news.com.au/sport/afl/channel-9-presenters-tony-jones-and-caroline-wilson-respond-to-hawthorn-hawks-allegations/news-story/0560ed61434ec9fd84951b0cde8666d4
‘Cherished’ Play School presenter dies,https://www.news.com.au/entertainment/celebrity-life/celebrity-deaths/iconic-play-school-presenter-john-hamblin-dies-aged-87/news-story/936417988a319ce15d04c8d0982978b7
‘Tough period’: Star couple on the rocks,https://www.news.com.au/sport/nrl/braith-anasta-admits-relationship-with-rachael-lee-going-through-a-tough-period/news-story/6a6d040179f6a8305a90405e92453ffd
‘Stop killing blackfellas’: Strong AFL plea,https://www.news.com.au/sport/afl/stop-killing-blackfellas-former-elite-cricketers-passionate-plea-after-hawthorn-hawks-allegations/news-story/c577179f472820b6933dd75aa230b2f8
ScoMo’s ‘committee of one’ exposed,https://www.news.com.au/national/politics/scomos-committee-of-one-held-hundreds-of-secret-meetings/news-story/e320843daa12a7050613f4c5d765dfba
Chilling footage of Putin’s flesh-melting bomb,https://www.news.com.au/technology/innovation/military/chilling-footage-of-russian-militarys-fleshmelting-thermite-bomb/news-story/7bf2f4715b56efb2243ff1091b493f20
Putin announces huge escalation of war,https://www.news.com.au/world/europe/vladimir-putin-says-lines-have-been-crossed-by-the-west-in-latest-speech/news-story/7241fac8e2545debfa6c2ef20d232d37
Fears as new Covid variant spreads,https://www.news.com.au/world/scientists-on-alert-as-new-covid-strain-tears-through-multiple-countries/news-story/d7975efbc4350976900a6ea0c834d9be
Emma Watson trolled as quote resurfaces,https://www.news.com.au/entertainment/celebrity-life/celebrity-photos/faux-feminist-terfs-attack-emma-watson/news-story/705cb992d918f04fa21a5860ad9f0bc2
Scary ‘supervolcano’ on Australia’s doorstep,https://www.news.com.au/technology/environment/scientists-raise-alert-level-for-first-time-after-700-earthquakes-detected-in-new-zealand/news-story/1c73114c232464042c32ed5fcc85cedd
Australia’s biggest builders revealed,https://www.realestate.com.au/news/hia-housing-100-australias-biggest-builders-revealed-with-metricon-taking-top-spot-for-seventh-straight-year/?rsf=syn:news:nca:news:spa:strap
See how popular your suburb is with buyers,https://www.realestate.com.au/news/the-most-popular-suburbs-for-serious-homebuyers-revealed-and-how-your-suburb-ranks/?rsf=syn:news:nca:rea:news-strap
Investor names black-listed suburbs to avoid,https://www.realestate.com.au/news/investors-three-best-and-worst-postpandemic-brisbane-suburbs/?rsf=syn:news:nca:news:spa:strap
Woman compared to centipede for long torso,https://www.news.com.au/lifestyle/real-life/news-life/woman-with-long-torso-compared-to-worm-aliens-from-men-in-black/news-story/e7a5dfafc5b3fea22447646bd64b0f8a
Dentist blasts viral TikTok hacks,https://www.news.com.au/lifestyle/beauty/face-body/dental-surgeon-shuts-down-viral-teeth-whitening-and-straightening-hacks/news-story/79e17ee76cbb50bc40cc7e84ef07c611
Fakeaway meal Aussies are loving,https://www.news.com.au/lifestyle/food/eat/mouthwatering-fakeaway-meal-aussies-are-loving/news-story/105559f88c45a1bd787d16eb0385da64
Cult fast food chain to open in Australia,https://www.news.com.au/lifestyle/food/restaurants-bars/us-cult-fast-food-chain-wendys-to-launch-in-australia/news-story/a28b10ea5c61cc8cc86504a71cbf7f61
Dad snared by savage revenge texts,https://www.news.com.au/lifestyle/relationships/dating/woman-who-got-revenge-after-she-was-fatshamed-divides-internet/news-story/bca869dabce999919258afd844b66d7e
Aussie jobs with big pay rises,https://www.seek.com.au/career-advice/article/jobs-where-salaries-are-on-the-rise?tracking=DAC-NAS-NCS_2020-29247&utm_campaign=NCS_2020&utm_source=Newcorp&utm_medium=Display&utm_content=Vis_CA_AO_ST
‘My creepy BIL barges in on me in the bathroom’,https://www.kidspot.com.au/news/my-creepy-brotherinlaw-keeps-barging-in-on-me-when-im-in-the-bathroom/news-story/db4a0c418fd1c2a2f9e674e1b81349dd
‘Sold out’ $45 bag I’m ‘wearing 24/7’,https://www.news.com.au/best-of/home/best-tiktok-products/news-story/fad34fbcb0d672eda70ccb4dc3ab69c2
Woman stunned by airline’s unlikely gesture,https://www.news.com.au/travel/travel-advice/flights/airline-cancels-flight-leaving-glasgow-couple-with-an-amazing-surprise/news-story/0e8f197629cfba7361cef5e46c12ca6b
Woman forced into ‘humiliating’ act on flight,https://www.news.com.au/travel/travel-updates/travel-stories/paralysed-woman-reveals-degrading-flight-experience/news-story/6807cb481ebbdf91c0783682c6a13dec
Travellers urged to brace for holiday delays,https://www.news.com.au/travel/not-out-of-the-woods-travellers-urged-to-brace-for-airport-delays/news-story/714b21ab7ba321c577eedb794fe212ea
Strange way to make plane food taste better,https://www.news.com.au/travel/travel-ideas/food-drink/strange-way-to-make-plane-food-taste-better/news-story/3cbb5f6dda5c6e4dbc6dc289e8abf23e
Leading Aussie filmmaker dies in plane crash,https://www.news.com.au/travel/travel-updates/tragic-end-to-search-for-missing-pilot-after-plane-wreckage-found/news-story/b585679521883d442fea600aaaf45e54
Hugh Hefner’s ‘gross’ sex tool revealed,https://www.news.com.au/entertainment/celebrity-life/holly-madison-reveals-hugh-hefners-disturbing-sex-act/news-story/151886dec4f8e44321722342ea249c47
Queen’s moving admission days before death,https://www.news.com.au/entertainment/celebrity-life/royals/the-queens-moving-private-admission-days-before-death/news-story/156db9317857755513ed1074887af7e4
King’s ‘love child’ wants to meet Harry,https://www.news.com.au/entertainment/celebrity-life/royals/kings-alleged-love-child-simon-dorantedays-next-move/news-story/fed3efe1502436667e7a20513155391f
‘I have cheated’: Star’s interview resurfaces,https://www.news.com.au/entertainment/celebrity-life/hook-ups-break-ups/adam-levine-admitted-to-cheating-in-resurfaced-interview/news-story/53d64bef6b1d042c4e5bdfdb66b94940
Jackass star reveals wild boob job plans,https://www.news.com.au/entertainment/celebrity-life/jackass-star-steveo-reveals-plans-for-boob-job-penis-tattoo/news-story/83d55c4700000a4110a39167438ddefb
What is that?! Crazy find on beach,https://www.news.com.au/technology/science/animals/woman-finds-amazing-rare-transparent-fish-on-tasmanian-beach/news-story/1cde1daa66fcc94149b5c1fc1e1fedd9
Eerie detail in mass whale stranding,https://www.news.com.au/technology/science/animals/whales-found-dying-off-tasmania-coast-two-years-since-last-mass-death/news-story/31d236416dd88b568a39ad37e6a7205e
Reason ‘angry’ residents feel like ‘prisoners’,https://www.news.com.au/technology/gadgets/reason-angry-logan-residents-feel-like-prisoners/news-story/fb35683c3d01dd6d27b7cef7b23b3fb9
Grim forecast for Aussie public holiday,https://www.news.com.au/technology/environment/sydney-brisbane-brace-for-wet-public-holiday/news-story/74d85483463bd020d4325228be057b21
Push for Aus to follow radical Kiwi road rule,https://www.news.com.au/technology/motoring/on-the-road/call-for-big-change-to-pplate-driving-rules-in-australia/news-story/418127063fa0be26a25606db19b57400
‘Break your heart’: Aussie loses $267m,https://www.news.com.au/finance/money/wealth/australian-founder-of-crypto-startup-wyre-loses-267m-fortune/news-story/af5e92c0754d3147f52794029a33c8a8
Huge blow to free train ride plan,https://www.news.com.au/finance/business/travel/rtbu-hopes-to-begin-shutting-down-opal-machines-by-midoctober/news-story/4e74ea0381eeb12d6654bf01772cdbde
‘Like thieves’: Fury over Woolies’ checkout,https://www.news.com.au/finance/business/retail/calls-to-boycott-woolies-over-controversial-new-artificial-intelligence-technology/news-story/e8829c47a157ecce18843275832a0ecf
Sad $400 rental difference across Australia,https://www.news.com.au/finance/markets/australian-markets/viral-tiktok-compares-what-400-rentals-look-like-around-australia/news-story/53998cc2877312f870be0bdd5a8473cd
How much you need to be ‘rich’ in Australia,https://www.news.com.au/finance/money/wealth/australians-the-richest-in-the-world-with-4360-worth-more-than-50m/news-story/4ceaae73f1dd25a7251146ed7b2cd87b
Cam Smith cops ‘sad and disappointing’ ban,https://www.news.com.au/sport/golf/presidents-cup-preview-cam-smith-ineligible-to-play-in-sad-and-disappointing-reality/news-story/5f80f7085255d4a1ec7113273c66f2b3
Aussie tennis star’s worst fears confirmed,https://www.news.com.au/sport/tennis/what-the-f-happened-aussie-daria-saville-in-disbelief-after-scary-injury-scenes/news-story/b942b5ee314e41576b70a24a95c04a2b
Hollywood actor’s big win under secret name,https://www.news.com.au/sport/ufc/hollywood-actor-tom-hardy-wins-another-jiujistu-tournament-after-secretly-entering/news-story/7ffddcd005287ebb14c7c780bcc64ea3
Coach hits out at major AFL report,https://www.news.com.au/sport/afl/shocked-alasdair-clarkson-responds-to-hawthorn-hawks-allegations/news-story/ddec79869add34252136dd83e63d1428
‘Phenomenal’: Huge Aussie gamble pays off,https://www.news.com.au/sport/cricket/phenomenal-australian-prodigy-cameron-green-plunders-maiden-t20i-halfcentury/news-story/5a46a0b29b33a38c24d351e7ef8562ee
Huge decision made over AFL bombshell,https://www.news.com.au/sport/afl/afl-coach-alastair-clarkson-must-go-urged-to-stand-aside/news-story/1ebea228ea4104344c79dc9d4f58aee9
Hawks skipper reacts to abortion bombshell,https://www.news.com.au/sport/afl/hawthorn/damning-racism-report-finds-shock-allegations-against-hawthorn/news-story/e442e9865cb0dd74747c736a5478ccba
Lions coach steps down amid investigation,https://www.news.com.au/sport/afl/brisbane-coach-chris-fagan-takes-leave-of-absence-amid-hawthorn-allegations/news-story/3835aa4ba42fc7c5da91343abed1dc37
‘Hair’s less frizzy’: Top pillowcase wows,https://www.news.com.au/best-of/home/canningvale-sale/news-story/1441d2485151d9af0996d1508a7ca05a
Handy feature of ‘best mattress I’ve owned’,https://www.news.com.au/best-of/home/best-mattress/news-story/c576fa02eb03fa17f0851fd4a55ee146
Top-rated laptop bags for hybrid workers,https://www.news.com.au/best-of/electronics/best-laptop-bag/news-story/a8e291f07c40719a9f44da8cf4eb8d2b
Take further 20% off THE ICONIC’s mid-season sale,https://www.news.com.au/best-of/sales-and-deals/best-deals-for-the-iconic/news-story/56e74e33c5ac0bc5305bdfce5e76d565
‘Sold out’ $45 bag I’m ‘wearing 24/7’,https://www.news.com.au/best-of/home/best-tiktok-products/news-story/fad34fbcb0d672eda70ccb4dc3ab69c2
'Regrettable': Adam Levine cheating scandal explodes,https://www.news.com.au/web-stories/free/news-com-au/adam-levine-accused-of-secret-affair-with-models
New law to get Boomers to sell their homes,https://www.news.com.au/web-stories/free/news-com-au/real-estate-new-law-to-get-boomers-to-sell-their-homes
Fans accuse Harry of 'disrespectful' act,https://www.news.com.au/web-stories/free/news-com-au/queens-funeral-royal-watchers-slam-harrys-disrespectful-act
'Return it': War erupts over Queen’s $591m jewel,https://www.news.com.au/web-stories/free/news-com-au/queens-funeral-war-erupts-over-royal-591m-jewel
Truth about Princess Kate's secret double life,https://www.news.com.au/web-stories/free/news-com-au/the-truth-about-kate-middletons-secret-double-life
'Dead money': Aussies refusing to buy house,https://www.news.com.au/web-stories/free/news-com-au/millennials-are-ditching-buying-a-house-and-investing-in-shares-instead
Emotional scenes as world farewells Queen,https://www.news.com.au/web-stories/free/news-com-au/queens-funeral-world-bids-final-farewell-to-elizabeth-ii
Justin Bieber reveals 'horrible' diagnosis,https://www.news.com.au/web-stories/free/news-com-au/what-is-ramsay-hunt-syndrome-justin-bieber-reveals-diagnosis
Who will inherit Queen's most precious tiaras,https://www.news.com.au/web-stories/free/news-com-au/who-will-inherit-queen-elizabeths-most-famous-tiaras
'Unrelenting': Country on the brink of disaster,https://www.news.com.au/web-stories/free/news-com-au/climate-change-pakistan-on-the-brink-of-disaster
Meghan blindsided by kids' new titles,https://www.news.com.au/web-stories/free/news-com-au/queens-death-meghan-blindsided-by-archie-and-lilibets-new-royal-titles
'Incredible': New show everyone is obsessed with,https://www.news.com.au/web-stories/free/news-com-au/jeremy-allen-white-reacts-to-the-bear-thirst-obsession
Meghan request that delayed Fab Four walk,https://www.news.com.au/web-stories/free/news-com-au/queen-death-meghan-markle-request-that-delayed-fab-four-walk
Best looks from Emmy Awards red carpet,https://www.news.com.au/web-stories/free/news-com-au/2022-emmy-awards-fashion-zendaya-leads-best-looks-on-red-carpet
Surprise reaction to Meghan's 'lovely' act,https://www.news.com.au/web-stories/free/news-com-au/queen-death-meghan-reunites-with-harry-will-kate
Fans call out William's behaviour towards Kate,https://www.news.com.au/web-stories/free/news-com-au/queens-death-fans-call-out-prince-williams-behaviour-towards-kate
Queen Elizabeth’s most playful moments,https://www.news.com.au/web-stories/free/news-com-au/good-evening-mr-bond-queen-elizabeths-most-playful-moments
'Much-loved': Harry and William’s touching tribute,https://www.news.com.au/web-stories/free/news-com-au/prince-harry-and-prince-williams-heartwarming-tribute-to-queen
'Finally': Apple reveals huge iPhone change,https://www.news.com.au/web-stories/free/news-com-au/latest-iphone-14-released-by-apple-comes-with-a-hefty-price
Huge change coming to Aussie cash,https://www.news.com.au/web-stories/free/news-com-au/queen-elizabeth-death-what-happens-to-australian-money
The Queen's three most defining moments,https://www.news.com.au/web-stories/free/news-com-au/royals-queen-elizabeth-iis-most-defining-moments
Queen Elizabeth’s iconic life in pictures,https://www.news.com.au/web-stories/free/news-com-au/queen-elizabeth-ii-dies-at-96-a-royal-life-in-pictures
Sexuality type we don’t talk about,https://www.news.com.au/web-stories/free/news-com-au/asexuality-sexuality-type-we-dont-talk-about-often
Woman who identifies as a wolf cops backlash,https://www.news.com.au/web-stories/free/news-com-au/woman-who-identifies-as-wolf-opens-up-about-her-unique-life
‘Rubbish’: Real reason Tracy Grimshaw quit,https://www.news.com.au/web-stories/free/news-com-au/tracy-grimshaw-reveals-why-shes-leaving-a-current-affair
'Not the truth': Film's wild drama explained,https://www.news.com.au/web-stories/free/news-com-au/dont-worry-darling-drama-harry-styles-appears-to-spit-on-chris-pine
Rare weather event 'SAM' to smash Australia,https://www.news.com.au/web-stories/free/news-com-au/what-is-sam-rare-weather-phenomenon-to-smash-australia
Best Nintendo 64 games of all time,https://www.news.com.au/web-stories/free/news-com-au/best-nintendo-64-games-of-all-time
New dating trend as 'hook-up' culture dies out,https://www.news.com.au/web-stories/free/news-com-au/is-hook-up-culture-dead-new-gen-z-relationships-say-so
Surprise Aussie city wins world’s ‘coolest’ street,https://www.news.com.au/web-stories/free/news-com-au/travel-melbourne-makes-time-outs-coolest-streets-ranking
What really killed Princess Diana,https://www.news.com.au/web-stories/free/news-com-au/what-really-killed-princess-diana
Wild new Taylor Swift conspiracy theory,https://www.news.com.au/web-stories/free/news-com-au/midnights-taylor-swift-fans-reveal-wild-kanye-kardashian-theory
'Lyn is dead': Bombshell verdict in murder trial,https://www.news.com.au/web-stories/free/news-com-au/chris-dawson-trial-ex-teacher-guilty-of-murdering-wife-lynette
'Designer vagina’ surgery is booming,https://www.news.com.au/web-stories/free/news-com-au/why-designer-vagina-surgery-is-booming
The Aussie suburbs with ‘ridiculous’ rent hikes,https://www.news.com.au/web-stories/free/news-com-au/the-ridiculous-rent-hikes-in-aussie-suburbs
Four reasons men get paid considerably more,https://www.news.com.au/web-stories/free/news-com-au/men-get-paid-considerably-more-for-the-same-job-data-reveals
'This is it': Why you won't see actor anymore,https://www.news.com.au/web-stories/free/news-com-au/steve-martin-says-he-will-no-longer-seek-acting-work
Scary trap in new 'quiet quitting' trend,https://www.news.com.au/web-stories/free/news-com-au/scary-trap-in-quiet-quitting-trend-in-aussie-offices
Dangerous sex act on the rise,https://www.news.com.au/web-stories/free/news-com-au/sex-and-relationships-scary-condom-trend-on-the-rise
Why women everywhere hate this man,https://www.news.com.au/web-stories/free/news-com-au/andrew-tate-warning-over-viral-tiktok-rape-culture-videos
'Rare event': Aussies brace for six months of rain,https://www.news.com.au/web-stories/free/news-com-au/weather-aussies-brace-for-six-months-of-rain
Aussies saving a motza with 'cash stuffing’ trend,https://www.news.com.au/web-stories/free/news-com-au/what-is-cash-stuffing-millennials-save-thousands-with-money-hack
'Missing' Aussie actor found in LA jail after date,https://www.news.com.au/web-stories/free/news-com-au/australian-actor-laura-mcculloch-found-in-jail-after-online-date
‘Speechless’: Chess cheating scandal erupts,https://www.news.com.au/sport/more-sports/magnus-carlsen-resigns-after-one-move-against-hans-niemann/news-story/c9e4c9a740d8d3bb9c5eafa3d2a7bf7a
15 famous sayings with weird origins,https://www.news.com.au/national/15-famous-sayings-with-weird-origins/audio/cd048662ffa2d0fa5170496dbe924698
