title,url
‘FASTER AND EASIER’: How to make $1.4m more investing the same cash,https://www.news.com.au/finance/money/investing/property-vs-shares-which-offers-the-best-investment-return/news-story/e73afb7066755414914d2489d5c002de
Prison shrink’s sordid texts with inmates,https://www.news.com.au/lifestyle/real-life/news-life/prison-psychologist-sarahjane-lodingtons-texts-with-inmates/news-story/657ae52941e24199407a466b38d9445b
Deadpool star slams ‘mean’ Ryan Reynolds,https://www.news.com.au/entertainment/celebrity-life/deadpool-actor-tj-miller-reveals-mean-onset-encounter-with-ryan-reynolds/news-story/14eb62a430b5f8b02fe147af1e2c8f3f
F1 world explodes over ‘unacceptable’ farce,https://www.news.com.au/sport/motorsport/formula-one/japanese-grand-prix-live-max-verstappen-pole-after-reprimand/live-coverage/7050825f485185d4e3c0842e6d7fef42
Serial killer dies in agony in jail,https://www.news.com.au/world/europe/killer-dies-in-agony-after-months-at-deaths-door/news-story/4ec4bfdb0557633507e2a65da82cd7d9
Man dies on Sydney Harbour,https://www.news.com.au/national/nsw-act/news/man-dies-after-falling-from-boat-on-sydney-harbour/news-story/7ea38ca2b96c00de82b1a00b99295e42
Parents outraged as kids terror-struck,https://www.news.com.au/lifestyle/parenting/lil-blessings-daycare-in-hamilton-under-investigation-for-halloween-mask-video/news-story/9d0a7835577ce1033b7a09d39699c0c7
Weird reason woman lost six-figure job,https://www.news.com.au/finance/work/at-work/sisters-in-law-shocking-reason-victorian-woman-lost-job/news-story/0ff551e3f34d3e57b4b152bf744aa0d4
Champ sends Holden out a winner in classic,https://www.news.com.au/sport/motorsport/v8-supercars/bathurst-1000-live-updates-news-from-supercars-great-race/live-coverage/555cefe18bd43ff2a5003ee2d4993e12
Husband’s confession after wife ‘snaps’,https://www.news.com.au/lifestyle/relationships/marriage/my-wife-told-me-that-im-not-pulling-my-weight-and-im-shocked/news-story/cf2c2e3c57a570944ba52194844cb495
‘Danger day’: Another rainbomb to hit,https://www.news.com.au/technology/environment/forecasters-predict-another-deluge-of-rain-for-east-coast-in-week-ahead/news-story/54cf2b0bcd4562870a0d6943b4c6bbc5
‘Amazing’ Fifty Shades of Grey sex toy,https://www.news.com.au/best-of/beauty/best-selling-sex-toys/news-story/ddd69e7aabe604bbf2d33ec901b1fd95
Rising star enhances his Test credentials with defiant knock,https://www.news.com.au/sport/cricket/will-sutherland-scored-a-breakthrough-hundred-as-a-dumped-opener-sent-national-selectors-a-reminder/news-story/90f0a7649157e65f3932b57f2a7d95b8
"North Korea fires more missiles, seventh launch in two weeks",https://www.news.com.au/breaking-news/north-korea-fires-more-missiles-eight-in-two-weeks/news-story/bee80fad35380854b9d7ed6d88590656
Man dies on Sydney Harbour,https://www.news.com.au/national/nsw-act/news/man-dies-after-falling-from-boat-on-sydney-harbour/news-story/7ea38ca2b96c00de82b1a00b99295e42
‘Simply amazing’ detail in beauty advent calendar,https://www.news.com.au/best-of/gifts/best-beauty-makeup-advent-calendars/news-story/72be262a79047da998f6c49f740c7673
Eddie’s costly child support to Spice Girl,https://www.news.com.au/entertainment/celebrity-life/hook-ups-break-ups/eddie-murphy-ordered-to-pay-54000-monthly-child-support-to-mel-b/news-story/7aa3046f70bca39232f5c010f82bd0ee
Star responds to man’s robbery confession,https://www.news.com.au/entertainment/celebrity-life/celebrity-photos/paris-hilton-responds-to-mans-tiktok-robbery-confession/news-story/8ac293bbd1adcd7c133eb5cce6201569
Rapper reveals normal career change,https://www.news.com.au/entertainment/celebrity-life/kid-cudi-teases-retirement-from-rapping-reveals-entirely-new-career-ambition/news-story/90cbda7d3e3ec88e3b4777cf427ecdd0
Kaley Cuoco’s pick-up line to co-star,https://www.news.com.au/entertainment/celebrity-life/hook-ups-break-ups/kaley-cuoco-and-johnny-galecki-reveal-how-they-got-together-onset-of-big-bang-theory/news-story/c72435167397f5c3e571fd5f643f3dc1
Marvel star says filming is ‘embarrassing’,https://www.news.com.au/entertainment/movies/elizabeth-olsen-says-filming-marvel-movies-is-painful-and-embarrassing/news-story/ccaa3dfc6677250cf6e09fbeb745c34d
Graph proves fact men don’t want to admit,https://www.news.com.au/lifestyle/real-life/news-life/study-shows-women-do-more-chores-than-men-sparking-fury/news-story/0d5a919f7abcbe69803764f89a203a2f
Climate protesters glue themselves to Picasso,https://www.news.com.au/national/victoria/crime/climate-protesters-arrested-after-gluing-themselves-to-picasso-painting-at-melbourne-gallery/news-story/788c673920daf3ae8a25f81899e969f3
Star’s ‘nastiest dunk ever seen’ goes viral,https://www.news.com.au/sport/basketball/sydney-kings-xavier-cooks-throws-down-nastiest-dunk-ever-seen/news-story/ba009886b9e14985072929d775e7b97b
‘Beaten down’: Terrible news for Melburnians,https://www.news.com.au/travel/travel-ideas/food-drink/beaten-down-and-broken-more-iconic-melbourne-venues-to-close/news-story/a21e325bb1a8b1e3b45db6345eb8f7f3
Steve Smith numbers Australia can’t ignore,https://www.news.com.au/sport/cricket/selectors-have-got-a-headache-steve-smith-at-risk-of-becoming-t20-world-cup-spectator/news-story/d108a93a1103537ee022f49461c93f9b
Soulless act moments after tragedy,https://www.news.com.au/world/north-america/disturbing-thief-caught-pickpocketing-dead-body/news-story/83ec41f0ac987deab6c7fceae65e6b9c
Schumacher embroiled in fiery car crash,https://www.news.com.au/sport/motorsport/michael-schumachers-nephew-requires-medical-attention-after-fiery-car-crash/news-story/1ed5406f11f6026fb95d6623b1a8898b
Doubt cast on Meghan’s most shocking claim,https://www.news.com.au/entertainment/celebrity-life/royals/meghan-markles-most-shocking-claim-exposes-worrying-royal-trend/news-story/c75137d4bd3a3a380887fe45b7f58b8f
Inside ‘world’s sexiest woman’s’ empire,https://www.news.com.au/sport/sports-life/inside-look-at-paige-spiranacs-multimilliondollar-empire/news-story/cc08461b5ddec0255075a0993614ae73
British star’s stunning body transformation,https://www.news.com.au/sport/sports-life/british-bodybuilder-martyn-ford-piles-on-muscle-in-stunning-body-transformation/news-story/4cccc1b3b083fa0e34c648932729a9f8
Bidder wins $1.2m beach home with $500 bid,https://www.realestate.com.au/news/you-can-have-it-brisbane-auction-bidder-pulls-out-after-500-bid-increase/?rsf=syn:news:nca:news:spa:strap
Vendors score $3.4m profit on luxury penthouse,https://www.realestate.com.au/news/stonecutters-pyrmont-penthouse-sells-for-62-million-after-18-months-on-the-market/?rsf=syn:news:nca:news:spa:strap
20-year-old sparky loses out on abandoned home,https://www.realestate.com.au/news/1970s-house-unoccupied-for-40-years-gets-new-owners/?rsf=syn:news:nca:news:spa:strap
Diner calls out infuriating restaurant ‘trend’,https://www.news.com.au/lifestyle/food/eat/diner-calls-out-infuriating-restaurant-trend/news-story/882b38fe0f935079273fdb9bbd66a8b7
Surprising cost to rent out Bondi Beach,https://www.news.com.au/lifestyle/food/eat/bondi-beach-rented-out-for-eyewatering-cost-for-allwhite-dinner-party/news-story/95aeae81ece2b166e42172dcf971ed11
Lara Worthington rocks revealing miniskirt,https://www.news.com.au/lifestyle/fitness/inspiration/lara-worthington-i-feel-better-now-in-my-body-than-ever/news-story/be0265dff4a212ab369960c9a5baf568
Influencer torn apart over simple act,https://www.news.com.au/lifestyle/food/eat/influencer-criticised-for-simple-act-in-his-hugely-popular-video/news-story/e7fd552fc3cc81326c02f23526807e49
Mum shocks with wild parenting rule,https://www.news.com.au/lifestyle/parenting/kids/mum-reveals-5-things-she-lets-kids-do-others-may-not-agree-with/news-story/95bf57d2dd3603b41f76c54ebb593c9a
Jobs that want you without a degree,https://www.seek.com.au/career-advice/article/in-demand-jobs-you-dont-need-a-degree-for?tracking=DAC-NAS-NCS_2020-30126&utm_campaign=NCS_2020&utm_source=Newcorp&utm_medium=Display&utm_content=Vis_CA_AO_FTJ
Best hiding spots for your Christmas stash,https://www.kidspot.com.au/parenting/primary-school/hiding-spots-for-your-christmas-stash-that-even-a-bloodhound-couldnt-find/news-story/04d708121cf1c619bf1433366a301cc3
Jules sparks frenzy over Cotton On dress,https://www.news.com.au/best-of/fashion/best-summer-dresses/news-story/7ae467b9f3e3d9883fa1356eb710cb27
’Mystery’ feature hidden in Aussie corner,https://www.news.com.au/travel/travel-ideas/best-of-travel/hidden-corner-of-nsw-that-rivals-the-glorious-sands-of-byron-bay/news-story/46c93208686ef973cc0bf25076a2d2e9
$24 proves America has changed forever,https://www.news.com.au/travel/travel-ideas/food-drink/i-bought-a-24-smoothie-in-nyc/news-story/26ced7fe71fdc317a88415280bfb1d30
Woman’s ‘nude’ outfit stuns at airport,https://www.news.com.au/travel/travel-advice/airports/traveller-turns-heads-at-airport-over-nude-pants/news-story/24f0f9c7891acf044be7c31624d14d00
’Deranged’: Tourist’s wild act in Vatican,https://www.news.com.au/travel/travel-updates/incidents/us-tourist-smashes-roman-busts-in-vatican-after-denied-pope-audience/news-story/631e437ad502e72df39d9ab5885d9e45
Never sleep at this time on a plane,https://www.news.com.au/travel/travel-advice/tips-tricks/why-you-shouldnt-sleep-for-the-first-two-hours-on-a-flight-and-never-skip-a-meal/news-story/2c866b706dde7d9bc85eff5e05decc16
Kanye trashes ‘Hailey nose job’ Bieber,https://www.news.com.au/entertainment/celebrity-life/justin-bieber-reportedly-cuts-ties-with-kanye-west-over-hailey-spray/news-story/87e63fe6fd527f98dff9a4201d919457
Cruise’s unbelievable movie pitch revealed,https://www.news.com.au/entertainment/movies/tom-cruise-set-to-become-first-actor-to-shoot-movie-in-outer-space/news-story/22237751b5cf8052647271147123a93b
‘You’re not a princess’: Piers blasts Meghan,https://www.news.com.au/entertainment/celebrity-life/royals/youre-not-a-princess-piers-morgan-blasts-meghan-markle/news-story/a92045e93403d465d735da325ae95ff0
Star addresses biggest Hollywood rumour,https://www.news.com.au/entertainment/celebrity-life/eva-mendes-addresses-speculation-shes-quit-her-hollywood-career-to-be-a-mum/news-story/274513c5585caf7a98d9b5106857b36d
Who’s your fave Aussie star?,https://www.news.com.au/entertainment/awards/2022-aacta-audience-choice-awards-voting-is-now-open/news-story/78a1f2919cb93467955687c02cc0e8dd
‘Don’t be deceived’: Rainbomb will linger,https://www.news.com.au/technology/environment/adf-called-in-as-locals-brace-for-more-wild-weather-and-flooding/news-story/c23080d5224283c23f52715ce1cb82e5
Mum ‘covered in bandages’ as kids killed,https://www.news.com.au/technology/science/animals/tennessee-pit-bull-attack-two-toddlers-mauled-to-death-by-familys-dogs/news-story/fc87fe545aa002dc3abceb01cb4dbc0c
Rugged new ute arrives in Australia,https://www.news.com.au/technology/motoring/new-cars/2022-mazda-bt50-sp-new-car-review/news-story/51687ef93e1752c34928814b0eff78fc
‘Selfish’ Aussie parking act that has to stop,https://www.news.com.au/technology/motoring/on-the-road/illegal-parking-is-a-scourge-of-australian-suburbs-and-it-has-to-stop/news-story/50dfb4273294f2ac6574d5dd9de49be3
Heartbreaking photos of kids mauled to death,https://www.news.com.au/technology/science/animals/heartbreaking-photos-emerge-of-girl-and-her-baby-brother-who-were-killed-by-familys-pit-bulls/news-story/ad794b24d0d1d4e54a26310bc95d6a80
Huge hint that tax cuts won’t be scrapped,https://www.news.com.au/national/politics/albanese-government-hasnt-changed-position-on-stage-three-tax-cuts/news-story/645299fbe59c6e7682e53d9e6f3ab5be
Staggering payday for public servants,https://www.news.com.au/finance/work/at-work/million-dollar-payday-for-public-servants/news-story/c435f75068495b63483f66727acb7811
Disaster about to smash Aussie economy,https://www.news.com.au/finance/economy/australian-economy/worrying-reason-inflation-and-interest-rates-could-just-keep-climbing/news-story/b9dacbf510069dc5c0e8ec54fed10f0e
‘Poisonous’: Huge problem crippling China,https://www.news.com.au/finance/economy/world-economy/big-tech-companies-are-moving-production-out-of-china-over-geostrategic-concerns/news-story/ce27ed75e2ba0617e90a9d5f75034450
Warning to Aussies about Christmas,https://www.news.com.au/finance/money/budgeting/huge-risk-christmas-spending-blowout-could-hurt-your-mortgage/news-story/625b01bb4bd5e6b438aaa007c71b8b96
"Star’s tears, heartbreak over crash ‘madness’",https://www.news.com.au/sport/motorsport/v8-supercars/star-driver-in-tears-heartbreak-over-crash-madness-at-bathurst/news-story/2572d370a81ca7af1b78dc7f1b113f70
Rafael Nadal celebrating amazing baby news,https://www.news.com.au/sport/tennis/rafael-nadal-is-celebrating-becoming-a-father-for-the-first-time/news-story/bcc3f338da1bfd7c05a5433888fc3dc4
‘Plummeted’: World reacts to Ricciardo bomb,https://www.news.com.au/sport/motorsport/formula-one/dealt-a-bad-hand-daniel-ricciardos-agent-spills-on-bombshell/news-story/e7b85df6b42e1c171ac107331290c667
‘Final straw’: Manly coach doomed long ago,https://www.news.com.au/sport/nrl/manly-made-decision-to-dump-hasler-months-ago-after-final-straw/news-story/fd6eae95e29c7d4baf42017278210391
NBA star walks away after punch video leak,https://www.news.com.au/sport/american-sports/nba/i-failed-as-a-man-nba-star-taking-leave-after-punch-video-leak/news-story/7f3f7e8346b7ecabb85da8f9f4e7491c
Ricciardo’s damning F1 reality laid bare,https://www.news.com.au/sport/motorsport/formula-one/stands-to-gain-nothing-daniel-ricciardo-reality-is-looking-bleak/news-story/31e40002978e0f0f347532cb2b6a0192
AFL great takes court action against Nine,https://www.news.com.au/sport/afl/afl-great-warren-tredrea-suing-channel-9-over-ban/news-story/3354feab62099f4c20fd966c444c9bea
‘Cannot believe it’: Johns blasts Kangaroos,https://www.news.com.au/sport/nrl/i-honestly-hate-it-matthew-johns-unimpressed-with-kangaroos-jersey-system/news-story/789d3633f89a12de22a920b912d53d9c
$81 off bestselling ASICS Gel-Kayano 29,https://www.news.com.au/best-of/sales-and-deals/best-deals-for-the-iconic/news-story/56e74e33c5ac0bc5305bdfce5e76d565
‘No more stiff neck’: Top pillow for side sleepers,https://www.news.com.au/best-of/home/best-pillow-for-side-sleepers/news-story/dba1b848a1288feab76d3b21e34f0af8
Spotted: $9 Havaianas for a limited time,https://www.news.com.au/best-of/sales-and-deals/ozsale-super-sale-deals/news-story/5cd0a978f7a47833f15436a07b3859f2
Apple’s latest AirPods spotted on sale,https://www.news.com.au/best-of/electronics/gadgets/best-apple-airpods-deals-australia/news-story/2455b71bdbf80c9aa667eb0472454906
Luxe Sheridan bath towels on sale for just $20,https://www.news.com.au/best-of/sales-and-deals/best-weekly-deals/news-story/f2e3292f923e682ff447423f9a6c6888
Dark warning for Aussie homeowners,https://www.news.com.au/web-stories/free/news-com-au/interest-rate-rise-australia-grim-warning-for-homeowners
Star signs most likely to be serial killers,https://www.news.com.au/web-stories/free/news-com-au/astrology-star-signs-most-likely-to-be-serial-killers
‘Disgusting’: Backlash to Kanye’s wild claim,https://www.news.com.au/web-stories/free/news-com-au/kanye-west-slammed-after-paris-fashion-week-stunt
Princess Mary pulled into ‘difficult’ royal row,https://www.news.com.au/web-stories/free/news-com-au/royal-family-princess-mary-pulled-into-difficult-row
Vegan protester making thousands,https://www.news.com.au/web-stories/free/news-com-au/tash-peterson-vegan-protester-and-onlyfans-stars-notorious-stunts
Shocking act disturbs Australian TV star,https://www.news.com.au/web-stories/free/news-com-au/australia-cup-nazi-salute-shocks-australian-tv-star-2
Mum’s ‘experiment’ turns into $3.7m idea,https://www.news.com.au/web-stories/free/news-com-au/melbourne-business-the-australian-natural-soap-company-makes-3-7m
Millions to go beyond ‘quiet quitting’,https://www.news.com.au/web-stories/free/news-com-au/quiet-quitting-millions-of-australians-to-leave-their-job
Shopping hack Aussie tourists don’t know about,https://www.news.com.au/web-stories/free/news-com-au/tourist-discount-aussies-dont-know-about
Aussie Netflix hit the world is obsessed with,https://www.news.com.au/web-stories/free/news-com-au/heartbreak-high-why-the-world-is-frothing-for-aussie-netflix-hit
Real reason you can't use your phone on plane,https://www.news.com.au/web-stories/free/news-com-au/experts-reveal-why-you-need-to-turn-off-your-phone-on-a-flight
Mystery surrounding sex act finally solved,https://www.news.com.au/web-stories/free/news-com-au/sex-and-relationships-is-squirting-actually-a-thing
'Staggering': Disturbing trend at Aussie brands,https://www.news.com.au/web-stories/free/news-com-au/jb-hi-fi-nick-scali-baby-bunting-disturbing-trend-at-aussie-brands
Queen's biggest wish before her death,https://www.news.com.au/web-stories/free/news-com-au/queen-elizabeths-biggest-wish-was-to-heal-harry-meghan-rift
'Chaos': Rain bomb to smash Australia,https://www.news.com.au/web-stories/free/news-com-au/sydney-weather-australia-smashed-by-rain-band
Proof Keanu Reeves may be the nicest guy on Earth,https://www.news.com.au/web-stories/free/news-com-au/keanu-reeves-may-be-the-nicest-guy-on-earth
Five signs your partner wants a divorce,https://www.news.com.au/web-stories/free/news-com-au/relationships-five-signs-your-partner-wants-a-divorce
Aussies jump on popular travel trend,https://www.news.com.au/web-stories/free/news-com-au/best-pet-friendly-holiday-homes-in-australia
'Regrettable': Adam Levine cheating scandal explodes,https://www.news.com.au/web-stories/free/news-com-au/adam-levine-accused-of-secret-affair-with-models
Truth about Princess Kate's secret double life,https://www.news.com.au/web-stories/free/news-com-au/the-truth-about-kate-middletons-secret-double-life
New law to get Boomers to sell their homes,https://www.news.com.au/web-stories/free/news-com-au/real-estate-new-law-to-get-boomers-to-sell-their-homes
Fans accuse Harry of 'disrespectful' act,https://www.news.com.au/web-stories/free/news-com-au/queens-funeral-royal-watchers-slam-harrys-disrespectful-act
'Return it': War erupts over Queen’s $591m jewel,https://www.news.com.au/web-stories/free/news-com-au/queens-funeral-war-erupts-over-royal-591m-jewel
Meghan blindsided by kids' new titles,https://www.news.com.au/web-stories/free/news-com-au/queens-death-meghan-blindsided-by-archie-and-lilibets-new-royal-titles
'Dead money': Aussies refusing to buy house,https://www.news.com.au/web-stories/free/news-com-au/millennials-are-ditching-buying-a-house-and-investing-in-shares-instead
Emotional scenes as world farewells Queen,https://www.news.com.au/web-stories/free/news-com-au/queens-funeral-world-bids-final-farewell-to-elizabeth-ii
Justin Bieber reveals 'horrible' diagnosis,https://www.news.com.au/web-stories/free/news-com-au/what-is-ramsay-hunt-syndrome-justin-bieber-reveals-diagnosis
Who will inherit Queen's most precious tiaras,https://www.news.com.au/web-stories/free/news-com-au/who-will-inherit-queen-elizabeths-most-famous-tiaras
'Unrelenting': Country on the brink of disaster,https://www.news.com.au/web-stories/free/news-com-au/climate-change-pakistan-on-the-brink-of-disaster
'Incredible': New show everyone is obsessed with,https://www.news.com.au/web-stories/free/news-com-au/jeremy-allen-white-reacts-to-the-bear-thirst-obsession
Meghan request that delayed Fab Four walk,https://www.news.com.au/web-stories/free/news-com-au/queen-death-meghan-markle-request-that-delayed-fab-four-walk
Best looks from Emmy Awards red carpet,https://www.news.com.au/web-stories/free/news-com-au/2022-emmy-awards-fashion-zendaya-leads-best-looks-on-red-carpet
Surprise reaction to Meghan's 'lovely' act,https://www.news.com.au/web-stories/free/news-com-au/queen-death-meghan-reunites-with-harry-will-kate
Fans call out William's behaviour towards Kate,https://www.news.com.au/web-stories/free/news-com-au/queens-death-fans-call-out-prince-williams-behaviour-towards-kate
Queen Elizabeth’s most playful moments,https://www.news.com.au/web-stories/free/news-com-au/good-evening-mr-bond-queen-elizabeths-most-playful-moments
'Much-loved': Harry and William’s touching tribute,https://www.news.com.au/web-stories/free/news-com-au/prince-harry-and-prince-williams-heartwarming-tribute-to-queen
'Finally': Apple reveals huge iPhone change,https://www.news.com.au/web-stories/free/news-com-au/latest-iphone-14-released-by-apple-comes-with-a-hefty-price
Huge change coming to Aussie cash,https://www.news.com.au/web-stories/free/news-com-au/queen-elizabeth-death-what-happens-to-australian-money
The Queen's three most defining moments,https://www.news.com.au/web-stories/free/news-com-au/royals-queen-elizabeth-iis-most-defining-moments
Queen Elizabeth’s iconic life in pictures,https://www.news.com.au/web-stories/free/news-com-au/queen-elizabeth-ii-dies-at-96-a-royal-life-in-pictures
Sexuality type we don’t talk about,https://www.news.com.au/web-stories/free/news-com-au/asexuality-sexuality-type-we-dont-talk-about-often
Woman who identifies as a wolf cops backlash,https://www.news.com.au/web-stories/free/news-com-au/woman-who-identifies-as-wolf-opens-up-about-her-unique-life
‘Rubbish’: Real reason Tracy Grimshaw quit,https://www.news.com.au/web-stories/free/news-com-au/tracy-grimshaw-reveals-why-shes-leaving-a-current-affair
'Not the truth': Film's wild drama explained,https://www.news.com.au/web-stories/free/news-com-au/dont-worry-darling-drama-harry-styles-appears-to-spit-on-chris-pine
Rare weather event 'SAM' to smash Australia,https://www.news.com.au/web-stories/free/news-com-au/what-is-sam-rare-weather-phenomenon-to-smash-australia
Best Nintendo 64 games of all time,https://www.news.com.au/web-stories/free/news-com-au/best-nintendo-64-games-of-all-time
New dating trend as 'hook-up' culture dies out,https://www.news.com.au/web-stories/free/news-com-au/is-hook-up-culture-dead-new-gen-z-relationships-say-so
Surprise Aussie city wins world’s ‘coolest’ street,https://www.news.com.au/web-stories/free/news-com-au/travel-melbourne-makes-time-outs-coolest-streets-ranking
What really killed Princess Diana,https://www.news.com.au/web-stories/free/news-com-au/what-really-killed-princess-diana
Wild new Taylor Swift conspiracy theory,https://www.news.com.au/web-stories/free/news-com-au/midnights-taylor-swift-fans-reveal-wild-kanye-kardashian-theory
'Lyn is dead': Bombshell verdict in murder trial,https://www.news.com.au/web-stories/free/news-com-au/chris-dawson-trial-ex-teacher-guilty-of-murdering-wife-lynette
'Designer vagina’ surgery is booming,https://www.news.com.au/web-stories/free/news-com-au/why-designer-vagina-surgery-is-booming
The Aussie suburbs with ‘ridiculous’ rent hikes,https://www.news.com.au/web-stories/free/news-com-au/the-ridiculous-rent-hikes-in-aussie-suburbs
Four reasons men get paid considerably more,https://www.news.com.au/web-stories/free/news-com-au/men-get-paid-considerably-more-for-the-same-job-data-reveals
'This is it': Why you won't see actor anymore,https://www.news.com.au/web-stories/free/news-com-au/steve-martin-says-he-will-no-longer-seek-acting-work
Scary trap in new 'quiet quitting' trend,https://www.news.com.au/web-stories/free/news-com-au/scary-trap-in-quiet-quitting-trend-in-aussie-offices
Dangerous sex act on the rise,https://www.news.com.au/web-stories/free/news-com-au/sex-and-relationships-scary-condom-trend-on-the-rise
Why women everywhere hate this man,https://www.news.com.au/web-stories/free/news-com-au/andrew-tate-warning-over-viral-tiktok-rape-culture-videos
'Rare event': Aussies brace for six months of rain,https://www.news.com.au/web-stories/free/news-com-au/weather-aussies-brace-for-six-months-of-rain
Aussies saving a motza with 'cash stuffing’ trend,https://www.news.com.au/web-stories/free/news-com-au/what-is-cash-stuffing-millennials-save-thousands-with-money-hack
'Missing' Aussie actor found in LA jail after date,https://www.news.com.au/web-stories/free/news-com-au/australian-actor-laura-mcculloch-found-in-jail-after-online-date
‘I’m not talking to you’: Saudi prince erupts,https://www.news.com.au/finance/economy/opec-sides-with-russia-to-cut-oil-output-by-2-million-barrels-a-day/news-story/ff376116e0a6a087f9a9a245c1d754f3
15 famous sayings with weird origins,https://www.news.com.au/national/15-famous-sayings-with-weird-origins/audio/cd048662ffa2d0fa5170496dbe924698
