title,url
‘DEEPLY UPSET’: Tennis star investigated ahead of Australian Open,https://www.news.com.au/sport/tennis/italian-tennis-star-camila-giorgi-investigated-for-alleged-fake-covid-vaccine-certificate/news-story/7a8169598c91bab284d25cb49737e5bd
Arrests as president urinates on himself,https://www.news.com.au/finance/business/media/video-shows-south-sudan-president-salva-kiir-urinating-on-himself-as-journalists-arrested/news-story/8964348b8b846c5985659d67ac6b8192
Harry’s shock claim about William’s wedding,https://www.news.com.au/entertainment/celebrity-life/royals/harry-alleges-william-didnt-want-him-to-give-a-speech-at-his-wedding/news-story/13d4729e20c274016e80aa51714a86c2
European country on the brink of war,https://www.news.com.au/finance/work/leaders/turkish-president-recep-tayyip-erdogan-on-the-brink-of-triggering-war/news-story/c89b23d6bf2454222b65725245bd3f3b
‘Not my prince’: Ex-marine slams Harry,https://www.news.com.au/entertainment/celebrity-life/royals/exmarine-forced-to-evacuate-kabul-after-prince-harrys-explosive-claims/news-story/78cc9a167df37085dd42e80da70fdd73
Aussie tradie dating sex doll named Karina,https://www.news.com.au/lifestyle/real-life/true-stories/aussie-tradie-is-in-intimate-relationship-with-a-sex-doll-named-karina/news-story/c128a3d47bef97ff3728be59f74327a1
‘Curious’: 24yo reveals big body secret,https://www.news.com.au/lifestyle/real-life/news-life/i-was-24-when-i-got-a-stoma-heres-what-i-want-you-to-know/news-story/7ccb5f73ba60368c3755171e60752928
Rod Stewart mourns double family tragedy,https://www.news.com.au/entertainment/celebrity-life/rod-stewart-mourns-deaths-of-both-brothers-bob-and-don/news-story/a7f86eb4fd3d40dfd1335d5a74aab970
"Man killed, kids injured in horror crash",https://www.news.com.au/technology/motoring/on-the-road/man-killed-four-others-including-children-injured-in-hindmarsh-valley-crash/news-story/95cb37ea304dd65027eb79efbdaafe3d
Iran executes karate champion and coach,https://www.news.com.au/lifestyle/real-life/karate-champion-and-childrens-coach-executed-in-iran/news-story/9301471a96ff37dd79c06064a0ef759e
WHO’s warning about variant in Australia,https://www.news.com.au/technology/science/xbb-15-covid-subvariant-how-worried-should-australians-be-about-new-kraken-strain/news-story/8acfd74da8f2ac8c268686f814cf0edb
Woman’s alarming measure to keep safe in Ubers,https://www.kidspot.com.au/lifestyle/uber-rider-safety-one-womans-terrifying-and-clever-hack/news-story/f3a3b93ea26006709264c492410228fc
Ex-tropical cyclone picks next target,https://www.news.com.au/technology/environment/nations-south-enjoys-warm-weather-while-extropical-cyclone-ellie-threatens-fnq/news-story/a6cdf03aaf8928e392effb9a41db3db2
"Man killed, kids injured in horror crash",https://www.news.com.au/technology/motoring/on-the-road/man-killed-four-others-including-children-injured-in-hindmarsh-valley-crash/news-story/95cb37ea304dd65027eb79efbdaafe3d
WHO’s warning about variant in Australia,https://www.news.com.au/technology/science/xbb-15-covid-subvariant-how-worried-should-australians-be-about-new-kraken-strain/news-story/8acfd74da8f2ac8c268686f814cf0edb
Test your trivia skills with our general knowledge quiz,https://www.news.com.au/in-the-know-quiz/dashboard
Meghan and Kate’s private clashes exposed,https://www.news.com.au/entertainment/celebrity-life/royals/inside-kate-middleton-and-meghan-markles-tense-relationship-and-how-it-became-so-frosty/news-story/11813bc2c5068da193f1b9a468b4d561
‘Hates them’: William vs Harry rift heats up,https://www.news.com.au/entertainment/celebrity-life/royals/utterly-betrayed-william-versus-harry-rift-heats-up/news-story/d9875849ab0cdb8a938293e6656493cd
Unlikely star to lead Gladiator sequel,https://www.news.com.au/entertainment/movies/upcoming-movies/paul-mescal-in-talks-to-lead-gladiator-sequel/news-story/822444d2c2e4049c0cd8760a0507ad46
Seven questions Harry needs to answer,https://www.news.com.au/entertainment/celebrity-life/royals/yet-to-heir-seven-questions-harry-needs-to-answer/news-story/d8dc429545ea217638b89b8e61c65a31
Petty reason behind Miley’s attack on Liam,https://www.news.com.au/entertainment/celebrity-life/hook-ups-break-ups/mileys-dig-at-ex-liam-hemsworth-is-very-ontrend/news-story/79ff5a9718193f26b61544ff4cd0bea4
Aussies gamble to pull off miracle victory,https://www.news.com.au/sport/cricket/australia-vs-south-africa-day-5-live-aussies-pushing-for-miracle-victory/news-story/ba8f7a0e928bf6442ef2e2c20f561a6d
Why flight prices could drop this year,https://www.news.com.au/travel/travel-advice/flights/aviation-experts-flights-prediction-as-aussie-airlines-bounce-back-amid-diversions-staff-shortages/news-story/02ed5713217eee32676d6137f090f5ef
Ex-tropical cyclone picks next target,https://www.news.com.au/technology/environment/nations-south-enjoys-warm-weather-while-extropical-cyclone-ellie-threatens-fnq/news-story/a6cdf03aaf8928e392effb9a41db3db2
Commentators left ‘staggered’ by SCG fail,https://www.news.com.au/sport/cricket/invest-in-some-better-covers-calls-for-scg-overhaul-after-embarrassing-sponsor-leak/news-story/552f54506eb704e39ce84fd8f2918f37
Broncos in crisis as damning quote emerges,https://www.news.com.au/sport/nrl/selwyn-cobbo-makes-stunning-kevin-walters-admission/news-story/62e6f8acd713c7320752d989cc9236fd
Shock words ‘branded’ on Tate’s sex-cam girls,https://www.news.com.au/world/andrew-tates-sexcam-girls-were-reportedly-branded-with-owned-by-tate-tattoos/news-story/38bec487563c7c4e14ea0e5f8069a7eb
‘F**k the NFL’: Emily’s cryptic tweet,https://www.news.com.au/entertainment/celebrity-life/emily-ratajkowski-sledges-the-nfl/news-story/b65ab15c15467c2f130d2faad0674c5d
Football star stabbed to death at 23,https://www.news.com.au/sport/football/stratford-towns-cody-fisher-23-honoured-after-fatal-stabbing/news-story/4772297091173b6c829b374497f586d7
Murder suspect’s strange act before arrest,https://www.news.com.au/world/north-america/idaho-murder-suspect-bryan-kohberger-cleaned-his-car-before-arrest/news-story/b153c381e4d2b2ae2ef3dce88e25003f
‘Resign or fired’: World wants UFC boss gone,https://www.news.com.au/sport/ufc/pathetic-calls-for-ufc-boss-dana-white-to-resign-or-be-fired-for-slapping-wife/news-story/12ff77db99dfb1f34a3324bbb801e1f0
Sacked NRL star’s ex-wife unveils new project,https://www.realestate.com.au/news/sacked-nrl-titans-star-kevin-proctors-exwife-leesa-fife-unveils-stunning-coastal-reno/?rsf=syn:news:nca:news:spa:strap
‘Beware’: Homes you should avoid in 2023,https://www.realestate.com.au/news/buyer-beware-why-material-facts-will-matter-for-home-purchasers/?rsf=syn:news:nca:news:spa:strap
‘I have two jobs and bought a home at 22’,https://www.realestate.com.au/news/how-firsthome-buyer-juggled-two-jobs-at-coles-and-mcdonalds-to-buy-a-home-at-22/?rsf=syn:news:nca:news:spa:strap
Model unrecognisable after dog mauled face,https://www.news.com.au/lifestyle/real-life/news-life/skateboarder-and-model-shares-transformation-photos-after-pit-bull-mauled-her-face/news-story/ba7e2c99082cd113ea45d6a6680d693b
‘I’ve already won’: Influencer’s brave last post,https://www.news.com.au/lifestyle/real-life/news-life/influencers-gutwrenching-last-video-message-before-dying-of-cancer/news-story/3822d9d17fa9b3bb6c1f2c9f1ae237e1
Deadly bacteria spreads in Australia,https://www.news.com.au/lifestyle/health/health-problems/rare-bacterial-infections-on-rise-sparking-health-authorities-warning/news-story/3f1a9194d4bc77939768a59951d2b71d
‘Insanity’ of most ‘un-Australian’ thing,https://www.news.com.au/lifestyle/real-life/news-life/most-unaustralian-thing-revealed-in-new-australian-lamb-advert/news-story/5d991ffd82a9fba17373312f6c50d6aa
‘Curious’: 24yo reveals big body secret,https://www.news.com.au/lifestyle/real-life/news-life/i-was-24-when-i-got-a-stoma-heres-what-i-want-you-to-know/news-story/7ccb5f73ba60368c3755171e60752928
Online act jeopardising your job prospects,https://www.seek.com.au/career-advice/article/5-ways-to-put-your-best-foot-forward-online?tracking=DAC-NAS-NCS_2020-25466&utm_campaign=NCS_2020&utm_source=Newcorp&utm_medium=Display&utm_content=Vis_CA_AO_AFJ
‘My BIL keeps cracking jokes about my adopted son’,https://www.kidspot.com.au/news/my-brotherinlaw-keeps-cracking-jokes-about-my-adopted-son/news-story/db692ec4ee938a15cd79fad15e72460e
"$67 vacuum with 119,000 5-star ratings",https://www.news.com.au/best-of/electronics/best-car-vacuum-cleaner/news-story/6861350ef7fa25b593017c2fa4155b3c
Stunning town has tourists in fear,https://www.news.com.au/travel/destinations/pacific/why-queenstown-new-zealand-has-tourists-screaming-in-fear/news-story/ab3cadff46381839ed4ccde745e40bdd
New Aussie hotel’s stunning feature,https://www.news.com.au/travel/travel-ideas/best-of-travel/five-best-hotel-pools-to-check-out-around-australia-this-summer/news-story/def68b49b5b4f71d0acb0671ceab3084
Jetstar flight makes emergency landing,https://www.news.com.au/travel/travel-updates/incidents/jetstar-flight-forced-to-make-emergency-landing-after-bomb-threat/news-story/565693b8dc6295b4bcb6030537a076bf
SeaWorld crash victims could sue for millions,https://www.news.com.au/travel/travel-updates/incidents/victims-of-seaworld-helicopter-crash-eligible-for-compensation-through-legal-action/news-story/834b208326c9a21fe108ed90a4c28595
‘Bulls**t’: Why Covid test rule backfired,https://www.news.com.au/travel/travel-updates/health-safety/joe-hildebrand-australias-china-travel-test-rule-has-sparked-new-wave-of-covid-panic/news-story/2c25ae75fecff1e1fd5ecd0838a4b8c7
Netflix finally puts fans out of their misery,https://www.news.com.au/entertainment/tv/streaming/netflix-confirms-season-two-of-wednesday/news-story/a49733e73858a04abded7cb836cb0d37
Harry got high after first date with Meghan,https://www.news.com.au/entertainment/celebrity-life/royals/prince-harry-smoked-weed-after-first-date-with-meghan-markle/news-story/904328be7603ea77875a05cc3690a52c
‘Truth’ behind Harry and Will’s physical fight,https://www.news.com.au/entertainment/celebrity-life/royals/royal-sources-say-harry-and-williams-physical-fight-was-over-meghan-bullying-claims/news-story/15987fdd9358ec2460f65fbabde0396b
Harry’s explosive army drug test bombshell,https://www.news.com.au/entertainment/celebrity-life/royals/prince-harry-left-army-base-right-before-drug-testing/news-story/793f225c97c3148f6be1a0a464a900e5
Savage move King Charles must make,https://www.news.com.au/entertainment/celebrity-life/royals/king-charles-must-react-to-prince-harrys-book-or-risk-looking-cold/news-story/add18fe7527f60c088318852f8dfb37a
Grim find reveals homeowner’s nightmare,https://www.news.com.au/technology/science/animals/leave-now-aussie-homeowners-alarming-find-on-doorstep/news-story/357f47eec1f26ed17bfe06ff8fb1e8ae
Logan Paul’s massive backflip,https://www.news.com.au/technology/gaming/logan-paul-hits-back-at-criticism-of-his-controversial-nft-game/news-story/0b1b90131f9b15b7cbcbe4c4441dc98b
‘Idiot’: Cyclist rule divides the internet,https://www.news.com.au/technology/motoring/on-the-road/seeing-cyclists-doing-this-makes-my-blood-boil/news-story/8902f8aa693c8ffcc95c4e3d9ce6c358
Subs doubts as AUKUS deadline looms,https://www.news.com.au/technology/innovation/military/anthony-albanese-defends-aukus-as-joe-biden-issues-submarine-warning/news-story/326ce3c195b5d84c33c8706a0fc058e2
Horse riders label fines ‘declaration of war’,https://www.news.com.au/technology/science/animals/war-outrage-over-horse-fine-in-sydneys-centennial-park/news-story/628f1b9106fb48f28c3d329fbb9d07a3
"Teenager loses $37,000 in seconds",https://www.news.com.au/finance/money/nothing-left-teen-loses-37000-falling-victim-to-alleged-nab-scam/news-story/401d4fe9d8a00fdab2cd8e19fa65bfac
Pic proves Sydney rental market is cooked,https://www.news.com.au/finance/real-estate/renting/sad-photo-highlights-sydneys-housing-crisis/news-story/ff9e53fb73a19f94533b80f1991ff627
Shoppers warned of fake retailer scam,https://www.news.com.au/technology/online/hacking/online-shoppers-urged-to-avoid-dotti-scam/news-story/f6144ea5dd4c8dac419a40b436e55858
Why this Red Rooster sign is blowing up,https://www.news.com.au/finance/work/at-work/red-rooster-sign-to-protect-workers-resonates-with-australia/news-story/955c768f1bb394d212453a41bf3e4c7f
‘Risky’: Nightmare scenario for homeowners,https://www.news.com.au/finance/economy/interest-rates/homeowners-face-nightmare-2023-as-property-market-remains-unstable/news-story/8d9d7596afc38ca68cfd8a2ec2b7ec45
Medvedev mocks Djokovic with brutal act,https://www.news.com.au/sport/tennis/daniil-medvedev-appears-to-mock-novak-djokovic-for-playing-up-injury-during-adelaide-international-battle/news-story/0476f53ef4e8a000c9dee9e1acf59820
Tomic officially snubbed from Aus Open,https://www.news.com.au/sport/tennis/bernard-tomic-officially-snubbed-from-australian-open-wildcard/news-story/39ddc56142e1a3aa86d923afc958853a
Khawaja ‘has every right to be p***ed’,https://www.news.com.au/sport/cricket/usman-khawaja-denied-double-century-by-day-four-declaration/news-story/8f609134c7a4abf4275aaa31bdc7f8f1
Fuming star’s horror review torn apart,https://www.news.com.au/sport/cricket/khaya-zondo-told-forfeit-your-wicket-in-second-innings-amid-tantrum/news-story/2c038cb4a07f93d41c665010bd176886
Shaun Tait blows up at Pakistan journo,https://www.news.com.au/sport/cricket/answering-the-question-before-you-ask-it-shaun-taits-fiery-exchange-with-pakistan-journo/news-story/b83dc83e083df42e974d9d9cb126e334
Aus Open rocked by shattering development,https://www.news.com.au/sport/tennis/australian-open-top-seed-carlos-alcaraz-withdraws-after-training-injury/news-story/3f10edbc7a201613e1e4ac664c9dfdad
NFL team announces second tragedy,https://www.news.com.au/sport/american-sports/nfl/buffalo-bills-reveal-second-tragedy-as-damar-hamlin-calls-teammates-from-hospital-bed/news-story/e367bd0413b5c50ac770117ade653d29
League legend’s tragic family reveal,https://www.news.com.au/sport/nrl/wally-lewis-message-for-all-men-following-fathers-dementia-diagnosis/news-story/37c5724344c709a5a618992526a704ab
$69 off: Hot prices on PlayStation games,https://www.news.com.au/best-of/electronics/best-playstation-deals-australia/news-story/b5fc04b74062b6b7358de25679c99c41
Clever kettles to make perfect tea and coffee,https://www.news.com.au/best-of/electronics/appliances/15-kettles-that-will-help-you-make-a-delicious-cuppa/news-story/171e939e6195f5006eae7da2669091c5
‘Warm and comfy’ hooded blankets from just $8.99,https://www.news.com.au/best-of/fashion/best-hooded-blankets/news-story/122096a8ad3d9ff1e1ebba3d6eef2388
$700 slashed off robot vac with ‘impressive suction’,https://www.news.com.au/best-of/sales-and-deals/best-weekly-deals/news-story/9c016ab1a34c9adb0ab720ce5cf833e9
$940 off: Back to school laptop deals,https://www.news.com.au/best-of/electronics/gadgets/best-laptop-deals-australia/news-story/ceca9380d0eb073de8fac0f8b8748507
Bizarre new burial trend sweeping the US,https://www.news.com.au/web-stories/free/news-com-au/human-composting-new-york
New twist in the race to cast next James Bond,https://www.news.com.au/web-stories/free/news-com-au/frontrunner-to-replace-daniel-craig-revealed-as-aaron-taylor-johnson-james-bond
New ‘super variant’ could be the worst one yet,https://www.news.com.au/web-stories/free/news-com-au/xbb15-covid-variant-new-york
Model’s bombshell claim about Andrew Tate,https://www.news.com.au/web-stories/free/news-com-au/andrew-tate-arrest-tate-allegedly-tried-to-lure-playboy-model-carla-howe-to-romanian-lair
The new beach trend dividing Aussies,https://www.news.com.au/web-stories/free/news-com-au/the-new-beach-trend-dividing-aussies
Hollywood star embroiled in slavery controversy,https://www.news.com.au/web-stories/free/news-com-au/benedict-cumberbatch-could-pay-reparations-due-to-slave-owning-ancestors
World’s safest airline for 2023 revealed,https://www.news.com.au/web-stories/free/news-com-au/qantas-named-worlds-safest-airline-2
The real reason behind new Covid rule for China,https://www.news.com.au/web-stories/free/news-com-au/china-covid-rule-health-minister-mark-butler-explains-new-covid-rule
Woman’s viral ‘hangover cure’ praised online,https://www.news.com.au/web-stories/free/news-com-au/womans-viral-hangover-cure-praised-online
Avoid the biggest tourist mistakes in London,https://www.news.com.au/web-stories/free/news-com-au/avoid-the-biggest-tourist-mistakes-in-london-england
Azealia Banks’ most controversial moments,https://www.news.com.au/web-stories/free/news-com-au/azealia-banks-most-controversial-moments
Zoe Foster Blake’s Go-To skincare company has suffered $73 million hit,https://www.news.com.au/web-stories/free/news-com-au/zoe-foster-blakes-go-to-skincare-company-has-suffered-73-million-hit
'Gender pain gap' killing Aussie women,https://www.news.com.au/web-stories/free/news-com-au/gender-pain-gap-sinister-issue-killing-australian-women
Australia’s housing bubble could be ‘about to burst’,https://www.news.com.au/web-stories/free/news-com-au/australias-housing-bubble-could-be-about-to-burst
AFL star looks absurdly ripped in new photo,https://www.news.com.au/web-stories/free/news-com-au/bailey-smith-has-left-fans-giddy-with-new-photos
Big clue about White Lotus Season 3 revealed,https://www.news.com.au/web-stories/free/news-com-au/big-white-lotus-clue-reveals-where-season-3-could-be-filmed
China abandons reporting daily Covid figures,https://www.news.com.au/web-stories/free/news-com-au/china-abandons-reporting-daily-covid-figures
Meghan blames Australia for her downfall,https://www.news.com.au/web-stories/free/news-com-au/meghan-markle-blames-australia-for-her-royal-downfall
Generation more likely to call in sick to work,https://www.news.com.au/web-stories/free/news-com-au/the-generation-thats-more-likely-to-call-in-sick-to-work
Meghan’s big royal claim branded a ‘total lie’,https://www.news.com.au/web-stories/free/news-com-au/harry-and-meghan-netflix-meghans-claim-a-total-lie-2
Elon Musk no longer world's richest person,https://www.news.com.au/web-stories/free/news-com-au/bernard-arnault-is-worlds-richest-person-replacing-elon-musk
Reason Aussies are being diagnosed with ADHD,https://www.news.com.au/web-stories/free/news-com-au/real-reason-more-australians-are-being-diagnosed-with-adhd
Margot Robbie’s wild Brad Pitt confession,https://www.news.com.au/web-stories/free/news-com-au/margot-robbies-wild-brad-pitt-kiss-confession
Dyson release most 'bizarre' product to date,https://www.news.com.au/web-stories/free/news-com-au/dyson-zone-controversial-air-purifying-headphones-released
Reason for spike in meningococcal cases,https://www.news.com.au/web-stories/free/news-com-au/meningococcal-australia-why-is-there-a-spike-in-cases
Celine diagnosed with Stiff Person Syndrome,https://www.news.com.au/web-stories/free/news-com-au/stiff-person-syndrome-disease-thats-cancelled-celine-dions-music-career
Hidden Aussie beach better than Byron,https://www.news.com.au/web-stories/free/news-com-au/cellito-beach-hidden-aussie-coastal-town-better-than-byron
Full moon will make these star signs cheat,https://www.news.com.au/web-stories/free/news-com-au/full-moon-will-make-aquarius-sagittarius-libra-star-signs-cheat
Shocking statistic plaguing workplaces,https://www.news.com.au/web-stories/free/news-com-au/shocking-statistic-plaguing-australian-workplaces
'Less than a year to live': Man's warning to tradies,https://www.news.com.au/web-stories/free/news-com-au/silicosis-aussie-tradie-has-less-than-a-year-to-live-after-diagnosis
‘Confusing’ relationship 1 in 10 Aussies are in,https://www.news.com.au/web-stories/free/news-com-au/situationship-new-relationship-trend-emerges-in-2022-tinder-report
Anger boils over as China Covid rule backfires,https://www.news.com.au/web-stories/free/news-com-au/xi-jinping-asked-to-resign-as-china-covid-protests-grow
Surprising Botox service on rise in Australia,https://www.news.com.au/web-stories/free/news-com-au/aussies-seeking-botox-injections-turning-to-dentists
'Evil': Why Nicole Kidman is being cancelled,https://www.news.com.au/web-stories/free/news-com-au/nicole-kidman-backlash-amid-balenciaga-child-pornography-scandal
"Woman ditches Sydney, doubles salary, buys home",https://www.news.com.au/web-stories/free/news-com-au/midwife-ditches-sydney-for-alice-springs-and-doubles-salary
The surprising most watched TV show,https://www.news.com.au/web-stories/free/news-com-au/yellowstone-is-the-most-popular-tv-show-in-america
‘I f***ed up’: Billionaire’s net worth vanishes,https://www.news.com.au/web-stories/free/news-com-au/billionaire-sam-bankman-frieds-net-worth-vanishes-after-ftx-and-alameda-disaster
Why did Deliveroo collapse in Australia?,https://www.news.com.au/web-stories/free/news-com-au/deliveroo-goes-into-voluntary-administration-in-australia
"'Just do it!': 20,000 signatures in eight hours",https://www.news.com.au/web-stories/free/news-com-au/petition-20000-signatures-to-help-child-sexual-abuse-survivors
"‘Um, sorry?’: Rebel slammed over party post",https://www.news.com.au/web-stories/free/news-com-au/rebel-wilson-criticised-for-partying-after-birth-of-daughter
One job tennis star Ash Barty will ‘never’ pursue,https://www.news.com.au/web-stories/free/news-com-au/one-job-tennis-star-ash-barty-will-never-pursue
Charles’ ‘deepest regret’ from Lady Di’s funeral,https://www.news.com.au/web-stories/free/news-com-au/king-charles-deepest-regret-from-princess-dianas-funeral
Sad truth behind Jen Aniston’s ‘pregnancy’,https://www.news.com.au/web-stories/free/news-com-au/jennifer-aniston-opens-up-about-secret-ivf-struggle
Tornado warning as rain band moves in,https://www.news.com.au/web-stories/free/news-com-au/weather-tornado-warning-as-rain-band-moves-towards-nsw
Australia’s $5b phoenix operation set to explode,https://www.news.com.au/web-stories/free/news-com-au/pheonixing-australias-5b-operation-set-to-explode
'Now pay': Chaos over Musk Twitter prank,https://www.news.com.au/web-stories/free/news-com-au/elon-musks-twitter-takeover-backfires-after-celeb-prank
Surprise truth about quiet quitting exposed,https://www.news.com.au/web-stories/free/news-com-au/quiet-quitting-australian-expert-reveals-the-truth-about-job-trend
Company's big work day shake-up pays off,https://www.news.com.au/web-stories/free/news-com-au/unilever-australia-to-trial-four-day-work-week
Aussie singer's staggering fortune revealed,https://www.news.com.au/web-stories/free/news-com-au/tones-and-is-staggering-fortune-revealed
Hamish and Zoe Foster Blake’s home is wild,https://www.news.com.au/web-stories/free/news-com-au/hamish-and-zoe-foster-blakes-sydney-home-is-wild
Surprise love story of China’s most powerful man,https://www.news.com.au/web-stories/free/news-com-au/surprising-love-story-of-chinas-most-powerful-man
Bizarre plant trend on the rise in Australia,https://www.news.com.au/web-stories/free/news-com-au/plant-parenting-is-a-new-trend-aussies-are-getting-around
21yo earns six figures working just three hours,https://www.news.com.au/web-stories/free/news-com-au/dropshipping-how-21yo-earns-six-figures-working-just-three-hours
What would a recession mean for Australia?,https://www.news.com.au/web-stories/free/news-com-au/what-would-a-recession-mean-for-australia
When the La Nina rain event will end,https://www.news.com.au/web-stories/free/news-com-au/australia-weather-la-nina-when-will-the-rain-stop
Inside the most beautiful Macca's in the world,https://www.news.com.au/web-stories/free/news-com-au/inside-the-most-beautiful-mcdonalds-in-the-world
Top 3 emojis that make you 'less likeable',https://www.news.com.au/web-stories/free/news-com-au/top-3-phone-emojis-that-make-you-more-likeable
Carrie’s career option no one saw coming,https://www.news.com.au/web-stories/free/news-com-au/carrie-bickmores-next-move-after-leaving-the-project
'Legend': Aussie’s 'insane' $1.5m journey,https://www.news.com.au/web-stories/free/news-com-au/nedd-brockmanns-1-5-million-journey-across-australia
‘Beaten down’: Terrible news for Melburnians,https://www.news.com.au/web-stories/free/news-com-au/beaten-down-and-broken-terrible-news-for-melburnians
Aussie town that's home to new big landmark,https://www.news.com.au/web-stories/free/news-com-au/regional-victorian-town-named-home-to-big-rainbow
Drama behind multimillion-dollar divorce,https://www.news.com.au/web-stories/free/news-com-au/tom-brady-gisele-bundchens-multimillion-dollar-divorce
Vegan protester making thousands,https://www.news.com.au/web-stories/free/news-com-au/tash-peterson-vegan-protester-and-onlyfans-stars-notorious-stunts
‘Step up’: Report angering a lot of men,https://www.news.com.au/web-stories/free/news-com-au/rise-of-single-lonely-men-psychologist-slammed-online
Star signs most likely to be serial killers,https://www.news.com.au/web-stories/free/news-com-au/astrology-star-signs-most-likely-to-be-serial-killers
New ‘R’ car plate for Aussie motorists,https://www.news.com.au/web-stories/free/news-com-au/new-r-car-plate-for-aussie-motorists
Millions to go beyond ‘quiet quitting’,https://www.news.com.au/web-stories/free/news-com-au/quiet-quitting-millions-of-australians-to-leave-their-job
Shopping hack Aussie tourists don’t know about,https://www.news.com.au/web-stories/free/news-com-au/tourist-discount-aussies-dont-know-about
Real reason you can't use your phone on plane,https://www.news.com.au/web-stories/free/news-com-au/experts-reveal-why-you-need-to-turn-off-your-phone-on-a-flight
Mystery surrounding sex act finally solved,https://www.news.com.au/web-stories/free/news-com-au/sex-and-relationships-is-squirting-actually-a-thing
Proof Keanu Reeves may be the nicest guy on Earth,https://www.news.com.au/web-stories/free/news-com-au/keanu-reeves-may-be-the-nicest-guy-on-earth
