title,url
‘DEEPLY DISTRESSING’: Daniel Andrews rejects George Pell honour,https://www.news.com.au/national/victoria/politics/premier-daniel-andrews-sides-with-churchs-victimsurvivors-after-george-pells-death/news-story/bfb4523f5a0d8914a1b56350e6fb1cbe
Picture that got Perth mum cancelled,https://www.news.com.au/lifestyle/parenting/babies/mum-shares-sad-truth-behind-controversial-breastfeeding-picture/news-story/5756abfcd14cb816c805300ec0727e76
Concerns as star disappears from public life,https://www.news.com.au/entertainment/celebrity-life/jack-nicholson-hasnt-been-seen-in-over-a-year-amid-health-fears/news-story/d193b80444237bb19ec3ce67422a6d00
10yo’s maths question no one can solve,https://www.news.com.au/lifestyle/parenting/school-life/can-you-solve-a-maths-question-given-to-a-10yo-for-homework/news-story/fbed5658adcd0073c48f51b389e73881
Scientists confirm penis size rumour,https://www.news.com.au/technology/motoring/motoring-news/scientists-prove-link-between-perceived-penis-size-and-sports-cars/news-story/0cbbb93349c4d9d4a6406e610438cd46
Albo makes history ahead of major deal,https://www.news.com.au/finance/work/leaders/anthony-albanese-to-address-png-parliament-ahead-of-new-security-deal/news-story/7be9b57f9f2b0665d370e89b44147eb0
World’s richest man puts daughter in charge,https://www.news.com.au/finance/business/worlds-richest-man-bernard-arnault-puts-daughter-delphine-in-charge-of-christian-dior/news-story/76b4e924e3ddb7632aa49f718d9ed272
TV star’s brutal reaction to Pell tribute,https://www.news.com.au/entertainment/tv/current-affairs/beyond-the-pale-seven-anchors-brutal-pell-reaction/news-story/224a8a14fe141d2d8f028b834facd665
Addison Rae stuns in white dress,https://www.news.com.au/lifestyle/fashion/fashion-trends/youtube-star-rocks-exposed-gstring-dress-at-golden-globes/news-story/18f078c7cd5aa45a8a793ffad90d5173
Bizarre detail spotted in iconic movie poster,https://www.news.com.au/entertainment/movies/fans-perplexed-over-kate-winslets-hair-in-25th-anniversary-titanic-poster/news-story/8a2d2e7189f0e7b6534dc5deba93f809
Bezos’ billionaire ex-wife divorced again,https://www.news.com.au/finance/money/wealth/mackenzie-scott-amazon-billionaire-jeff-bezos-exwife-finalises-second-divorce/news-story/5010e75e33dcc5227f0879d63144cf43
Harry just an ‘organ farm’ for Willy,https://www.bodyandsoul.com.au/lifestyle/prince-harry-reckons-he-was-born-to-be-an-organ-farm-for-his-brother/news-story/7774a584675fe530078a08aeb29316ae
Albo makes history ahead of major deal,https://www.news.com.au/finance/work/leaders/anthony-albanese-to-address-png-parliament-ahead-of-new-security-deal/news-story/7be9b57f9f2b0665d370e89b44147eb0
Reason Matildas’ opponents ‘carefully selected’,https://www.news.com.au/sport/football/february-tournament-to-mirror-what-the-matildas-can-expect-at-fifa-womens-world-cup/news-story/6ecf87589ed4a1bbc43a3d0056b02711
‘Hateful act’: Emu chicks left for dead,https://www.news.com.au/technology/science/animals/emu-chicks-left-to-die-on-side-of-remote-wa-road-in-sickening-act/news-story/b57d1e65d94d786f60d20ea424441015
’Miracle’ pillow with over 24k 5-star reviews,https://www.news.com.au/best-of/home/best-hypoallergenic-pillows/news-story/650846c0622356274abe3f5b1c018952
Kate seen for first time since book release,https://www.news.com.au/entertainment/celebrity-life/royals/kate-middleton-looks-downcast-in-first-photos-since-release-of-prince-harrys-memoir-spare/news-story/4300890dc61ac81235d8f52d15c6faa2
Host under fire for ‘awful’ Will Smith joke,https://www.news.com.au/entertainment/awards/golden-globes/golden-globes-host-under-fire-for-awful-will-smith-joke/news-story/308b9ec4780862e238168ff755006fbb
‘Drunk off her a**e’: Aussie star goes viral,https://www.news.com.au/entertainment/awards/golden-globes/aussie-star-milly-alcocks-onstage-golden-globes-antics-go-viral/news-story/2d2ca9539ea9b68a7d30f12279b7ee80
Harry: ‘I was born to give William my organs’,https://www.news.com.au/entertainment/celebrity-life/royals/prince-harry-says-he-was-bred-to-offer-spare-organs-to-heir-william/news-story/e7b13a526c2093969a0964f3b1be5198
‘So f***ing embarrassed’: Harry explosion,https://www.news.com.au/entertainment/celebrity-life/royals/repetitive-and-tiresome-allies-turn-on-harry/news-story/6a9184c9c1afce9da3ed9df1430e19aa
McEnroe: Ash Barty ‘hurt the sport’,https://www.news.com.au/sport/tennis/john-mcenroe-says-ash-bartys-retirement-hurt-the-sport/news-story/0886a6f74b6a4217ce7f71aeffab69b9
"‘I’m looking for a wake woman, unvaccinated’",https://www.news.com.au/lifestyle/relationships/meet-jay-hernandez-antivax-leaders-quest-to-find-love/news-story/85ae0e7b8f6d5ba42c4c58c7cec39f1c
‘Hateful act’: Emu chicks left for dead,https://www.news.com.au/technology/science/animals/emu-chicks-left-to-die-on-side-of-remote-wa-road-in-sickening-act/news-story/b57d1e65d94d786f60d20ea424441015
"Man accused of horror DV acts, taking child",https://www.news.com.au/national/queensland/courts-law/man-29-charged-after-allegedly-assaulting-and-threatening-woman-taking-toddler/news-story/11263466cefd0513608f0decaed1078d
‘Shove it’: Fury over Gold Coast car park,https://www.news.com.au/technology/motoring/on-the-road/disabled-womans-heartbreaking-note-for-driver-of-car-parked-illegally-in-disability-bay/news-story/8b036e47a1dacd0c725ebc23d7a5a023
Elvis star’s wild explanation for new voice,https://www.news.com.au/entertainment/awards/golden-globes/austin-butlers-bizarre-explanation-for-why-his-voice-has-changed/news-story/d35935b868e23ce62b91d01d8041bf3a
‘I won’t be punished for slapping my wife’,https://www.news.com.au/sport/ufc/ufc-boss-dana-white-wont-be-punished-after-slapping-his-wife/news-story/ed452c602035e59ab0d156af0bc29a0f
Football bans offensive two-word chant,https://www.news.com.au/sport/football/football-officials-ban-offensive-rent-boy-chant/news-story/5814ecf287ffdfc1ce4562b4bc185a84
‘Tremendous loss’: Rock legend dead at 78,https://www.news.com.au/entertainment/celebrity-life/celebrity-deaths/rock-legend-jeff-beck-dead-at-78-after-health-battle/news-story/1bdc05e431c14c74913f25cbbc389789
Staggering amount 9m customers lost,https://www.news.com.au/finance/business/other-industries/lawyers-dealing-with-ftx-crypto-collapse-identify-9m-customers/news-story/7af6871ff64910e65588894c57c82bc8
Rents hit grim record high in Aussie city,https://www.realestate.com.au/news/melbourne-rents-hit-grim-new-record-high-to-start-2023/?rsf=syn:news:nca:news:spa:strap
Rinehart’s right hand man offloads two mansions,https://www.realestate.com.au/news/gina-rinehart-right-hand-man-puts-two-qld-mansions-up-for-sale/?rsf=syn:news:nca:news:spa:strap
Private Aussie island oddly up for sale,https://www.realestate.com.au/news/interstate-investors-to-offload-private-qld-island-is-shock-sale/?rsf=syn:news:nca:news:spa
American rages at price of Aussie seafood,https://www.news.com.au/lifestyle/food/its-ridiculous-us-expat-rages-over-the-cost-of-seafood-in-australia/news-story/064ab75abcf40e795f330358fa1155e4
‘One of the originals’: Supermodel dead at 56,https://www.news.com.au/lifestyle/fashion/one-of-the-originals-supermodel-tatjana-patitz-dead-at-56/news-story/01b7713e0ffc4335efb02990a62c94ae
Woolies ‘indulgent’ take on cult $6 item,https://www.news.com.au/lifestyle/food/eat/woolworths-launches-limitededition-flavour-mud-cake/news-story/4d622ddb13685baebd6a67caaf9a5f27
Apple’s sleep fix for millions of tired Aussies,https://www.news.com.au/lifestyle/health/health-problems/apple-launches-new-feature-to-help-millions-of-tired-australians/news-story/a2dab6eaf29614dd2a4cb66ccc840951
Expat’s surprise at Aussie supermarket bill,https://www.news.com.au/lifestyle/food/british-expat-shares-shock-at-woolworths-grocery-bill/news-story/1ea783d44af9635aebbb115b86633252
‘Exposed’: Psych speaks out over fraudulent act,https://www.seek.com.au/career-advice/article/5-signs-of-imposter-syndrome-and-what-to-do-about-it?tracking=DAC-NAS-NCS_2020-28545&utm_campaign=NCS_2020&utm_source=Newcorp&utm_medium=Display&utm_content=Vis_CA_AO_WPTWB
Dad’s hilarious account of mum giving birth in car,https://www.kidspot.com.au/news/mate-i-was-shting-myself-dads-hilarious-account-of-mum-giving-birth-in-car/news-story/4e74dadc041bcaaccdf641d2e268230b
‘Genius’ new feature of hair removal tool,https://www.news.com.au/best-of/beauty/the-best-athome-laser-hair-removal-devices-for-smooth-skin/news-story/e3a5b4e5a23431ae50cc9484d4ab9a44
Victoria lands new low-cost airline,https://www.news.com.au/travel/travel-updates/melbourne-lands-lowcost-vietnamese-airlines-direct-flights/news-story/aa6353ebd37b8bca3093e21716702be2
Chaos after flights grounded across US,https://www.news.com.au/travel/travel-updates/incidents/all-flights-grounded-across-america-after-computer-glitch/news-story/08aedb3f478435e12b7904c3c7cda0da
Plane forced to make emergency landing,https://www.news.com.au/travel/travel-updates/incidents/virgin-australia-flight-from-perth-to-brisbane-forced-to-make-emergency-landing/news-story/1795bb290c97b2f831a3ed0a843d9a2b
Entire Jetstar flight cheers as woman booted,https://www.news.com.au/travel/travel-updates/incidents/drunk-karen-cheered-off-jetstar-flight-for-allegedly-being-disorderly/news-story/badc12659ffce70e8dd852c12fdd83c7
‘Stay out’: Surf towns fed up with tourists,https://www.news.com.au/travel/australian-holidays/nsw-act/idyllic-aussie-beach-towns-hit-back-after-being-completely-overrun-by-tourists/news-story/05adbafb6ba0e22f44f26d9024b7108c
Dance duo confess to threesomes with fans,https://www.news.com.au/entertainment/music/pop-duo-chainsmokers-confess-they-have-threesomes-with-fans/news-story/a1c2557a662b8e362ff53d7b4cfacd79
Meghan’s ‘colour’ joke that Kate hated,https://www.news.com.au/entertainment/celebrity-life/royals/prince-harry-reveals-meghan-markles-joke-to-kate-middleton-that-led-to-yawning-silence/news-story/b40ae880b87ec0216b7f4f9c1e0c8010
OnlyFans scandal takes over Bachie,https://www.news.com.au/entertainment/tv/reality-tv/the-bachelor/two-sex-scandals-rock-the-bachelor-mansion/news-story/3ce8514b30a106a2dec1c04af5f7d90b
Hugh Jackman denies sinister rumour,https://www.news.com.au/entertainment/movies/hugh-jackman-denies-ever-taking-steroids-to-play-wolverine/news-story/d3774d9dcf9ac8b9bda7e7612dd53ef7
Meghan was told to put on weight,https://www.news.com.au/entertainment/celebrity-life/royals/prince-harry-says-doctor-advised-meghan-markle-to-gain-weight-to-conceive/news-story/79ae4060f2ebe1cf16b348edf47f377a
Outrage as homeless woman hosed,https://www.news.com.au/technology/online/gallery-owner-soaks-homeless-woman-with-garden-hose-in-viral-video/news-story/833e5ae14ccdfb874f94a10613219ffc
‘Utter garbage’: Sovereign citizens slammed,https://www.news.com.au/technology/online/bullsht-former-magistrate-slams-sovereign-citizens/news-story/6755a8986943724280c281f050f1dd64
Dog owner‘s beach rant sparks fiery debate,https://www.news.com.au/technology/science/animals/dog-owners-rant-about-unkind-encounter-with-a-fellow-beachgoer-splits-the-internet/news-story/e155a03c0266ad0284a3baf55527b9d3
Collapse of $35 billion Aussie solar venture,https://www.news.com.au/technology/environment/sustainability/30bn-solar-venture-backed-by-forrest-cannonbrookes-goes-into-voluntary-administration/news-story/a5d0b3c69bc68103069effa92f5db8ce
Warning after deadly virus found in state,https://www.news.com.au/technology/science/animals/murray-valley-encephalitis-detected-in-nsw-after-heavy-rainfall/news-story/e53335a76411d804e80ef23926ae93f0
World’s richest man puts daughter in charge,https://www.news.com.au/finance/business/worlds-richest-man-bernard-arnault-puts-daughter-delphine-in-charge-of-christian-dior/news-story/76b4e924e3ddb7632aa49f718d9ed272
Mum’s accidental $3m windfall,https://www.news.com.au/finance/money/wealth/mum-claims-3m-prize-after-accidentally-purchasing-oz-lotto-ticket/news-story/c813fedf4c25700a96b37655770a3ef8
Bizarre rift over popular tradie drink,https://www.news.com.au/finance/business/retail/albury-supermarket-left-without-flavoured-milk-as-owner-and-distributor-fight/news-story/4c3bb31c1bd0d35cb09072c38bfd2729
New York Times columnist dies aged 44,https://www.news.com.au/finance/business/media/new-york-times-columnist-blake-hounshell-dies-aged-44-from-suspected-suicide/news-story/3b324dac96162bd1525ca7904e951749
‘Idiot’: Coles shopper leaves irate note,https://www.news.com.au/finance/business/retail/coles-shopper-unleashes-in-furious-note-left-on-sauce-product/news-story/2b78113221cec9b747b12cea65b460e5
‘No bigger signing in local footy … ever.’,https://www.news.com.au/sport/afl/code-swaps-business-ventures-and-local-cameos-2023-plans-for-106-exafl-players/news-story/7b796dcae4cbb85964ba88ba7d452ef1
Aussies dealt crushing Aus Open blow,https://www.news.com.au/sport/tennis/australian-open-2023-draw-aussies-dealt-crushing-seeding-blow/news-story/a91bf885ba4e965e8e12b5f61dc49f17
‘Zero idea’: Kyrgios torches tennis legend,https://www.news.com.au/sport/tennis/nick-kyrgios-torches-clueless-pat-rafter-after-aussie-greats-remarks/news-story/54aab9f6f38b573112f2909fafe1510e
Stark omission from Naomi Osaka baby news,https://www.news.com.au/sport/tennis/naomi-osaka-drops-bombshell-about-why-shes-missing-the-australian-open/news-story/60d8c102cebaaf355051add1344f82ae
Aussie goes nuclear in stunning upset,https://www.news.com.au/sport/tennis/thanasi-kokkinakis-rages-over-st-call-in-shock-upset-over-world-no-6/news-story/11b75850d90691d36aa99b39b178b94d
‘We were terrible’: Cleary quit reveal stuns,https://www.news.com.au/sport/nrl/dont-think-im-the-right-man-for-this-job-ivan-cleary-nearly-quit-on-panthers/news-story/e6c39a188c3f60f58b1e4792b2f01773
Albo’s big call on new NRL team,https://www.news.com.au/sport/nrl/pm-gives-clearest-backing-yet-for-a-pngbased-team-in-the-nrl/news-story/b3df91271c6b5d00775610e80e58b268
WWE champ sacked over racy pics,https://www.news.com.au/sport/more-sports/wwe-champion-mandy-rose-sacked-after-racy-pics-on-onlyfans-clone/news-story/f0457640b758cc1b4a99bbe6a047db67
Hot deal on ‘perfect running shoe’ from ASICS,https://www.news.com.au/best-of/sales-and-deals/best-deals-for-the-iconic/news-story/56e74e33c5ac0bc5305bdfce5e76d565
’Easy to use’ juicer food expert loves,https://www.news.com.au/best-of/best-juicer/news-story/6d663fb5b56817099c78ff517205748d
‘Supportive’ bike shorts that are ‘worth every cent’,https://www.news.com.au/best-of/fashion/best-bike-shorts/news-story/b0370316e7dc1721b7ad1f0d775b46a7
Top silk sheets to help you ‘sleep like a baby’,https://www.news.com.au/best-of/home/best-silk-sheets/news-story/39ffebc6beeec13a84b98630e2f44f43
$71 off: Hot prices on PlayStation games,https://www.news.com.au/best-of/electronics/best-playstation-deals-australia/news-story/b5fc04b74062b6b7358de25679c99c41
Bizarre new burial trend sweeping the US,https://www.news.com.au/web-stories/free/news-com-au/human-composting-new-york
New twist in the race to cast next James Bond,https://www.news.com.au/web-stories/free/news-com-au/frontrunner-to-replace-daniel-craig-revealed-as-aaron-taylor-johnson-james-bond
New ‘super variant’ could be the worst one yet,https://www.news.com.au/web-stories/free/news-com-au/xbb15-covid-variant-new-york
Model’s bombshell claim about Andrew Tate,https://www.news.com.au/web-stories/free/news-com-au/andrew-tate-arrest-tate-allegedly-tried-to-lure-playboy-model-carla-howe-to-romanian-lair
The new beach trend dividing Aussies,https://www.news.com.au/web-stories/free/news-com-au/the-new-beach-trend-dividing-aussies
Hollywood star embroiled in slavery controversy,https://www.news.com.au/web-stories/free/news-com-au/benedict-cumberbatch-could-pay-reparations-due-to-slave-owning-ancestors
World’s safest airline for 2023 revealed,https://www.news.com.au/web-stories/free/news-com-au/qantas-named-worlds-safest-airline-2
The real reason behind new Covid rule for China,https://www.news.com.au/web-stories/free/news-com-au/china-covid-rule-health-minister-mark-butler-explains-new-covid-rule
Woman’s viral ‘hangover cure’ praised online,https://www.news.com.au/web-stories/free/news-com-au/womans-viral-hangover-cure-praised-online
Avoid the biggest tourist mistakes in London,https://www.news.com.au/web-stories/free/news-com-au/avoid-the-biggest-tourist-mistakes-in-london-england
Azealia Banks’ most controversial moments,https://www.news.com.au/web-stories/free/news-com-au/azealia-banks-most-controversial-moments
Zoe Foster Blake’s Go-To skincare company has suffered $73 million hit,https://www.news.com.au/web-stories/free/news-com-au/zoe-foster-blakes-go-to-skincare-company-has-suffered-73-million-hit
'Gender pain gap' killing Aussie women,https://www.news.com.au/web-stories/free/news-com-au/gender-pain-gap-sinister-issue-killing-australian-women
Australia’s housing bubble could be ‘about to burst’,https://www.news.com.au/web-stories/free/news-com-au/australias-housing-bubble-could-be-about-to-burst
AFL star looks absurdly ripped in new photo,https://www.news.com.au/web-stories/free/news-com-au/bailey-smith-has-left-fans-giddy-with-new-photos
Big clue about White Lotus Season 3 revealed,https://www.news.com.au/web-stories/free/news-com-au/big-white-lotus-clue-reveals-where-season-3-could-be-filmed
China abandons reporting daily Covid figures,https://www.news.com.au/web-stories/free/news-com-au/china-abandons-reporting-daily-covid-figures
Meghan blames Australia for her downfall,https://www.news.com.au/web-stories/free/news-com-au/meghan-markle-blames-australia-for-her-royal-downfall
Generation more likely to call in sick to work,https://www.news.com.au/web-stories/free/news-com-au/the-generation-thats-more-likely-to-call-in-sick-to-work
Meghan’s big royal claim branded a ‘total lie’,https://www.news.com.au/web-stories/free/news-com-au/harry-and-meghan-netflix-meghans-claim-a-total-lie-2
Elon Musk no longer world's richest person,https://www.news.com.au/web-stories/free/news-com-au/bernard-arnault-is-worlds-richest-person-replacing-elon-musk
Reason Aussies are being diagnosed with ADHD,https://www.news.com.au/web-stories/free/news-com-au/real-reason-more-australians-are-being-diagnosed-with-adhd
Margot Robbie’s wild Brad Pitt confession,https://www.news.com.au/web-stories/free/news-com-au/margot-robbies-wild-brad-pitt-kiss-confession
Dyson release most 'bizarre' product to date,https://www.news.com.au/web-stories/free/news-com-au/dyson-zone-controversial-air-purifying-headphones-released
Reason for spike in meningococcal cases,https://www.news.com.au/web-stories/free/news-com-au/meningococcal-australia-why-is-there-a-spike-in-cases
Celine diagnosed with Stiff Person Syndrome,https://www.news.com.au/web-stories/free/news-com-au/stiff-person-syndrome-disease-thats-cancelled-celine-dions-music-career
Hidden Aussie beach better than Byron,https://www.news.com.au/web-stories/free/news-com-au/cellito-beach-hidden-aussie-coastal-town-better-than-byron
Full moon will make these star signs cheat,https://www.news.com.au/web-stories/free/news-com-au/full-moon-will-make-aquarius-sagittarius-libra-star-signs-cheat
Shocking statistic plaguing workplaces,https://www.news.com.au/web-stories/free/news-com-au/shocking-statistic-plaguing-australian-workplaces
'Less than a year to live': Man's warning to tradies,https://www.news.com.au/web-stories/free/news-com-au/silicosis-aussie-tradie-has-less-than-a-year-to-live-after-diagnosis
‘Confusing’ relationship 1 in 10 Aussies are in,https://www.news.com.au/web-stories/free/news-com-au/situationship-new-relationship-trend-emerges-in-2022-tinder-report
Anger boils over as China Covid rule backfires,https://www.news.com.au/web-stories/free/news-com-au/xi-jinping-asked-to-resign-as-china-covid-protests-grow
Surprising Botox service on rise in Australia,https://www.news.com.au/web-stories/free/news-com-au/aussies-seeking-botox-injections-turning-to-dentists
'Evil': Why Nicole Kidman is being cancelled,https://www.news.com.au/web-stories/free/news-com-au/nicole-kidman-backlash-amid-balenciaga-child-pornography-scandal
"Woman ditches Sydney, doubles salary, buys home",https://www.news.com.au/web-stories/free/news-com-au/midwife-ditches-sydney-for-alice-springs-and-doubles-salary
The surprising most watched TV show,https://www.news.com.au/web-stories/free/news-com-au/yellowstone-is-the-most-popular-tv-show-in-america
‘I f***ed up’: Billionaire’s net worth vanishes,https://www.news.com.au/web-stories/free/news-com-au/billionaire-sam-bankman-frieds-net-worth-vanishes-after-ftx-and-alameda-disaster
Why did Deliveroo collapse in Australia?,https://www.news.com.au/web-stories/free/news-com-au/deliveroo-goes-into-voluntary-administration-in-australia
"'Just do it!': 20,000 signatures in eight hours",https://www.news.com.au/web-stories/free/news-com-au/petition-20000-signatures-to-help-child-sexual-abuse-survivors
"‘Um, sorry?’: Rebel slammed over party post",https://www.news.com.au/web-stories/free/news-com-au/rebel-wilson-criticised-for-partying-after-birth-of-daughter
One job tennis star Ash Barty will ‘never’ pursue,https://www.news.com.au/web-stories/free/news-com-au/one-job-tennis-star-ash-barty-will-never-pursue
Charles’ ‘deepest regret’ from Lady Di’s funeral,https://www.news.com.au/web-stories/free/news-com-au/king-charles-deepest-regret-from-princess-dianas-funeral
Sad truth behind Jen Aniston’s ‘pregnancy’,https://www.news.com.au/web-stories/free/news-com-au/jennifer-aniston-opens-up-about-secret-ivf-struggle
Tornado warning as rain band moves in,https://www.news.com.au/web-stories/free/news-com-au/weather-tornado-warning-as-rain-band-moves-towards-nsw
Australia’s $5b phoenix operation set to explode,https://www.news.com.au/web-stories/free/news-com-au/pheonixing-australias-5b-operation-set-to-explode
'Now pay': Chaos over Musk Twitter prank,https://www.news.com.au/web-stories/free/news-com-au/elon-musks-twitter-takeover-backfires-after-celeb-prank
Surprise truth about quiet quitting exposed,https://www.news.com.au/web-stories/free/news-com-au/quiet-quitting-australian-expert-reveals-the-truth-about-job-trend
Company's big work day shake-up pays off,https://www.news.com.au/web-stories/free/news-com-au/unilever-australia-to-trial-four-day-work-week
Aussie singer's staggering fortune revealed,https://www.news.com.au/web-stories/free/news-com-au/tones-and-is-staggering-fortune-revealed
Hamish and Zoe Foster Blake’s home is wild,https://www.news.com.au/web-stories/free/news-com-au/hamish-and-zoe-foster-blakes-sydney-home-is-wild
Surprise love story of China’s most powerful man,https://www.news.com.au/web-stories/free/news-com-au/surprising-love-story-of-chinas-most-powerful-man
Bizarre plant trend on the rise in Australia,https://www.news.com.au/web-stories/free/news-com-au/plant-parenting-is-a-new-trend-aussies-are-getting-around
21yo earns six figures working just three hours,https://www.news.com.au/web-stories/free/news-com-au/dropshipping-how-21yo-earns-six-figures-working-just-three-hours
What would a recession mean for Australia?,https://www.news.com.au/web-stories/free/news-com-au/what-would-a-recession-mean-for-australia
When the La Nina rain event will end,https://www.news.com.au/web-stories/free/news-com-au/australia-weather-la-nina-when-will-the-rain-stop
Inside the most beautiful Macca's in the world,https://www.news.com.au/web-stories/free/news-com-au/inside-the-most-beautiful-mcdonalds-in-the-world
Top 3 emojis that make you 'less likeable',https://www.news.com.au/web-stories/free/news-com-au/top-3-phone-emojis-that-make-you-more-likeable
Carrie’s career option no one saw coming,https://www.news.com.au/web-stories/free/news-com-au/carrie-bickmores-next-move-after-leaving-the-project
'Legend': Aussie’s 'insane' $1.5m journey,https://www.news.com.au/web-stories/free/news-com-au/nedd-brockmanns-1-5-million-journey-across-australia
‘Beaten down’: Terrible news for Melburnians,https://www.news.com.au/web-stories/free/news-com-au/beaten-down-and-broken-terrible-news-for-melburnians
Aussie town that's home to new big landmark,https://www.news.com.au/web-stories/free/news-com-au/regional-victorian-town-named-home-to-big-rainbow
Drama behind multimillion-dollar divorce,https://www.news.com.au/web-stories/free/news-com-au/tom-brady-gisele-bundchens-multimillion-dollar-divorce
Vegan protester making thousands,https://www.news.com.au/web-stories/free/news-com-au/tash-peterson-vegan-protester-and-onlyfans-stars-notorious-stunts
‘Step up’: Report angering a lot of men,https://www.news.com.au/web-stories/free/news-com-au/rise-of-single-lonely-men-psychologist-slammed-online
Star signs most likely to be serial killers,https://www.news.com.au/web-stories/free/news-com-au/astrology-star-signs-most-likely-to-be-serial-killers
New ‘R’ car plate for Aussie motorists,https://www.news.com.au/web-stories/free/news-com-au/new-r-car-plate-for-aussie-motorists
Millions to go beyond ‘quiet quitting’,https://www.news.com.au/web-stories/free/news-com-au/quiet-quitting-millions-of-australians-to-leave-their-job
Shopping hack Aussie tourists don’t know about,https://www.news.com.au/web-stories/free/news-com-au/tourist-discount-aussies-dont-know-about
Real reason you can't use your phone on plane,https://www.news.com.au/web-stories/free/news-com-au/experts-reveal-why-you-need-to-turn-off-your-phone-on-a-flight
Mystery surrounding sex act finally solved,https://www.news.com.au/web-stories/free/news-com-au/sex-and-relationships-is-squirting-actually-a-thing
Proof Keanu Reeves may be the nicest guy on Earth,https://www.news.com.au/web-stories/free/news-com-au/keanu-reeves-may-be-the-nicest-guy-on-earth
Five signs your partner wants a divorce,https://www.news.com.au/web-stories/free/news-com-au/relationships-five-signs-your-partner-wants-a-divorce
