title,url
‘LONG-LASTING DAMAGE’: Australia’s huge Covid lies finally exposed,https://www.news.com.au/national/australias-huge-covid-lies-finally-exposed/news-story/44c571e0f0f3f2100226b709717638af
King Charles’ horror scenario comes true,https://www.news.com.au/entertainment/celebrity-life/royals/king-charles-nightmare-comes-true-a-the-crown-trailer-drops/news-story/af5153fef505f4514392aae03550a743
‘Too fat’: Woman’s plane rant sparks fury,https://www.news.com.au/travel/travel-advice/flights/sydney-watson-makes-massive-call-after-fat-flight-nightmare/news-story/0553d2046d026f941815d00940eab483
‘This is serious’: Monster storm threat,https://www.news.com.au/technology/environment/this-is-serious-huge-storms-heavy-rain-set-to-smash-east-coast/news-story/0de0e45d7a89a788af7dd7b5991b3f8b
Covid poll: Do you regret getting vaccinated?,https://www.news.com.au/world/coronavirus/australia/covid-poll-a-pulse-check-of-australia-as-we-exit-the-pandemic/news-story/cb910eb5525d0dd24ca38ff5a6240822
Proof Sydney has officially lost it,https://www.news.com.au/finance/real-estate/selling/dilapidated-strathfield-house-selling-for-5m/news-story/d7a575223d47ccea9671ae35c4ed269f
‘Sick and tired’: Radio stars’ fury,https://www.news.com.au/entertainment/tv/radio/sick-and-tired-of-working-here-kyle-and-jackie-os-dramafilled-year/news-story/d22c4b2fc7a233a9d906f6628301f2ec
‘Betrayed’: Tennis star banned for doping,https://www.news.com.au/sport/tennis/betrayed-former-world-no-1-tennis-star-banned-for-doping/news-story/7de6f7362e455b485e280bcd23ce23a1
Massive escalation of Trump legal drama,https://www.news.com.au/world/north-america/us-politics/trump-ally-bannon-sentenced-to-prison-for-contempt-of-congress/news-story/ce3774fe5b30b5ed6000cc911c1b9051
"Messy new twist in Wilde, Sudeikis drama",https://www.news.com.au/entertainment/celebrity-life/jason-sudeikis-exgirlfriend-shades-olivia-wilde/news-story/27095a2d90dd04fac275f864f20dfa8f
‘Insane’: Model’s daring backless dress stuns,https://www.news.com.au/lifestyle/fashion/celebrity/inside-ghds-starstudded-launch-party-for-2022-christmas-collection/news-story/6a58d0ad5fd74a938875c9e590f3989b
Suitcase trick every traveller should do,https://www.escape.com.au/travel-advice/always-take-a-photo-of-your-suitcase-before-you-travel/news-story/f42740ea4c5c8c53c8b0b6765091435b
UK’s Sunak qualifies for PM race as Johnson eyes comeback,https://www.news.com.au/breaking-news/uks-sunak-qualifies-for-pm-race-as-johnson-eyes-comeback/news-story/09de8fb796b426b339eb569b677b67ab
"US, Russian defence ministers hold rare call as Ukraine advances",https://www.news.com.au/breaking-news/russia-says-fortress-kherson-readying-for-ukraine-attack/news-story/8fe525533562443a2c5f0c8b4fd10117
‘Daddy was sick’: NRL star’s cruel disease,https://www.news.com.au/national/queensland/news/paul-greens-family-break-their-silence-over-nrl-stars-death/news-story/c2751f9ce2357566f72487eb6aa28e36
What Not To Wear star’s surprise career 180,https://www.news.com.au/best-of/beauty/trinny-woodall-reveals-trinny-london-makeup-company/news-story/854eb5d74f46acbb87a01ebf1f8cac7c
Corden backtracks on restaurant apology,https://www.news.com.au/entertainment/celebrity-life/james-corden-says-its-beneath-him-to-care-about-nyc-restaurant-drama-i-did-nothing-wrong/news-story/b77300a1d63189962902f2a72ae05782
‘Sick and tired’: Radio stars’ fury,https://www.news.com.au/entertainment/tv/radio/sick-and-tired-of-working-here-kyle-and-jackie-os-dramafilled-year/news-story/d22c4b2fc7a233a9d906f6628301f2ec
Hollywood star’s huge win over Netflix,https://www.news.com.au/entertainment/celebrity-life/royals/big-change-to-netflixs-the-crown-after-judi-dench-complained-of-crude-sensationalism/news-story/9b67ac7dd3f6fbdeab144bc494b4399a
Megan’s savage response to mum-shamer,https://www.news.com.au/entertainment/celebrity-life/megan-fox-hits-back-at-mumshamer-asking-where-your-kids-at/news-story/62ed401889340e0c7e44a83ddea7504f
"Staff ‘broken’ working for Harry, Meghan",https://www.news.com.au/entertainment/celebrity-life/royals/royal-staff-quite-broken-working-for-prince-harry-and-meghan-markle-author/news-story/7ef84e1140f5cf1fee2ba912c90ec048
13 hours of deliberation in rape trial,https://www.news.com.au/national/nsw-act/courts-law/bruce-lehrmann-rape-trial-will-continue-into-next-week/news-story/5b2ea9a443898ca8913c89f1e416807b
Aussie stars in tears over Hampson tribute,https://www.news.com.au/sport/nrl/aussie-stars-in-tears-over-hampson-tribute-before-scotland-match/news-story/8f93a408f37d7d24f2150bc07d8e0a76
Aussies set for cash boost,https://www.news.com.au/finance/economy/australian-economy/what-we-know-so-far-about-albanese-governments-first-budget/news-story/1ea7796d09399272e981e518b561d284
‘Finger up my a***’ claim rocks basketball,https://www.news.com.au/sport/basketball/melbourne-uniteds-chris-goulding-claims-nbl-rival-put-finger-up-my-a/news-story/cad479519bc0b94bc1051d30a879c0d2
Final racist place name removed from map,https://www.news.com.au/national/queensland/queensland-removes-last-racial-slur-from-states-place-names/news-story/a90f0aa61ac254cd928b39daa1275d6d
‘Infuriated’: Wild twist in Ronaldo revolt,https://www.news.com.au/sport/football/infuriated-manager-confirms-wild-twist-in-ronaldo-revolt/news-story/bd6d4754a3418a650ce58afb0d51b6f1
‘Fake Barbie’ jailed for murdering boyfriend,https://www.news.com.au/world/europe/fake-barbie-model-jailed-for-life-after-murdering-boyfriend-when-he-ended-relationship/news-story/03bbc690c362a1e026ed634e9ff0a49b
Hilarious Ricciardo stunt takes US by storm,https://www.news.com.au/sport/motorsport/formula-one/daniel-ricciardo-makes-greatest-entrance-ever-to-us-grand-prix-on-a-horse/news-story/43ecd10f4e86068e75302597aa1e30e1
Bullied ginger-haired girl has last laugh,https://www.news.com.au/lifestyle/real-life/news-life/miss-englands-first-ginger-champ-reveals-she-was-bullied-over-her-hair/news-story/0b51ed3877e8ac6b152afe799e5f0337
Tom Brady’s five-word answer says it all,https://www.news.com.au/sport/american-sports/nfl/tom-brady-gives-fiveword-answer-to-nfl-retirement-question/news-story/efcc7e1e1244c66f4d45f1a25d40c933
Where rents have exploded by 40 per cent,https://www.realestate.com.au/news/where-rent-prices-have-skyrocketed-the-most-some-up-to-40-in-a-year/?rsf=syn:news:nca:rea:news-strap
True pain of Millennial home search revealed,https://www.realestate.com.au/news/millennials-housing-pain-confirmed-by-australian-bureau-of-statistics/?rsf=syn:news:nca:news:spa:strap
Elton John moving to sky-high treehouse,https://www.realestate.com.au/news/elton-john-buys-treehouseinspired-penthouse-at-king-toronto-development/?rsf=syn:news:nca:news:spa:strap
Star’s adult lunch boxes go viral,https://www.news.com.au/lifestyle/food/eat/chefs-videos-making-lunch-boxes-for-mate-goes-viral-on-tiktok/news-story/592a4d97a04c3cb6120809a4a175fda1
Frenzy over star’s incredibly racy $80 dress,https://www.news.com.au/lifestyle/fashion/celebrity/inside-starstudded-white-fox-party-in-la-with-kid-laroi-performance/news-story/5e0c56c412324c1da6bbbeff0c0ebc31
Surprise detail behind surf star’s comeback,https://www.news.com.au/lifestyle/health/wellbeing/how-camping-helped-australian-owen-wright-get-his-life-back-after-a-brain-injury/news-story/7d56832dcdda36356861abe328a76dd6
Gross food behind man’s transformation,https://www.news.com.au/lifestyle/fitness/inspiration/liver-king-reveals-gross-food-items-behind-his-fanatic-transformation/news-story/173eee9870879f50e3f494de4d07243d
Wild lie sociopath told boss to get out of work,https://www.news.com.au/lifestyle/health/health-problems/australian-sociopath-reveals-pros-and-cons-of-her-condition-at-work/news-story/ab352f6edfc8ecdf8f8112051963e05e
Annoying habit derailing your work life,https://www.seek.com.au/career-advice/article/the-5-personality-traits-that-are-holding-you-back-at-work?tracking=DAC-NAS-NCS_2020-25748&utm_campaign=NCS_2020&utm_source=Newcorp&utm_medium=Display&utm_content=Vis_CA_AO_WPTWB
‘My husband left me for my daughter’,https://www.kidspot.com.au/news/womans-disgust-after-her-exhusband-starts-a-family-with-her-daughter/news-story/ac06d4d3a083cda3a2bd79cac8c99209
‘Perfect’ dupe for $2.7k Chanel sandals,https://www.news.com.au/best-of/fashion/best-summer-sandals/news-story/4d9f0c8045c3dc36647ccbd7b6bb6d93
‘Bring police’: Qantas flyer clashes with staff,https://www.news.com.au/travel/travel-updates/incidents/qantas-passenger-clashes-with-flight-attendant-refuses-to-leave-aircraft/news-story/daaf44647dc2f77048fd985866eb6100
Secret in Byron no one told you about,https://www.news.com.au/travel/the-rural-secrets-you-didnt-know-about-byron-bay/news-story/85a005b2ac3662a1f70696d3317eddba
Disturbing video proves US is in ‘crisis’,https://www.news.com.au/travel/travel-updates/incidents/stars-disturbing-clip-of-homeless-crisis-in-california/news-story/e987cab0094c596ad2dafda4f325b3f6
Baby killed in horror giraffe safari attack,https://www.news.com.au/travel/travel-updates/incidents/baby-girl-killed-and-her-mum-fighting-for-life-after-raging-giraffe-tramples-them-in-south-africa/news-story/2ba820c29bc5a7a09f7474ffec8d3aff
Kaley Cuoco’s controversial hostie comment,https://www.news.com.au/travel/travel-advice/flights/should-you-tip-cabin-crew-kaley-cuoco-says-flight-attendants-deserve-gratuity/news-story/24e6522cd1c732efdd14ab2ca59b9dcf
Fans lose it over Taylor Swift career-first,https://www.news.com.au/entertainment/music/taylor-swift-announces-major-careerfirst-with-release-of-new-album/news-story/3fb13472b001b01cb89e9665827cd526
‘Dark and disturbing’ Netflix movie,https://www.news.com.au/entertainment/movies/movie-reviews/the-stranger-pushes-into-the-dark-and-disturbing-aspects-of-human-nature/news-story/548837d87db665252dd70d2fd5bdce59
Ed Sheeran reveals brutal Bond snub,https://www.news.com.au/entertainment/movies/ed-sheeran-hurt-over-james-bond-theme-song-snub/news-story/ca7fd139ad5bfcb6886687436437c54a
Billy Ray’s secret history with Aussie singer,https://www.news.com.au/entertainment/celebrity-life/hook-ups-break-ups/billy-ray-cyrus-and-firerose-confirm-engagement-reveal-they-met-a-decade-ago/news-story/7101797ebe1f14a3804156358217917b
Kyle and Jackie O dramatically exit mid-show,https://www.news.com.au/entertainment/tv/radio/kyle-and-jackie-o-dramatically-exit-midshow/news-story/e468f571be42c4cbb2b3bfd04ed85fe7
Why Aussies hit harder by hackers,https://www.news.com.au/technology/online/hacking/why-aussies-hit-harder-by-major-cyber-attacks-than-other-countries/news-story/b022e6a76c14ded89f24997f8b05ef73
Major Aussie company hacked,https://www.news.com.au/technology/online/hacking/energy-australia-hacked-after-data-stolen-from-medibank-optus/news-story/7fd668f480e8ab0b8c227fd772ed530f
Wild confrontation on commuter train,https://www.news.com.au/technology/online/fing-oath-insane-rant-on-sydney-train-recorded/news-story/234ec394a3750ac3bb3bff684f22279c
World’s richest man’s brutal plan revealed,https://www.news.com.au/technology/online/social/elon-musk-plans-to-sack-thousands-in-twitter-purchase/news-story/e01e72a4e0e328be33fe9a3b6169684b
"China could invade Taiwan this year, US says",https://www.news.com.au/technology/innovation/military/china-could-invade-taiwan-this-year-us-admiral-warns/news-story/65f0e86d70ec7cb7964bb9bb3d1cf68d
Trick to turn $500k property into $10m,https://www.news.com.au/finance/money/investing/use-equity-in-a-500000-property-to-make-10-million/news-story/90a5fca46b913d103ef17b3055d5519d
‘Raises questions’: ABC pinned over ‘bias’,https://www.news.com.au/finance/business/media/raises-questions-media-watch-pins-abc-over-partnership-with-lgbt-group-acon/news-story/9cb3a54423f9cb2f67339c0da72bb5f6
"The $500,000 job no Aussie wants",https://www.news.com.au/finance/work/careers/doctors-could-earn-500k-and-a-free-house-for-taking-job-in-idyllic-regional-town/news-story/2507a3b74fca2cd61b6a963f1ed84f0d
Husband keeps dark secret from his wife,https://www.news.com.au/finance/money/investing/brisbane-woman-and-sydney-man-lose-fortunes-to-sophisticated-scam/news-story/9b7800ee655e26fbaed1318620cfd6a3
Treasurer’s horror fruit and veg warning,https://www.news.com.au/finance/economy/australian-economy/fruit-and-vegetable-prices-set-to-leap-by-8-per-cent-after-october-floods/news-story/f9666bf8c7d7b6e834af62e17471517e
Two-time champs ‘crash out’ of World Cup,https://www.news.com.au/sport/cricket/ireland-knock-twotime-champions-west-indies-out-of-t20-world-cup-in-extraordinary-upset/news-story/fc557e496c24dd295f8b3414d8aa7b8b
Controversy as Aussie stars robbed of victory,https://www.news.com.au/sport/cricket/usman-khawaja-dismayed-after-umpire-call-robs-queensland-of-sheffield-shield-win/news-story/5a4a03a6cbcbc3ba38b2d2dd23c34cdb
Sad reason Aussie left mates before death,https://www.news.com.au/sport/nrl/queensland-rugby-league-player-liam-hampson-found-dead-in-barcelona-nightclub/news-story/444e768e24575da346e774ccb45c087d
Manly royalty axed in ruthless bloodletting,https://www.news.com.au/sport/nrl/manly-bloodletting-continues-as-fulton-blindsided-in-ruthless-axing/news-story/c6a1ad823f29a333de6035028fa602f0
Bathurst champion dating team owner,https://www.news.com.au/sport/motorsport/v8-supercars/bathurst-champion-shane-van-gisbergen-reportedly-dating-triple-eight-racing-coowner/news-story/64de32327dd4a94ca0443816f7dcf884
‘Beyond appalled’: Nightclub breaks silence,https://www.news.com.au/sport/nrl/queensland-rugby-league-player-liam-hampson-found-inside-internal-patio-at-spanish-nightclub/news-story/d13e6bce90c013b705354c5aad1f4dc6
Stunning twist in chess ‘cheating’ scandal,https://www.news.com.au/sport/sports-life/hans-niemann-sues-magnus-carlsen-chesscom-and-hikaru-nakamura-for-defamation/news-story/3a572c1abb5660f4e1202fd613c58bc4
Aus rugby slams ‘laughable’ Kiwi demand,https://www.news.com.au/sport/rugby/rugby-australia-rubbishes-laughable-call-to-ditch-the-melbourne-rebels/news-story/bea37dd482f1f822123a5e41572515d6
"20% off Nike, Adidas, ASICS and more",https://www.news.com.au/best-of/sales-and-deals/best-deals-for-the-iconic/news-story/56e74e33c5ac0bc5305bdfce5e76d565
‘Macabre’ Christmas tree decoration takes off,https://www.news.com.au/best-of/home/best-christmas-tree-decorations/news-story/e47c66e861a56d842e7531d3c56bbdfc
The Iconic drops ‘amazing’ beauty advent calendar,https://www.news.com.au/best-of/gifts/best-beauty-makeup-advent-calendars/news-story/72be262a79047da998f6c49f740c7673
Google Pixel 7 Pro review: ‘Simply superb’,https://www.news.com.au/best-of/electronics/gadgets/google-pixel-7-pro-review/news-story/78b86c4db2ef161a47920458d62c495b
Spotted: $100 off Apple AirPods Pro,https://www.news.com.au/best-of/electronics/gadgets/best-apple-airpods-deals-australia/news-story/2455b71bdbf80c9aa667eb0472454906
Inside the most beautiful Macca's in the world,https://www.news.com.au/web-stories/free/news-com-au/inside-the-most-beautiful-mcdonalds-in-the-world
Here's when the La Nina rain event will end,https://www.news.com.au/web-stories/free/news-com-au/australia-weather-la-nina-when-will-the-rain-stop
Top 3 emojis that make you 'less likeable',https://www.news.com.au/web-stories/free/news-com-au/top-3-phone-emojis-that-make-you-more-likeable
Hidden Aussie beach better than Byron,https://www.news.com.au/web-stories/free/news-com-au/cellito-beach-hidden-aussie-coastal-town-better-than-byron
Carrie’s career option no one saw coming,https://www.news.com.au/web-stories/free/news-com-au/carrie-bickmores-next-move-after-leaving-the-project
'Legend': Aussie’s 'insane' $1.5m journey,https://www.news.com.au/web-stories/free/news-com-au/nedd-brockmanns-1-5-million-journey-across-australia
Shock Aussie flight trend revealed,https://www.news.com.au/web-stories/free/news-com-au/aussie-travel-trend-behind-international-flight-searches
‘Beaten down’: Terrible news for Melburnians,https://www.news.com.au/web-stories/free/news-com-au/beaten-down-and-broken-terrible-news-for-melburnians
Aussie town that's home to new big landmark,https://www.news.com.au/web-stories/free/news-com-au/regional-victorian-town-named-home-to-big-rainbow
The terror attack that changed Australia forever,https://www.news.com.au/web-stories/free/news-com-au/bali-bombings-anniversary-how-the-2002-attacks-unfolded
Drama behind multimillion-dollar divorce,https://www.news.com.au/web-stories/free/news-com-au/tom-brady-gisele-bundchens-multimillion-dollar-divorce
Vegan protester making thousands,https://www.news.com.au/web-stories/free/news-com-au/tash-peterson-vegan-protester-and-onlyfans-stars-notorious-stunts
Dark warning for Aussie homeowners,https://www.news.com.au/web-stories/free/news-com-au/interest-rate-rise-australia-grim-warning-for-homeowners
‘Step up’: Report angering a lot of men,https://www.news.com.au/web-stories/free/news-com-au/rise-of-single-lonely-men-psychologist-slammed-online
Star signs most likely to be serial killers,https://www.news.com.au/web-stories/free/news-com-au/astrology-star-signs-most-likely-to-be-serial-killers
‘Disgusting’: Backlash to Kanye’s wild claim,https://www.news.com.au/web-stories/free/news-com-au/kanye-west-slammed-after-paris-fashion-week-stunt
New ‘R’ car plate for Aussie motorists,https://www.news.com.au/web-stories/free/news-com-au/new-r-car-plate-for-aussie-motorists
Princess Mary pulled into ‘difficult’ royal row,https://www.news.com.au/web-stories/free/news-com-au/royal-family-princess-mary-pulled-into-difficult-row
Millions to go beyond ‘quiet quitting’,https://www.news.com.au/web-stories/free/news-com-au/quiet-quitting-millions-of-australians-to-leave-their-job
Shopping hack Aussie tourists don’t know about,https://www.news.com.au/web-stories/free/news-com-au/tourist-discount-aussies-dont-know-about
Real reason you can't use your phone on plane,https://www.news.com.au/web-stories/free/news-com-au/experts-reveal-why-you-need-to-turn-off-your-phone-on-a-flight
Mystery surrounding sex act finally solved,https://www.news.com.au/web-stories/free/news-com-au/sex-and-relationships-is-squirting-actually-a-thing
'Staggering': Disturbing trend at Aussie brands,https://www.news.com.au/web-stories/free/news-com-au/jb-hi-fi-nick-scali-baby-bunting-disturbing-trend-at-aussie-brands
Queen's biggest wish before her death,https://www.news.com.au/web-stories/free/news-com-au/queen-elizabeths-biggest-wish-was-to-heal-harry-meghan-rift
'Chaos': Rain bomb to smash Australia,https://www.news.com.au/web-stories/free/news-com-au/sydney-weather-australia-smashed-by-rain-band
Proof Keanu Reeves may be the nicest guy on Earth,https://www.news.com.au/web-stories/free/news-com-au/keanu-reeves-may-be-the-nicest-guy-on-earth
Five signs your partner wants a divorce,https://www.news.com.au/web-stories/free/news-com-au/relationships-five-signs-your-partner-wants-a-divorce
Aussies jump on popular travel trend,https://www.news.com.au/web-stories/free/news-com-au/best-pet-friendly-holiday-homes-in-australia
'Regrettable': Adam Levine cheating scandal explodes,https://www.news.com.au/web-stories/free/news-com-au/adam-levine-accused-of-secret-affair-with-models
Truth about Princess Kate's secret double life,https://www.news.com.au/web-stories/free/news-com-au/the-truth-about-kate-middletons-secret-double-life
New law to get Boomers to sell their homes,https://www.news.com.au/web-stories/free/news-com-au/real-estate-new-law-to-get-boomers-to-sell-their-homes
Fans accuse Harry of 'disrespectful' act,https://www.news.com.au/web-stories/free/news-com-au/queens-funeral-royal-watchers-slam-harrys-disrespectful-act
'Return it': War erupts over Queen’s $591m jewel,https://www.news.com.au/web-stories/free/news-com-au/queens-funeral-war-erupts-over-royal-591m-jewel
Meghan blindsided by kids' new titles,https://www.news.com.au/web-stories/free/news-com-au/queens-death-meghan-blindsided-by-archie-and-lilibets-new-royal-titles
'Dead money': Aussies refusing to buy house,https://www.news.com.au/web-stories/free/news-com-au/millennials-are-ditching-buying-a-house-and-investing-in-shares-instead
Justin Bieber reveals 'horrible' diagnosis,https://www.news.com.au/web-stories/free/news-com-au/what-is-ramsay-hunt-syndrome-justin-bieber-reveals-diagnosis
Who will inherit Queen's most precious tiaras,https://www.news.com.au/web-stories/free/news-com-au/who-will-inherit-queen-elizabeths-most-famous-tiaras
'Unrelenting': Country on the brink of disaster,https://www.news.com.au/web-stories/free/news-com-au/climate-change-pakistan-on-the-brink-of-disaster
'Incredible': New show everyone is obsessed with,https://www.news.com.au/web-stories/free/news-com-au/jeremy-allen-white-reacts-to-the-bear-thirst-obsession
Meghan request that delayed Fab Four walk,https://www.news.com.au/web-stories/free/news-com-au/queen-death-meghan-markle-request-that-delayed-fab-four-walk
Best looks from Emmy Awards red carpet,https://www.news.com.au/web-stories/free/news-com-au/2022-emmy-awards-fashion-zendaya-leads-best-looks-on-red-carpet
Surprise reaction to Meghan's 'lovely' act,https://www.news.com.au/web-stories/free/news-com-au/queen-death-meghan-reunites-with-harry-will-kate
Fans call out William's behaviour towards Kate,https://www.news.com.au/web-stories/free/news-com-au/queens-death-fans-call-out-prince-williams-behaviour-towards-kate
Queen Elizabeth’s most playful moments,https://www.news.com.au/web-stories/free/news-com-au/good-evening-mr-bond-queen-elizabeths-most-playful-moments
'Much-loved': Harry and William’s touching tribute,https://www.news.com.au/web-stories/free/news-com-au/prince-harry-and-prince-williams-heartwarming-tribute-to-queen
'Finally': Apple reveals huge iPhone change,https://www.news.com.au/web-stories/free/news-com-au/latest-iphone-14-released-by-apple-comes-with-a-hefty-price
The Queen's three most defining moments,https://www.news.com.au/web-stories/free/news-com-au/royals-queen-elizabeth-iis-most-defining-moments
Sexuality type we don’t talk about,https://www.news.com.au/web-stories/free/news-com-au/asexuality-sexuality-type-we-dont-talk-about-often
‘Rubbish’: Real reason Tracy Grimshaw quit,https://www.news.com.au/web-stories/free/news-com-au/tracy-grimshaw-reveals-why-shes-leaving-a-current-affair
'Not the truth': Film's wild drama explained,https://www.news.com.au/web-stories/free/news-com-au/dont-worry-darling-drama-harry-styles-appears-to-spit-on-chris-pine
Rare weather event 'SAM' to smash Australia,https://www.news.com.au/web-stories/free/news-com-au/what-is-sam-rare-weather-phenomenon-to-smash-australia
New dating trend as 'hook-up' culture dies out,https://www.news.com.au/web-stories/free/news-com-au/is-hook-up-culture-dead-new-gen-z-relationships-say-so
Surprise Aussie city wins world’s ‘coolest’ street,https://www.news.com.au/web-stories/free/news-com-au/travel-melbourne-makes-time-outs-coolest-streets-ranking
What really killed Princess Diana,https://www.news.com.au/web-stories/free/news-com-au/what-really-killed-princess-diana
Wild new Taylor Swift conspiracy theory,https://www.news.com.au/web-stories/free/news-com-au/midnights-taylor-swift-fans-reveal-wild-kanye-kardashian-theory
'Lyn is dead': Bombshell verdict in murder trial,https://www.news.com.au/web-stories/free/news-com-au/chris-dawson-trial-ex-teacher-guilty-of-murdering-wife-lynette
'Designer vagina’ surgery is booming,https://www.news.com.au/web-stories/free/news-com-au/why-designer-vagina-surgery-is-booming
The Aussie suburbs with ‘ridiculous’ rent hikes,https://www.news.com.au/web-stories/free/news-com-au/the-ridiculous-rent-hikes-in-aussie-suburbs
Four reasons men get paid considerably more,https://www.news.com.au/web-stories/free/news-com-au/men-get-paid-considerably-more-for-the-same-job-data-reveals
'This is it': Why you won't see actor anymore,https://www.news.com.au/web-stories/free/news-com-au/steve-martin-says-he-will-no-longer-seek-acting-work
Scary trap in new 'quiet quitting' trend,https://www.news.com.au/web-stories/free/news-com-au/scary-trap-in-quiet-quitting-trend-in-aussie-offices
Dangerous sex act on the rise,https://www.news.com.au/web-stories/free/news-com-au/sex-and-relationships-scary-condom-trend-on-the-rise
Why women everywhere hate this man,https://www.news.com.au/web-stories/free/news-com-au/andrew-tate-warning-over-viral-tiktok-rape-culture-videos
'Rare event': Aussies brace for six months of rain,https://www.news.com.au/web-stories/free/news-com-au/weather-aussies-brace-for-six-months-of-rain
Stunning twist in chess ‘cheating’ scandal,https://www.news.com.au/sport/sports-life/hans-niemann-sues-magnus-carlsen-chesscom-and-hikaru-nakamura-for-defamation/news-story/3a572c1abb5660f4e1202fd613c58bc4
15 famous sayings with weird origins,https://www.news.com.au/national/15-famous-sayings-with-weird-origins/audio/cd048662ffa2d0fa5170496dbe924698
