title,url
JURY SENT HOME: Judge has message for jurors in Parliament rape trial,https://www.news.com.au/national/nsw-act/courts-law/jurys-fourth-day-of-deliberations-in-trial-of-bruce-lehrmann-accused-of-raping-brittany-higgins/news-story/93948b02e3ab412145e1191007470edb
‘Just isn’t true’: Teo’s saved patients hit back,https://www.news.com.au/lifestyle/health/health-problems/former-patients-of-dr-charlie-teo-hit-back-at-60-minutes-accusations/news-story/9eaafc9cff88a2a2300259094d09825e
10m Aussies to miss out on $1500 handout,https://www.news.com.au/finance/economy/federal-budget/federal-budget-2022-australia-live-updates/live-coverage/6b6b574a24c95b1b1a61aab0c7a0f13c
Evicted influencer kept secret from landlord,https://www.news.com.au/finance/real-estate/influencer-evicted-from-sydney-rental-for-keeping-dog-secret/news-story/4abaa874da6bca9f532f294a9b0e283b
Serena announces bombshell backflip,https://www.news.com.au/sport/tennis/serena-williams-announces-bombshell-retirement-backflip/news-story/6085678bd09e4a4b21a171b9b9e17e77
‘Strange dots’ appear in Australian outback,https://www.news.com.au/technology/environment/strange-dots-and-markings-appear-in-australian-outback/news-story/cbe8c2312f3c4633999d8634087843c9
Boyfriend’s savage act over revealing outfit,https://www.news.com.au/lifestyle/relationships/dating/boyfriend-dumps-girlfriend-over-inappropriate-halloween-costume/news-story/5ded6c678a67255ab39588dab0d2e805
Rock star loses it at Aussie golf club,https://www.news.com.au/entertainment/music/why-sydney-club-is-on-kings-of-leon-drummers-fk-it-list/news-story/5701f8d0e98486e83e8a687ada32cfb9
Surprising identity of enraged Qantas flyer,https://www.news.com.au/travel/travel-updates/incidents/qantas-passenger-kicked-off-flight-is-high-profile-rugby-player-and-charity-ambassador/news-story/526c18ecec4802f282a86c3016b41b6d
Ex-AFL star suddenly makes $40m fortune,https://www.news.com.au/sport/afl/export-adelaide-star-donald-dickie-makes-40-million-fortune/news-story/81726b32ecd439257cb0387e6ca3ea40
Aquaman star shocks with revealing pics,https://www.news.com.au/entertainment/celebrity-life/celebrity-photos/jason-momoa-bares-it-all-in-tiny-loincloth-on-ocean-fishing-trip/news-story/f46d7ecf6a59c5bab9510040eb4cfcbc
Hilarious pics: Comedy Wildlife Photo Awards,https://www.escape.com.au/news/worlds-funniest-animals-comedy-wildlife-photography-awards-finalists-revealed/image-gallery/c3d98c1d2e97afa82784cdfc9d9893f4?galleryimage=6
‘We don’t eat lithium’: S. America longs for benefits of metal boon,https://www.news.com.au/breaking-news/we-dont-eat-lithium-s-america-longs-for-benefits-of-metal-boon/news-story/c912265c0bd8a1f4c945fc01aa5ed36c
Halloween display deemed too twisted,https://www.news.com.au/lifestyle/parenting/kids/confronting-halloween-decorations-leave-parents-worried-for-kids/news-story/7fa5788a107e9bcf0ef8dee3341ecac3
Bonkers way you can get groceries from Coles,https://www.news.com.au/finance/business/retail/big-change-to-how-coles-delivers-groceries-on-gold-coast/news-story/4eba4522ed23a8a387f6f7ec52482828
What currency is used in Argentina?,https://www.news.com.au/in-the-know-quiz/dashboard
Plot twist in Dench’s beef with Netflix,https://www.news.com.au/entertainment/tv/streaming/plot-twist-in-judi-denchs-beef-with-netflix-show-the-crown/news-story/0a8af8d8925e0a34cb8943cd5df0d804
Block stars go rogue in explosive interview,https://www.news.com.au/entertainment/tv/reality-tv/block-contestants-sharon-and-ankur-slam-the-show-in-radio-interview/news-story/df91da879d96dd9296f45121185690c5
‘Get help’: Ninja Warrior star’s shocking video,https://www.news.com.au/entertainment/tv/reality-tv/ninja-warrior-star-jack-deadly-ninja-wilson-reveals-bizarre-new-habit/news-story/f2ff880ee81863fdafdec3362b7445e2
Radio DJ dies live on air,https://www.news.com.au/entertainment/tv/radio/radio-dj-tim-gough-dies-live-on-air-aged-55/news-story/d78360cab34486582de1ac517356a310
Kim breaks silence on Kanye scandal,https://www.news.com.au/entertainment/celebrity-life/kim-kardashian-breaks-silence-on-kanye-west-scandal-never-ok/news-story/e609962ef42639e0611042904cc83e9d
‘Tokenistic’ act behind $15m netball scandal,https://www.news.com.au/sport/netball/tokenistic-indigenous-act-behind-15m-netball-sponsorship-scandal/news-story/cdf4247244a79746bed6bf0b046f21f0
Halloween display deemed too twisted,https://www.news.com.au/lifestyle/parenting/kids/confronting-halloween-decorations-leave-parents-worried-for-kids/news-story/7fa5788a107e9bcf0ef8dee3341ecac3
‘Pouring blood’: Mum’s gruesome warning,https://www.news.com.au/lifestyle/parenting/kids/mums-horror-after-daughters-everyday-act-leads-to-surgery/news-story/d2d358bad1d0179362cddfcf0438b499
‘Disrespectful’: Star ‘cancelled’ over horror act,https://www.news.com.au/lifestyle/real-life/news-life/australian-influencer-slammed-for-indonesian-meat-market-video/news-story/d56145bda05e1b5b5dcea6713d0abc8a
Backlash flares over Lisa’s netball bomb,https://www.news.com.au/sport/netball/backlash-flares-over-lisa-wilkinsons-netball-comment/news-story/49ee66b9998c6ee2393b394f4376a2a4
Disturbing ‘rape mode’ on popular game,https://www.news.com.au/technology/gaming/overwatch-2-custom-game-depicts-sexual-assault/news-story/d5ae3995120331a9cddb1521c407e8c3
New world leader’s embarrassing gaffes,https://www.news.com.au/world/europe/uk-politics/new-uk-prime-minister-rishi-sunaks-history-of-embarrassing-gaffes/news-story/76d25ddd77b279b7d4665fc0042ef047
Massacre on ‘island of love’ in tribal warfare,https://www.news.com.au/world/pacific/massacre-on-papua-new-guineas-island-of-love-after-tribal-warfare/news-story/b2413ce25acf267425f9277e2c891bdd
Hunt for woman who vanished from beach,https://www.news.com.au/lifestyle/real-life/news-life/indescribable-pain-mothers-desperate-plea-after-daughter-vanishes-from-beach/news-story/d5b3168f8c2169f5131945fe728fb06a
Aussie champ destroys salty Conor McGregor,https://www.news.com.au/sport/ufc/this-is-not-over-conor-mcgregor-takes-swipe-at-aussie-ufc-champion-alex-volkanovski/news-story/14954f1107eef386176e036c73e6493a
"Ritzy homestead has 20 rooms, ballroom",https://www.realcommercial.com.au/news/luxury-goulburn-estate-rhyanna-park-offers-top-end-living-with-a-commercial-farm/?rsf=syn:news:nca:news:spa:rca
Waterfront mansion makes owners $2m+ in 5 years,https://www.realestate.com.au/news/mansion-makes-owner-430000-a-year-for-five-years/?rsf=syn:news:nca:news:spa:strap
’Gold mine’ shack snagged for $95k,https://www.realestate.com.au/news/rustic-onebedder-cottage-sells-for-a-bargain-in-far-north-qld/?rsf=syn:news:nca:news:spa:strap
Kyle Sandilands’ model ex flashes G-string,https://www.news.com.au/lifestyle/fashion/celebrity/inside-australian-fashion-brand-staxs-starstudded-runway-show/news-story/387329a09a4b7662c73b622f093bcf22
‘Best by far’: Woolies new $10 freezer item,https://www.news.com.au/lifestyle/food/eat/connoisseur-releases-new-laneway-sweets-ice-cream-range/news-story/683be37da39dddcd1424e186acabac63
‘Disgusting’: KFC staff caught in ‘feral’ act,https://www.news.com.au/lifestyle/real-life/news-life/aussie-kfc-workers-go-viral-for-disgusting-act-in-afterhours-video/news-story/9fd63f38806a92702871943ca7c74ffd
‘Need’: New $30 Aldi item everyone wants,https://www.news.com.au/lifestyle/beauty/face-body/new-30-aldi-item-customers-declare-they-need/news-story/4d3dca213016924fba479c8d37e45b9e
‘Amazed’: Mum feeds family-of-4 for $106,https://www.news.com.au/lifestyle/food/eat/woman-shares-her-weekly-dinner-shop-from-aldi-for-just-106/news-story/e25b54918d5bd8829e789a977ce1768d
Jobs that want you without a degree,https://www.seek.com.au/career-advice/article/in-demand-jobs-you-dont-need-a-degree-for?tracking=DAC-NAS-NCS_2020-30126&utm_campaign=NCS_2020&utm_source=Newcorp&utm_medium=Display&utm_content=Vis_CA_AO_FTJ
My son’s wife keeps posting monster-in-law jokes,https://www.kidspot.com.au/news/my-sons-new-wife-keeps-posting-monsterinlaw-jokes-online-about-me/news-story/7d536eae76bd48d539ec2fd88b5df281
Stylist sparks frenzy with ‘perfect’ budget pants,https://www.news.com.au/best-of/fashion/best-wide-leg-pants/news-story/4b7bedf3c3a4833f4eb65ce1101de864
Woman ‘praised’ for train seat dilemma,https://www.news.com.au/travel/travel-updates/travel-stories/london-train-passenger-praised-for-refusing-to-give-up-booked-seat-to-old-woman/news-story/73a191a01e05f6b90f165722abdf21f5
Inside ‘hotel from hell’ in elite Sydney suburb,https://www.news.com.au/travel/travel-updates/incidents/inside-manlys-hotel-from-hell-health-authorities-called-in/news-story/18ad23d3b5636d2d01f939e66eab7c6a
‘Not good enough’: Woman’s $1.7k Qantas saga,https://www.news.com.au/travel/travel-updates/incidents/melbourne-womans-twoyear-qantas-refund-saga/news-story/685b587a10b94ddbc939eb35e9831dce
Airline’s explanation for ‘gross’ find in meal,https://www.news.com.au/travel/travel-advice/flights/airlines-explanation-for-cockroach-in-meal/news-story/df971d17634e951693678d9381c6c2c1
Thousands trapped on ship for five days,https://www.news.com.au/travel/travel-ideas/cruises/thousands-of-people-trapped-on-cruise-ship-for-five-days-after-covid19-outbreak/news-story/42f2a722828ad82ee57d0faa724ca1a5
Dark truth behind iconic Friends wedding,https://www.news.com.au/entertainment/tv/flashback/matthew-perry-reveals-tragic-truth-behind-iconic-friends-scene/news-story/a79cce4a1bfdeec415c440da85590680
Bono discovers his cousin is his brother,https://www.news.com.au/entertainment/celebrity-life/u2-frontman-bono-discovers-his-cousin-is-actually-his-halfbrother/news-story/9e7d239ee8cc856e394931eecd903f92
Block stars slam show in heated on-air clash,https://www.news.com.au/entertainment/tv/reality-tv/theres-no-empathy-block-stars-slam-show-in-heated-clash/news-story/13c7b7129ca034c54fc037560a98f4bf
Elle Macpherson’s ‘new boyfriend’ revealed,https://www.news.com.au/entertainment/celebrity-life/hook-ups-break-ups/elle-macpherson-rumoured-to-be-dating-doyle-bramhall-ii/news-story/70430430f19b6cbd14efc8f7d43b0b2f
Graphic scene sickens viewers in TV finale,https://www.news.com.au/entertainment/tv/house-of-the-dragon-episode-ten-recap-finale-leaves-world-on-brink-of-war/news-story/625f16e2ed03db5a7643ec18dea62dcb
When you can expect it to stop raining,https://www.news.com.au/technology/environment/hybrid-cyclone-to-bring-dangerous-conditions-to-southeastern-states/news-story/cc9f2c49decec0b84fc340bf25cd67c3
Updated popular ute and 4WD revealed,https://www.news.com.au/technology/motoring/motoring-news/2023-isuzu-dmax-and-mux-revealed/news-story/01ea27b1a4a48aa7eb9aae4ff96b39d6
Aussie man killed by lightning strike,https://www.news.com.au/technology/environment/pretty-unlucky-man-killed-by-lightning-strike-while-camping-in-south-australia/news-story/ed109ccce5232f8ca7d15a23c78542af
Protesters smear cake on Charles waxwork,https://www.news.com.au/technology/environment/just-stop-oil-protesters-smear-chocolate-cake-on-king-charles-madame-tussauds-waxwork/news-story/b5ab89089742eb88c49b9bebcc7052f0
Hot pre-order offer on new Pokémon game,https://www.news.com.au/best-of/electronics/nintendo-switch-oled/news-story/e82f5092d3d16d8b60e7e436dccc7dbe
Bonkers way you can get groceries from Coles,https://www.news.com.au/finance/business/retail/big-change-to-how-coles-delivers-groceries-on-gold-coast/news-story/4eba4522ed23a8a387f6f7ec52482828
‘You’re wrong’: Gen Z’s new work demand,https://www.news.com.au/finance/work/at-work/millennials-and-gen-z-are-right-about-work-its-time-we-listened/news-story/950bcae3acefa71c2a4a4e0c81e98e5a
Miner banked extra $8.5m every day,https://www.news.com.au/finance/money/investing/lithium-miner-pilbara-minerals-banked-extra-85m-every-day-this-quarter/news-story/398d36f1d13c063e3c52446408a74a48
Three tips for record Powerball jackpot,https://www.news.com.au/finance/money/wealth/half-of-australia-chasing-biggest-ever-powerball-prize/news-story/9bd1a3fa3cf0ff8cca44235c4bd7452b
‘Panic selling’: Stock market plunges,https://www.news.com.au/finance/economy/world-economy/hong-kong-stock-market-plunges-after-president-xi-jinpings-power-grab/news-story/3ff398c50f7a5dcea0bb064efa2b3101
‘Everyone was part of it’: Claim rocks cricket,https://www.news.com.au/sport/cricket/tim-paine-says-tv-cover-up-kept-south-africas-ball-tampering-secret-quiet/news-story/07172506ec75953146b5dc20c2b18dde
Netball boss hits out at players over $2m blow,https://www.news.com.au/sport/netball/money-doesnt-grow-on-trees-netball-boss-hits-out-at-players-over-sponsor-row/news-story/56faae5d594c24b9c44b484add676ab2
Bombers’ culture shredded in brutal review,https://www.news.com.au/sport/afl/essendon-review-makes-strong-findings-after-horror-2022/news-story/7cdd6e2154ea4365870b2a24041ac84c
‘Held accountable’: Fury at Aussie billionaire,https://www.news.com.au/sport/netball/calls-for-gina-rinehart-to-apologise-for-fathers-racist-comments-after-15m-netball-australia-funding-withdrawal/news-story/d76711a478e974bb3c840e9a01771430
‘I was stunned’: Captain’s sexting bombshell,https://www.news.com.au/sport/cricket/held-a-gun-to-my-head-former-captain-tim-paines-sexting-bombshell/news-story/bd02b7f2195c1b8a1254a5944866be81
Wallabies great reveals why he walked away,https://www.news.com.au/sport/rugby/former-wallabies-captain-michael-hooper-opens-up-on-why-he-walked-away/news-story/d4fb13ed33fcd1b344597631e0d197ef
‘Ridiculous’ scenes in World Cup robbery,https://www.news.com.au/sport/cricket/massive-blow-south-africa-robbed-of-crucial-t20-world-cup-win-over-zimbabwe/news-story/f86f254e1e55fbf8de8a26a00cce63cf
Mundine calls out Rinehart’s one big error,https://www.news.com.au/sport/netball/anthony-mundine-calls-out-gina-rinehart-after-netball-australia-sponsorship-saga/news-story/3d80d2b90e48a4f41bbb12e6b88b59a5
80% off ‘great quality’ top-selling UGGs,https://www.news.com.au/best-of/sales-and-deals/best-weekly-deals/news-story/af97627714789f10ac25efa421084ff1
"‘Easy, thrown-on dress’ is huge summer trend",https://www.news.com.au/best-of/fashion/best-puff-sleeve-dresses/news-story/6aa5b7ac65e030b7046cc6357be7f58d
Price drops on new Gotham Knights game,https://www.news.com.au/best-of/electronics/best-playstation-deals-australia/news-story/b5fc04b74062b6b7358de25679c99c41
$350 off: ‘Amazing’ Dyson stick vac sale,https://www.news.com.au/best-of/sales-and-deals/ebay-plus-membership-benefits/news-story/1df9575bd194dea8e08cac5757e18143
11 top-rated dehumidifiers that banish mould,https://www.news.com.au/best-of/home/best-dehumidifiers/news-story/291dc19d22bcff2b9d110c2a0161648a
One word at heart of ugly $15m netball saga,https://www.news.com.au/web-stories/free/news-com-au/15m-netball-australia-gina-rinehart-saga-takes-ugly-turn
European countries on brink of all out war,https://www.news.com.au/web-stories/free/news-com-au/greece-and-turkey-tensions-on-the-brink-of-open-conflict
When the La Nina rain event will end,https://www.news.com.au/web-stories/free/news-com-au/australia-weather-la-nina-when-will-the-rain-stop
Inside the most beautiful Macca's in the world,https://www.news.com.au/web-stories/free/news-com-au/inside-the-most-beautiful-mcdonalds-in-the-world
Hidden Aussie beach better than Byron,https://www.news.com.au/web-stories/free/news-com-au/cellito-beach-hidden-aussie-coastal-town-better-than-byron
Top 3 emojis that make you 'less likeable',https://www.news.com.au/web-stories/free/news-com-au/top-3-phone-emojis-that-make-you-more-likeable
Carrie’s career option no one saw coming,https://www.news.com.au/web-stories/free/news-com-au/carrie-bickmores-next-move-after-leaving-the-project
'Legend': Aussie’s 'insane' $1.5m journey,https://www.news.com.au/web-stories/free/news-com-au/nedd-brockmanns-1-5-million-journey-across-australia
Shock Aussie flight trend revealed,https://www.news.com.au/web-stories/free/news-com-au/aussie-travel-trend-behind-international-flight-searches
‘Beaten down’: Terrible news for Melburnians,https://www.news.com.au/web-stories/free/news-com-au/beaten-down-and-broken-terrible-news-for-melburnians
Aussie town that's home to new big landmark,https://www.news.com.au/web-stories/free/news-com-au/regional-victorian-town-named-home-to-big-rainbow
The terror attack that changed Australia forever,https://www.news.com.au/web-stories/free/news-com-au/bali-bombings-anniversary-how-the-2002-attacks-unfolded
Drama behind multimillion-dollar divorce,https://www.news.com.au/web-stories/free/news-com-au/tom-brady-gisele-bundchens-multimillion-dollar-divorce
Vegan protester making thousands,https://www.news.com.au/web-stories/free/news-com-au/tash-peterson-vegan-protester-and-onlyfans-stars-notorious-stunts
Dark warning for Aussie homeowners,https://www.news.com.au/web-stories/free/news-com-au/interest-rate-rise-australia-grim-warning-for-homeowners
‘Step up’: Report angering a lot of men,https://www.news.com.au/web-stories/free/news-com-au/rise-of-single-lonely-men-psychologist-slammed-online
Star signs most likely to be serial killers,https://www.news.com.au/web-stories/free/news-com-au/astrology-star-signs-most-likely-to-be-serial-killers
‘Disgusting’: Backlash to Kanye’s wild claim,https://www.news.com.au/web-stories/free/news-com-au/kanye-west-slammed-after-paris-fashion-week-stunt
New ‘R’ car plate for Aussie motorists,https://www.news.com.au/web-stories/free/news-com-au/new-r-car-plate-for-aussie-motorists
Princess Mary pulled into ‘difficult’ royal row,https://www.news.com.au/web-stories/free/news-com-au/royal-family-princess-mary-pulled-into-difficult-row
Millions to go beyond ‘quiet quitting’,https://www.news.com.au/web-stories/free/news-com-au/quiet-quitting-millions-of-australians-to-leave-their-job
Shopping hack Aussie tourists don’t know about,https://www.news.com.au/web-stories/free/news-com-au/tourist-discount-aussies-dont-know-about
Real reason you can't use your phone on plane,https://www.news.com.au/web-stories/free/news-com-au/experts-reveal-why-you-need-to-turn-off-your-phone-on-a-flight
Mystery surrounding sex act finally solved,https://www.news.com.au/web-stories/free/news-com-au/sex-and-relationships-is-squirting-actually-a-thing
'Staggering': Disturbing trend at Aussie brands,https://www.news.com.au/web-stories/free/news-com-au/jb-hi-fi-nick-scali-baby-bunting-disturbing-trend-at-aussie-brands
Queen's biggest wish before her death,https://www.news.com.au/web-stories/free/news-com-au/queen-elizabeths-biggest-wish-was-to-heal-harry-meghan-rift
'Chaos': Rain bomb to smash Australia,https://www.news.com.au/web-stories/free/news-com-au/sydney-weather-australia-smashed-by-rain-band
Proof Keanu Reeves may be the nicest guy on Earth,https://www.news.com.au/web-stories/free/news-com-au/keanu-reeves-may-be-the-nicest-guy-on-earth
Five signs your partner wants a divorce,https://www.news.com.au/web-stories/free/news-com-au/relationships-five-signs-your-partner-wants-a-divorce
Aussies jump on popular travel trend,https://www.news.com.au/web-stories/free/news-com-au/best-pet-friendly-holiday-homes-in-australia
'Regrettable': Adam Levine cheating scandal explodes,https://www.news.com.au/web-stories/free/news-com-au/adam-levine-accused-of-secret-affair-with-models
Truth about Princess Kate's secret double life,https://www.news.com.au/web-stories/free/news-com-au/the-truth-about-kate-middletons-secret-double-life
New law to get Boomers to sell their homes,https://www.news.com.au/web-stories/free/news-com-au/real-estate-new-law-to-get-boomers-to-sell-their-homes
Fans accuse Harry of 'disrespectful' act,https://www.news.com.au/web-stories/free/news-com-au/queens-funeral-royal-watchers-slam-harrys-disrespectful-act
'Return it': War erupts over Queen’s $591m jewel,https://www.news.com.au/web-stories/free/news-com-au/queens-funeral-war-erupts-over-royal-591m-jewel
Meghan blindsided by kids' new titles,https://www.news.com.au/web-stories/free/news-com-au/queens-death-meghan-blindsided-by-archie-and-lilibets-new-royal-titles
'Dead money': Aussies refusing to buy house,https://www.news.com.au/web-stories/free/news-com-au/millennials-are-ditching-buying-a-house-and-investing-in-shares-instead
Justin Bieber reveals 'horrible' diagnosis,https://www.news.com.au/web-stories/free/news-com-au/what-is-ramsay-hunt-syndrome-justin-bieber-reveals-diagnosis
Who will inherit Queen's most precious tiaras,https://www.news.com.au/web-stories/free/news-com-au/who-will-inherit-queen-elizabeths-most-famous-tiaras
'Unrelenting': Country on the brink of disaster,https://www.news.com.au/web-stories/free/news-com-au/climate-change-pakistan-on-the-brink-of-disaster
'Incredible': New show everyone is obsessed with,https://www.news.com.au/web-stories/free/news-com-au/jeremy-allen-white-reacts-to-the-bear-thirst-obsession
Meghan request that delayed Fab Four walk,https://www.news.com.au/web-stories/free/news-com-au/queen-death-meghan-markle-request-that-delayed-fab-four-walk
Best looks from Emmy Awards red carpet,https://www.news.com.au/web-stories/free/news-com-au/2022-emmy-awards-fashion-zendaya-leads-best-looks-on-red-carpet
Surprise reaction to Meghan's 'lovely' act,https://www.news.com.au/web-stories/free/news-com-au/queen-death-meghan-reunites-with-harry-will-kate
Fans call out William's behaviour towards Kate,https://www.news.com.au/web-stories/free/news-com-au/queens-death-fans-call-out-prince-williams-behaviour-towards-kate
Queen Elizabeth’s most playful moments,https://www.news.com.au/web-stories/free/news-com-au/good-evening-mr-bond-queen-elizabeths-most-playful-moments
'Much-loved': Harry and William’s touching tribute,https://www.news.com.au/web-stories/free/news-com-au/prince-harry-and-prince-williams-heartwarming-tribute-to-queen
'Finally': Apple reveals huge iPhone change,https://www.news.com.au/web-stories/free/news-com-au/latest-iphone-14-released-by-apple-comes-with-a-hefty-price
The Queen's three most defining moments,https://www.news.com.au/web-stories/free/news-com-au/royals-queen-elizabeth-iis-most-defining-moments
Sexuality type we don’t talk about,https://www.news.com.au/web-stories/free/news-com-au/asexuality-sexuality-type-we-dont-talk-about-often
‘Rubbish’: Real reason Tracy Grimshaw quit,https://www.news.com.au/web-stories/free/news-com-au/tracy-grimshaw-reveals-why-shes-leaving-a-current-affair
'Not the truth': Film's wild drama explained,https://www.news.com.au/web-stories/free/news-com-au/dont-worry-darling-drama-harry-styles-appears-to-spit-on-chris-pine
Rare weather event 'SAM' to smash Australia,https://www.news.com.au/web-stories/free/news-com-au/what-is-sam-rare-weather-phenomenon-to-smash-australia
New dating trend as 'hook-up' culture dies out,https://www.news.com.au/web-stories/free/news-com-au/is-hook-up-culture-dead-new-gen-z-relationships-say-so
Surprise Aussie city wins world’s ‘coolest’ street,https://www.news.com.au/web-stories/free/news-com-au/travel-melbourne-makes-time-outs-coolest-streets-ranking
What really killed Princess Diana,https://www.news.com.au/web-stories/free/news-com-au/what-really-killed-princess-diana
Wild new Taylor Swift conspiracy theory,https://www.news.com.au/web-stories/free/news-com-au/midnights-taylor-swift-fans-reveal-wild-kanye-kardashian-theory
'Lyn is dead': Bombshell verdict in murder trial,https://www.news.com.au/web-stories/free/news-com-au/chris-dawson-trial-ex-teacher-guilty-of-murdering-wife-lynette
'Designer vagina’ surgery is booming,https://www.news.com.au/web-stories/free/news-com-au/why-designer-vagina-surgery-is-booming
The Aussie suburbs with ‘ridiculous’ rent hikes,https://www.news.com.au/web-stories/free/news-com-au/the-ridiculous-rent-hikes-in-aussie-suburbs
Four reasons men get paid considerably more,https://www.news.com.au/web-stories/free/news-com-au/men-get-paid-considerably-more-for-the-same-job-data-reveals
'This is it': Why you won't see actor anymore,https://www.news.com.au/web-stories/free/news-com-au/steve-martin-says-he-will-no-longer-seek-acting-work
Scary trap in new 'quiet quitting' trend,https://www.news.com.au/web-stories/free/news-com-au/scary-trap-in-quiet-quitting-trend-in-aussie-offices
Dangerous sex act on the rise,https://www.news.com.au/web-stories/free/news-com-au/sex-and-relationships-scary-condom-trend-on-the-rise
Why women everywhere hate this man,https://www.news.com.au/web-stories/free/news-com-au/andrew-tate-warning-over-viral-tiktok-rape-culture-videos
'Rare event': Aussies brace for six months of rain,https://www.news.com.au/web-stories/free/news-com-au/weather-aussies-brace-for-six-months-of-rain
‘Panic selling’: Stock market plunges,https://www.news.com.au/finance/economy/world-economy/hong-kong-stock-market-plunges-after-president-xi-jinpings-power-grab/news-story/3ff398c50f7a5dcea0bb064efa2b3101
15 famous sayings with weird origins,https://www.news.com.au/national/15-famous-sayings-with-weird-origins/audio/cd048662ffa2d0fa5170496dbe924698
