title,url
‘THE DAMS ARE FULL’: Warning as monster storm lashes east coast,https://www.news.com.au/technology/environment/severe-weather-event-issued-for-large-parts-of-nsw-as-monster-deluge-continues/news-story/918b610e99b55ffaa3445edf3956488f
Bathurst event cancelled in historic first,https://www.news.com.au/sport/motorsport/v8-supercars/wet-weather-carnage-as-bathurst-top-10-shootout-race-cancelled-in-historic-first/news-story/ddc153362f1913ec22aba14a40be2a22
X-ray exposes woman’s unimaginable horror,https://www.news.com.au/lifestyle/real-life/news-life/my-stalker-shot-my-boyfriend-because-he-couldnt-have-me/news-story/b60fd90f7fd01d16c463704b47dc87bc
Australia Post suspends sea mail,https://www.news.com.au/national/australia-post-suspends-sea-mail-amid-prohibited-item-concerns/news-story/1ee350bb63a8ec8ffd553e604e04c6b3
‘Selfish’ Aussie parking act that has to stop,https://www.news.com.au/technology/motoring/on-the-road/illegal-parking-is-a-scourge-of-australian-suburbs-and-it-has-to-stop/news-story/50dfb4273294f2ac6574d5dd9de49be3
‘Nightmare’ high school shooting rocks US,https://www.news.com.au/sport/american-sports/nightmare-three-people-shot-during-high-school-football-match/news-story/5f4b19d652fb2d776dd3712295dcdb86
Parents outraged as kids terror-struck,https://www.news.com.au/lifestyle/parenting/lil-blessings-daycare-in-hamilton-under-investigation-for-halloween-mask-video/news-story/9d0a7835577ce1033b7a09d39699c0c7
‘Dress your age’: 48yo’s G-string bikini angers,https://www.news.com.au/lifestyle/fashion/fashion-trends/bikini-and-crop-top-loving-mum-40-shamed-for-not-dressing-age/news-story/a6aab57d3706ed2fb3533bcb134c968d
‘Broke my face’: Gym stunt backfires,https://www.news.com.au/sport/sports-life/broke-my-face-fitness-influencers-bench-press-stunt-goes-horribly-wrong/news-story/e604c3d7dee866a119db8b1ccad1fde6
Heartbreak as cricketer commits cardinal sin,https://www.news.com.au/sport/cricket/queensland-paceman-mark-steketee-cruelly-denied-sheffield-shield-hattrick/news-story/53098c9b422030e77278bb07811e8a5e
‘Utterly miserable’: Harry’s gamble backfired,https://www.news.com.au/entertainment/celebrity-life/royals/prince-harry-utterly-miserable-claims-biographer/news-story/0537ab90f49f8bb1ea0ddebec0c36913
Enjoy a Bali holiday without leaving home,https://www.realestate.com.au/news/home-offers-a-slice-of-bali-in-the-backyard/?rsf=syn:news:nca:news:spa:strap
Russia-backed forces claim gains near Bakhmut in east Ukraine,https://www.news.com.au/breaking-news/russianbacked-forces-claim-gains-near-bakhmut-in-east-ukraine/news-story/7fef5d53127aec4b3303f47ca37de282
Australia Post suspends sea mail,https://www.news.com.au/national/australia-post-suspends-sea-mail-amid-prohibited-item-concerns/news-story/1ee350bb63a8ec8ffd553e604e04c6b3
The AFL trades that still need to be done,https://www.news.com.au/sport/afl/afl-2022-josh-dunkley-luke-jackson-and-jason-hornefrancis-headline-trades-that-still-need-to-be-done/news-story/9cc1c5785cd4ab69b9c93bc7a0bfbf9e
Soundbars that bring movie night to life,https://www.news.com.au/best-of/electronics/home-entertainment/best-soundbars/news-story/725bd26418cb12447ebfa660f093048f
Inventing Anna scammer heads to Manhattan,https://www.news.com.au/entertainment/celebrity-life/inventing-anna-scammer-anna-sorkin-released-from-prison-heads-straight-to-manhattan/news-story/4133b510d22268ad18b0de2f0b8b203d
Moment Prince Harry’s persona ‘died’,https://www.news.com.au/entertainment/celebrity-life/royals/new-book-claims-prince-harrys-wild-streak-died-when-he-met-meghan/news-story/be9a8e6e2291b70f5d8a71666653db5f
Sunrise star defends weather skit,https://www.news.com.au/entertainment/tv/morning-shows/sunrise-weatherman-sam-macs-funny-defence-of-viral-poodle-clip/news-story/251db92c1283f67d9fc94b2dff63c43e
Ten’s new show struggles against juggernaut,https://www.news.com.au/entertainment/tv/channel-10-reality-show-the-real-love-boat-suffers-low-ratings-in-premiere-week/news-story/2485c0718d7611b7899c7d18195c2d20
Radio station cops bizarre spray from singer,https://www.news.com.au/entertainment/music/tours/the-1975-frontman-matty-healy-lashes-out-at-triple-j-for-trying-to-have-a-monopoly-on-cool/news-story/86186d47d5ca4abfe14b4459eeaa0599
Teen charged following 12yo’s death,https://www.news.com.au/national/nsw-act/crime/teen-charged-after-12yearold-boy-dies-in-brutal-car-crash/news-story/33d67eeaaea5ae0ba1f32d183866e04e
Aussie Council’s ‘disgraceful’ flag ban,https://www.news.com.au/national/australian-council-slammed-for-unbelievable-ban/news-story/10c195b1ba95fdb2dab86bad6375d63f
Disturbing slur to Jewish man on street,https://www.news.com.au/lifestyle/real-life/news-life/disturbing-slur-to-jewish-man-on-melbourne-street/news-story/40ae7df0a78b5c48a73757f3af25d9de
Fresh $7m threat to Eels’ title dream,https://www.news.com.au/sport/nrl/dolphins-and-bulldogs-looking-to-poach-parramatta-halves-in-7m-threat/news-story/b45ff6373817909c3cc0179c4689188a
Champ’s X-rated remark stuns reporter,https://www.news.com.au/sport/boxing/aussie-boxing-champions-xrated-remark-leaves-reporter-in-stitches/news-story/577cb0a08d3c5f212d399b80765de73d
Mum ‘covered in bandages’ as kids killed,https://www.news.com.au/technology/science/animals/tennessee-pit-bull-attack-two-toddlers-mauled-to-death-by-familys-dogs/news-story/fc87fe545aa002dc3abceb01cb4dbc0c
Police officer’s horrific discovery,https://www.news.com.au/lifestyle/real-life/true-stories/jeffrey-dahmer-police-officer-details-horrific-discovery-about-serial-killer/news-story/3516810df50017e2daa9c6b91c0aab54
Danger as Putin is ‘cornered like a rat’,https://www.news.com.au/technology/innovation/military/danger-as-russian-president-vladimir-putin-is-cornered-like-a-rat/news-story/373c7f6f1069624ef78602f7a76e0e40
And then there were just two for Ricciardo,https://www.news.com.au/sport/motorsport/formula-one/and-then-there-were-just-two-for-ricciardo-as-gasly-moves-to-alpine/news-story/f3d3501ab329c777dae0b22326abdcf0
‘Just stop’: Ukraine slams Elon Musk,https://www.news.com.au/world/just-stop-ukraine-newspaper-slams-elon-musks-comments-on-russian-invasion/news-story/4b31bf0faf2a25a74721cb0a1ac3394f
Tenants admit to lying to landlord for years,https://www.realestate.com.au/news/ive-had-a-dog-for-four-years-and-my-landlord-has-no-idea-tenants-who-hide-pets/?rsf=syn:news:nca:rea:news-strap
Own a palace with a Cleopatra spa for $2.3m,https://www.realestate.com.au/news/mansion-in-melbournes-east-with-cleopatralike-spa-roman-statues-set-to-make-a-splash/?rsf=syn:news:nca:news:spa:strap
Quirky Australiana-themed home asks $1m,https://www.realestate.com.au/news/mcmahons-point-unit-adorned-with-australiana-and-prime-water-views-asking-1-million/?rsf=syn:news:nca:news:spa:strap
Sam Armytage’s stunning rare appearance,https://www.news.com.au/lifestyle/fashion/celebrity/sydney-stars-celebrate-rosie-huntingtonwhiteleys-new-marks-spencer-lingerie-range/news-story/1edb0719202fe2cc793c9fa1d6e1b25e
Girl missing 53 years found in just 30 mins,https://www.news.com.au/lifestyle/real-life/news-life/woman-stolen-from-her-family-reunites-with-them-53-years-later/news-story/487889ac3cc0938ddb72dbc83c08b968
Sad truth behind star’s pregnancy at 48,https://www.news.com.au/lifestyle/parenting/pregnancy/hilary-swanks-twin-pregnancy-at-48-gives-women-false-hope/news-story/ff74df1973f0efaf4f95d7d2174f1aec
Popular shampoo pulled from shelves,https://www.news.com.au/lifestyle/beauty/face-body/woolies-chemist-warehouse-pull-popular-shampoo-from-shelves-over-bacteria-scare/news-story/d295bd740795cd253511f1d64d87f02b
Teacher defends pupils using OnlyFans name,https://www.news.com.au/lifestyle/real-life/news-life/whats-up-buttercup-exteacher-defends-students-using-her-onlyfans-name/news-story/7b7075f34820334b6b7b1c3f526efdec
How to quit when you hate your boss,https://www.seek.com.au/career-advice/article/how-to-resign-without-burning-bridges?tracking=DAC-NAS-NCS_2020-31127&utm_campaign=NCS_2020&utm_source=Newcorp&utm_medium=Display&utm_content=Vis_CA_AO_R
Best hiding spots for your Christmas stash,https://www.kidspot.com.au/parenting/primary-school/hiding-spots-for-your-christmas-stash-that-even-a-bloodhound-couldnt-find/news-story/04d708121cf1c619bf1433366a301cc3
Jules sparks frenzy over Cotton On dress,https://www.news.com.au/best-of/fashion/best-summer-dresses/news-story/7ae467b9f3e3d9883fa1356eb710cb27
Woman’s ‘nude’ outfit stuns at airport,https://www.news.com.au/travel/travel-advice/airports/traveller-turns-heads-at-airport-over-nude-pants/news-story/24f0f9c7891acf044be7c31624d14d00
’Deranged’: Tourist’s wild act in Vatican,https://www.news.com.au/travel/travel-updates/incidents/us-tourist-smashes-roman-busts-in-vatican-after-denied-pope-audience/news-story/631e437ad502e72df39d9ab5885d9e45
Never sleep at this time on a plane,https://www.news.com.au/travel/travel-advice/tips-tricks/why-you-shouldnt-sleep-for-the-first-two-hours-on-a-flight-and-never-skip-a-meal/news-story/2c866b706dde7d9bc85eff5e05decc16
‘Confused’: Man stunned after boarding flight,https://www.news.com.au/travel/travel-advice/flights/man-left-stunned-after-boarding-flight/news-story/00d5151a1538507beb0728fde9dea9cd
Qantas reveals huge sale as nation reopens,https://www.news.com.au/travel/travel-deals/qantas-and-jetstar-offer-100000-reward-flight-to-japan-for-frequent-flyers/news-story/904e536768ea721f9dfe4e3619f87550
Kanye West reveals his celebrity crush,https://www.news.com.au/entertainment/celebrity-life/kanye-west-reveals-his-celebrity-crush/news-story/940199a7672202120198eb1886586218
Fans baffled by Kim’s bizarre faux pas,https://www.news.com.au/entertainment/tv/reality-tv/fans-slam-kim-kardashian-for-not-knowing-what-tortellini-is-in-italy/news-story/8883993f004a853ae146b1367e8cbe70
Kanye slams Kim for ‘putting ass out’ in mag,https://www.news.com.au/entertainment/celebrity-life/kanye-west-slams-kim-kardashian-putting-ass-out-in-magazine/news-story/f16fec9c6e4edeff51743f8d16b9477e
‘Embarrassing’: Prada ripped over campaign,https://www.news.com.au/lifestyle/fashion/celebrity/embarrassing-fashionistas-slam-prada-model-choice/news-story/3e7e99afdf8b13d79f5f2d4284715817
Star roasted for performance in new film,https://www.news.com.au/entertainment/movies/upcoming-movies/chris-pratts-mario-voice-in-new-trailer-cops-savage-fan-reaction/news-story/6be245c8d22bc0ff1e6f8d9a38e2d855
Heartbreaking photos of kids mauled to death,https://www.news.com.au/technology/science/animals/heartbreaking-photos-emerge-of-girl-and-her-baby-brother-who-were-killed-by-familys-pit-bulls/news-story/ad794b24d0d1d4e54a26310bc95d6a80
‘Danger day’: 400km long monster deluge hits,https://www.news.com.au/technology/environment/danger-day-as-rain-hits-eastern-states-this-weekend/news-story/8050f76577fed858a67315c2f8782d50
New electric car’s odd feature,https://www.news.com.au/technology/motoring/luxury/2022-lexus-ux-300e-new-car-review/news-story/22ce4e91f4d41ea4969d8bbfd5daea28
The frozen pizza hack dividing the internet,https://www.news.com.au/technology/online/the-frozen-pizza-hack-dividing-the-internet/news-story/821ee3e6382e1a2e56c9aed69a80f8b8
Optus faces massive class action claim,https://www.news.com.au/technology/online/hacking/new-hope-for-justice-for-optus-customers-as-compensation-complaint-made/news-story/c6b5f52ed67fd5a9e66763c997c83016
‘Poisonous’: Huge problem crippling China,https://www.news.com.au/finance/economy/world-economy/big-tech-companies-are-moving-production-out-of-china-over-geostrategic-concerns/news-story/ce27ed75e2ba0617e90a9d5f75034450
Warning to Aussies about Christmas,https://www.news.com.au/finance/money/budgeting/huge-risk-christmas-spending-blowout-could-hurt-your-mortgage/news-story/625b01bb4bd5e6b438aaa007c71b8b96
Aussies fume at supermarket trend,https://www.news.com.au/finance/business/retail/aussie-shopper-blows-up-over-selfcheckout-at-supermarket-in-viral-social-media-post/news-story/577346735942bf4211dac81260a6fcbf
Rental agent’s ‘rude’ email to tenant,https://www.news.com.au/finance/real-estate/renting/tenant-blasts-extremely-rude-email-from-real-estate-agent/news-story/d77552511f0a53a1dfb3c3b9d1d83dda
Twist in lucrative fashion brand’s collapse,https://www.news.com.au/finance/business/luxury-aussie-fashion-brand-the-daily-edited-enters-liquidation/news-story/04ae98dde382248e568506d45e172ecd
‘Utterly chilling’: NRL star’s ‘brain shrunk’,https://www.news.com.au/sport/nrl/utterly-chilling-james-graham-reveals-nrl-shrunk-my-brain/news-story/5254fc053e680c7d3c010c0da2a1a92c
Bulldogs’ ‘ludicrous’ threat to star player,https://www.news.com.au/sport/afl/josh-dunkley-luke-jackson-and-jason-hornefrancis-headline-trades-that-still-need-to-be-done/news-story/632c419b98a2571f17047e5eb781f15d
Millionaire student cracks the big time,https://www.news.com.au/sport/sports-life/millionaire-student-olivia-dunne-is-now-topranked-influencer/news-story/27d822f33fe7d2372956d04272d2f98f
Weird reason Optus sign pulled from stadium,https://www.news.com.au/sport/cricket/optus-branding-to-be-taken-off-optus-stadium-as-telco-battles-after-hack/news-story/0a6eb12355b4e66d4f64a4b80e23c417
Bombers’ new target after trade shambles,https://www.news.com.au/sport/afl/afl-trade-news-bombers-new-target-after-dealing-shambles/news-story/0e15ecc02ebc27219ab2951f1b781c6a
Clip exposes NBA star’s teammate ‘sucka’ punch,https://www.news.com.au/sport/american-sports/nba/leaked-video-footage-shows-nba-star-sucka-punched-teammate/news-story/ab97eac35c078b758460f3e9d648f801
WWE star’s final eerie post before death,https://www.news.com.au/sport/sports-life/wwe-star-sara-lees-final-post-before-dying-suddenly-at-age-30/news-story/3b2d75a4c0d730b34d4333576888fb9e
‘Heartbreaking’: Kyrgios suddenly pulls out,https://www.news.com.au/sport/tennis/heartbreaking-kyrgios-suddenly-pulls-out-of-japan-open-quarterfinal/news-story/9f43af1c54d586cdfd8988b2919991c4
$81 off bestselling ASICS Gel-Kayano 29,https://www.news.com.au/best-of/sales-and-deals/best-deals-for-the-iconic/news-story/56e74e33c5ac0bc5305bdfce5e76d565
‘No more stiff neck’: Top pillow for side sleepers,https://www.news.com.au/best-of/home/best-pillow-for-side-sleepers/news-story/dba1b848a1288feab76d3b21e34f0af8
Spotted: $9 Havaianas for a limited time,https://www.news.com.au/best-of/sales-and-deals/ozsale-super-sale-deals/news-story/5cd0a978f7a47833f15436a07b3859f2
Apple’s latest AirPods spotted on sale,https://www.news.com.au/best-of/electronics/gadgets/best-apple-airpods-deals-australia/news-story/2455b71bdbf80c9aa667eb0472454906
Luxe Sheridan bath towels on sale for just $20,https://www.news.com.au/best-of/sales-and-deals/best-weekly-deals/news-story/f2e3292f923e682ff447423f9a6c6888
Dark warning for Aussie homeowners,https://www.news.com.au/web-stories/free/news-com-au/interest-rate-rise-australia-grim-warning-for-homeowners
Star signs most likely to be serial killers,https://www.news.com.au/web-stories/free/news-com-au/astrology-star-signs-most-likely-to-be-serial-killers
‘Disgusting’: Backlash to Kanye’s wild claim,https://www.news.com.au/web-stories/free/news-com-au/kanye-west-slammed-after-paris-fashion-week-stunt
Princess Mary pulled into ‘difficult’ royal row,https://www.news.com.au/web-stories/free/news-com-au/royal-family-princess-mary-pulled-into-difficult-row
Vegan protester making thousands,https://www.news.com.au/web-stories/free/news-com-au/tash-peterson-vegan-protester-and-onlyfans-stars-notorious-stunts
Shocking act disturbs Australian TV star,https://www.news.com.au/web-stories/free/news-com-au/australia-cup-nazi-salute-shocks-australian-tv-star-2
Mum’s ‘experiment’ turns into $3.7m idea,https://www.news.com.au/web-stories/free/news-com-au/melbourne-business-the-australian-natural-soap-company-makes-3-7m
Millions to go beyond ‘quiet quitting’,https://www.news.com.au/web-stories/free/news-com-au/quiet-quitting-millions-of-australians-to-leave-their-job
Shopping hack Aussie tourists don’t know about,https://www.news.com.au/web-stories/free/news-com-au/tourist-discount-aussies-dont-know-about
Aussie Netflix hit the world is obsessed with,https://www.news.com.au/web-stories/free/news-com-au/heartbreak-high-why-the-world-is-frothing-for-aussie-netflix-hit
Real reason you can't use your phone on plane,https://www.news.com.au/web-stories/free/news-com-au/experts-reveal-why-you-need-to-turn-off-your-phone-on-a-flight
Mystery surrounding sex act finally solved,https://www.news.com.au/web-stories/free/news-com-au/sex-and-relationships-is-squirting-actually-a-thing
'Staggering': Disturbing trend at Aussie brands,https://www.news.com.au/web-stories/free/news-com-au/jb-hi-fi-nick-scali-baby-bunting-disturbing-trend-at-aussie-brands
Queen's biggest wish before her death,https://www.news.com.au/web-stories/free/news-com-au/queen-elizabeths-biggest-wish-was-to-heal-harry-meghan-rift
'Chaos': Rain bomb to smash Australia,https://www.news.com.au/web-stories/free/news-com-au/sydney-weather-australia-smashed-by-rain-band
Proof Keanu Reeves may be the nicest guy on Earth,https://www.news.com.au/web-stories/free/news-com-au/keanu-reeves-may-be-the-nicest-guy-on-earth
Five signs your partner wants a divorce,https://www.news.com.au/web-stories/free/news-com-au/relationships-five-signs-your-partner-wants-a-divorce
Aussies jump on popular travel trend,https://www.news.com.au/web-stories/free/news-com-au/best-pet-friendly-holiday-homes-in-australia
'Regrettable': Adam Levine cheating scandal explodes,https://www.news.com.au/web-stories/free/news-com-au/adam-levine-accused-of-secret-affair-with-models
Truth about Princess Kate's secret double life,https://www.news.com.au/web-stories/free/news-com-au/the-truth-about-kate-middletons-secret-double-life
New law to get Boomers to sell their homes,https://www.news.com.au/web-stories/free/news-com-au/real-estate-new-law-to-get-boomers-to-sell-their-homes
Fans accuse Harry of 'disrespectful' act,https://www.news.com.au/web-stories/free/news-com-au/queens-funeral-royal-watchers-slam-harrys-disrespectful-act
'Return it': War erupts over Queen’s $591m jewel,https://www.news.com.au/web-stories/free/news-com-au/queens-funeral-war-erupts-over-royal-591m-jewel
Meghan blindsided by kids' new titles,https://www.news.com.au/web-stories/free/news-com-au/queens-death-meghan-blindsided-by-archie-and-lilibets-new-royal-titles
'Dead money': Aussies refusing to buy house,https://www.news.com.au/web-stories/free/news-com-au/millennials-are-ditching-buying-a-house-and-investing-in-shares-instead
Emotional scenes as world farewells Queen,https://www.news.com.au/web-stories/free/news-com-au/queens-funeral-world-bids-final-farewell-to-elizabeth-ii
Justin Bieber reveals 'horrible' diagnosis,https://www.news.com.au/web-stories/free/news-com-au/what-is-ramsay-hunt-syndrome-justin-bieber-reveals-diagnosis
Who will inherit Queen's most precious tiaras,https://www.news.com.au/web-stories/free/news-com-au/who-will-inherit-queen-elizabeths-most-famous-tiaras
'Unrelenting': Country on the brink of disaster,https://www.news.com.au/web-stories/free/news-com-au/climate-change-pakistan-on-the-brink-of-disaster
'Incredible': New show everyone is obsessed with,https://www.news.com.au/web-stories/free/news-com-au/jeremy-allen-white-reacts-to-the-bear-thirst-obsession
Meghan request that delayed Fab Four walk,https://www.news.com.au/web-stories/free/news-com-au/queen-death-meghan-markle-request-that-delayed-fab-four-walk
Best looks from Emmy Awards red carpet,https://www.news.com.au/web-stories/free/news-com-au/2022-emmy-awards-fashion-zendaya-leads-best-looks-on-red-carpet
Surprise reaction to Meghan's 'lovely' act,https://www.news.com.au/web-stories/free/news-com-au/queen-death-meghan-reunites-with-harry-will-kate
Fans call out William's behaviour towards Kate,https://www.news.com.au/web-stories/free/news-com-au/queens-death-fans-call-out-prince-williams-behaviour-towards-kate
Queen Elizabeth’s most playful moments,https://www.news.com.au/web-stories/free/news-com-au/good-evening-mr-bond-queen-elizabeths-most-playful-moments
'Much-loved': Harry and William’s touching tribute,https://www.news.com.au/web-stories/free/news-com-au/prince-harry-and-prince-williams-heartwarming-tribute-to-queen
'Finally': Apple reveals huge iPhone change,https://www.news.com.au/web-stories/free/news-com-au/latest-iphone-14-released-by-apple-comes-with-a-hefty-price
Huge change coming to Aussie cash,https://www.news.com.au/web-stories/free/news-com-au/queen-elizabeth-death-what-happens-to-australian-money
The Queen's three most defining moments,https://www.news.com.au/web-stories/free/news-com-au/royals-queen-elizabeth-iis-most-defining-moments
Queen Elizabeth’s iconic life in pictures,https://www.news.com.au/web-stories/free/news-com-au/queen-elizabeth-ii-dies-at-96-a-royal-life-in-pictures
Sexuality type we don’t talk about,https://www.news.com.au/web-stories/free/news-com-au/asexuality-sexuality-type-we-dont-talk-about-often
Woman who identifies as a wolf cops backlash,https://www.news.com.au/web-stories/free/news-com-au/woman-who-identifies-as-wolf-opens-up-about-her-unique-life
‘Rubbish’: Real reason Tracy Grimshaw quit,https://www.news.com.au/web-stories/free/news-com-au/tracy-grimshaw-reveals-why-shes-leaving-a-current-affair
'Not the truth': Film's wild drama explained,https://www.news.com.au/web-stories/free/news-com-au/dont-worry-darling-drama-harry-styles-appears-to-spit-on-chris-pine
Rare weather event 'SAM' to smash Australia,https://www.news.com.au/web-stories/free/news-com-au/what-is-sam-rare-weather-phenomenon-to-smash-australia
Best Nintendo 64 games of all time,https://www.news.com.au/web-stories/free/news-com-au/best-nintendo-64-games-of-all-time
New dating trend as 'hook-up' culture dies out,https://www.news.com.au/web-stories/free/news-com-au/is-hook-up-culture-dead-new-gen-z-relationships-say-so
Surprise Aussie city wins world’s ‘coolest’ street,https://www.news.com.au/web-stories/free/news-com-au/travel-melbourne-makes-time-outs-coolest-streets-ranking
What really killed Princess Diana,https://www.news.com.au/web-stories/free/news-com-au/what-really-killed-princess-diana
Wild new Taylor Swift conspiracy theory,https://www.news.com.au/web-stories/free/news-com-au/midnights-taylor-swift-fans-reveal-wild-kanye-kardashian-theory
'Lyn is dead': Bombshell verdict in murder trial,https://www.news.com.au/web-stories/free/news-com-au/chris-dawson-trial-ex-teacher-guilty-of-murdering-wife-lynette
'Designer vagina’ surgery is booming,https://www.news.com.au/web-stories/free/news-com-au/why-designer-vagina-surgery-is-booming
The Aussie suburbs with ‘ridiculous’ rent hikes,https://www.news.com.au/web-stories/free/news-com-au/the-ridiculous-rent-hikes-in-aussie-suburbs
Four reasons men get paid considerably more,https://www.news.com.au/web-stories/free/news-com-au/men-get-paid-considerably-more-for-the-same-job-data-reveals
'This is it': Why you won't see actor anymore,https://www.news.com.au/web-stories/free/news-com-au/steve-martin-says-he-will-no-longer-seek-acting-work
Scary trap in new 'quiet quitting' trend,https://www.news.com.au/web-stories/free/news-com-au/scary-trap-in-quiet-quitting-trend-in-aussie-offices
Dangerous sex act on the rise,https://www.news.com.au/web-stories/free/news-com-au/sex-and-relationships-scary-condom-trend-on-the-rise
Why women everywhere hate this man,https://www.news.com.au/web-stories/free/news-com-au/andrew-tate-warning-over-viral-tiktok-rape-culture-videos
'Rare event': Aussies brace for six months of rain,https://www.news.com.au/web-stories/free/news-com-au/weather-aussies-brace-for-six-months-of-rain
Aussies saving a motza with 'cash stuffing’ trend,https://www.news.com.au/web-stories/free/news-com-au/what-is-cash-stuffing-millennials-save-thousands-with-money-hack
'Missing' Aussie actor found in LA jail after date,https://www.news.com.au/web-stories/free/news-com-au/australian-actor-laura-mcculloch-found-in-jail-after-online-date
‘I’m not talking to you’: Saudi prince erupts,https://www.news.com.au/finance/economy/opec-sides-with-russia-to-cut-oil-output-by-2-million-barrels-a-day/news-story/ff376116e0a6a087f9a9a245c1d754f3
15 famous sayings with weird origins,https://www.news.com.au/national/15-famous-sayings-with-weird-origins/audio/cd048662ffa2d0fa5170496dbe924698
