title,url
‘WHAT SACRIFICE LOOKS LIKE’: ‘Heroic’ husband’s incredible final act,https://www.news.com.au/lifestyle/real-life/news-life/incredible-story-behind-this-picture-of-car-accident-hero/news-story/40d065186db01ddd6592ada6a8081cf7
Apology demanded after Jesus sex joke,https://www.news.com.au/entertainment/tv/current-affairs/comedians-crude-jesus-joke-leaves-waleed-aly-speechless-on-the-project/news-story/d767d7844a8305ba9ec50cc44e0add68
Chinese scientist: Covid lab leak ‘not accident’,https://www.news.com.au/lifestyle/health/health-problems/ccp-government-intentionally-released-covid19/news-story/5bf82a35639eae40cb179da9b84e51a0
Actor charged over ‘indecent act’ on flight,https://www.news.com.au/national/south-australia/actor-aleh-sidorchyk-dropped-form-australian-production-after-being-charged-over-indecent-act-on-flight/news-story/06db515f26709035e9018215e9089d4d
Surprise shift for Aussie property prices,https://www.news.com.au/breaking-news/proptrack-home-price-index-reveals-latest-capital-city-property-results/news-story/337824c8895c14b8ce4375d8f1d45e6e
Beloved TV show returns after 13 years,https://www.news.com.au/entertainment/tv/streaming/party-downs-martin-starr-and-ryan-hansen-on-the-cult-shows-season-three-return/news-story/1f7d532560adaa29a2e3b223516fbb57
Tables turned on cops after Aussie pulled over,https://www.news.com.au/technology/motoring/on-the-road/bald-as-a-babys-bottom-cop-car-busted-with-bald-tyres/news-story/20efe6c4c338e18665cec920df033527
Major update in beach ‘murder’ case,https://www.news.com.au/national/queensland/courts-law/rajwinder-singh-extradited-to-australia-to-face-trial-over-murder-of-toyah-cordingley/news-story/496936f00ff33a3b6e6fd468b79cdb87
‘Body shutting down’: Star rushed to hospital,https://www.news.com.au/entertainment/movies/elvis-star-austin-butler-was-rushed-to-hospital-after-his-body-started-shutting-down/news-story/a9f25ac7cb32724a0e5e04472dc9f3f9
NATO chief’s middle finger to Putin,https://www.news.com.au/world/europe/ukraine-will-join-nato-in-the-longterm-says-alliance-chief/news-story/6b71e800527fc254f095c3a985f4424a
Horrifying moment driver runs down 3 cops,https://www.news.com.au/national/nsw-act/courts-law/horrifying-moment-driver-runs-down-three-police-officers/news-story/701b219121a7a01893014e75e5f77628
‘No one believes I’m 8 months pregnant’,https://www.kidspot.com.au/news/no-one-believes-im-8-months-pregnant-they-just-think-im-fat/news-story/fc75075be5d8cd555e67de7aa8e793c6
"Ukraine says Bakhmut fight ‘extremely tense,’ Russia closes in",https://www.news.com.au/breaking-news/ukraine-army-says-situation-extremely-tense-around-bakhmut/news-story/7a4a057d75fb205ed9c2812bd74b1de9
Nigeria’s opposition calls for cancelling ‘sham’ election,https://www.news.com.au/breaking-news/nigeria-ruling-party-candidate-takes-election-lead-rivals-claim-fraud/news-story/937e74c97684201bed7a3139a6e7e695
Ukraine troops ‘on edge’ as Moscow seeks to encircle Bakhmut,https://www.news.com.au/breaking-news/ukraine-troops-on-edge-as-moscow-seeks-to-encircle-bakhmut/news-story/23ca9b2693633b7a0e0da398dd84f1f3
Aussie in Ukraine reveals the most horrific thing he’s seen,https://www.news.com.au/national/ive-got-news-for-you/podcast/addc2b261d7ffa5efaf36d1dc52803c0
MAFS husband trashes wife in butt-dial call,https://www.news.com.au/entertainment/tv/reality-tv/married-at-first-sight/james-weir-recaps-married-at-first-sight-australia-2023-episode-19/news-story/1d02f862fe32c10e6280fee794a45616
Meghan makes surprise return to Instagram,https://www.news.com.au/entertainment/celebrity-life/royals/meghan-markle-makes-surprise-return-to-instagram-to-promote-coffee-brand/news-story/7b66082bcee1a42dbd06a7b86d614506
DJ disappears after alarming post,https://www.news.com.au/entertainment/tv/radio/dj-disappears-after-alarming-instagram-post/news-story/85f703dfd6fa355ef9aefa2f80fbb6d8
‘No further hope’ for hospitalised actor,https://www.news.com.au/entertainment/celebrity-life/heartbreaking-update-after-actor-tom-sizemore-rushed-to-hospital/news-story/773192f105c449ef0b481301f39ce86c
Seven days that spell disaster for Charles,https://www.news.com.au/entertainment/celebrity-life/royals/seven-days-that-spell-disaster-for-king-charles/news-story/537f685b15d1a01f5e19c485212fa2e4
Tables turned on cops after Aussie pulled over,https://www.news.com.au/technology/motoring/on-the-road/bald-as-a-babys-bottom-cop-car-busted-with-bald-tyres/news-story/20efe6c4c338e18665cec920df033527
Swimmer makes incredible ocean find,https://www.news.com.au/lifestyle/real-life/good-news/nsw-swimmer-makes-unbelievable-find-while-diving/news-story/9b21a8837bed4fa9e188b23b269efe13
11 words that could come back to haunt Albo,https://www.news.com.au/finance/superannuation/treasurer-steps-up-push-to-put-tax-cap-on-high-value-superannuation-accounts/news-story/9a9b6d6cac566b97fd8b516055703da6
Slave lied about living conditions: court,https://www.news.com.au/national/victoria/courts-law/kumuthini-and-kandasamy-kannan-appeal-slavery-sentences/news-story/b5b440484294734a02968acad4c2208a
Parents of baby who died suffer fresh blow,https://www.news.com.au/national/nsw-act/news/parents-of-baby-who-died-from-leukaemia-suffer-fresh-blow/news-story/b6293af7d49926116fa2406bcb8d8cd7
Hero Aussie soldier suddenly dies aged 33,https://www.news.com.au/world/asia/former-australian-soldier-dies-aged-33-on-bangkok/news-story/18d576c88f58e43acf1eb0696be12186
LIV Golf suffers astonishing humiliation,https://www.news.com.au/sport/golf/liv-golfs-tv-debut-gets-less-viewers-than-worlds-funniest-animals/news-story/2ffb8d4279a7ca7f690356f3f45ee2d1
I was attacked by Weinstein: This is my story,https://www.news.com.au/world/i-was-attacked-by-harvey-weinstein-he-was-so-notorious-i-wore-2-pairs-of-tights/news-story/731214fdd96da305f8040ec7c154f13e
10 Covid myths that are now debunked,https://www.news.com.au/lifestyle/health/health-problems/10-myths-told-by-covid-experts-now-debunked/news-story/d414984470291668356217f4b3fa1f9c
‘Bombshell’ Covid mask study torn to shreds,https://www.news.com.au/lifestyle/health/so-ridiculous-major-flaw-with-gold-standard-covid-mask-study-exposed/news-story/008737f7b3f7bf669f633a3004a9e40b
Play School icon nabs bargain waterfront pad,https://www.realestate.com.au/news/noni-hazlehursts-bargain-waterfront-home-on-brisbanes-bayside/?campaignType=external&campaignChannel=syndication&campaignName=ncacont&campaignContent=&campaignSource=newscomau&campaignPlacement=strap
JLo lists ‘rare’ home with private lake for $63m,https://www.realestate.com.au/news/jennifer-lopez-lists-rare-belair-home-for-63m-after-settling-on-new-abode-with-ben-affleck/?campaignType=external&campaignChannel=syndication&campaignName=ncacont&campaignContent=&campaignSource=newscomau&campaignPlacement=spa
Goodrem’s ritzy family home lists at $4m,https://www.realestate.com.au/news/delta-goodrems-childhood-home-in-glenhaven-for-sale-with-a-price-guide-of-around-4-million/?campaignType=external&campaignChannel=syndication&campaignName=ncacont&campaignContent=&campaignSource=newscomau&campaignPlacement=strap
‘My sex request has divided my friends’,https://www.news.com.au/lifestyle/relationships/dating/my-boyfriend-will-pay-half-for-contraception-and-my-friends-arent-happy/news-story/70d2aa9c644fe918449ca0d1f1480387
‘Entitled’: Influencer’s demand in public park,https://www.news.com.au/lifestyle/real-life/news-life/entitled-influencers-demand-in-public-park/news-story/3c64977cd5d25feb962e3115f9cc508c
Woman’s Kmart air fryer ‘bursts into flames’,https://www.news.com.au/lifestyle/home/womans-kmart-air-fryer-bursts-into-flames/news-story/8874a6c12ef0054e9b3bc823225fc3fe
‘Genius’ water bottle trick exposes infidelity,https://www.news.com.au/lifestyle/relationships/dating/water-bottle-trick-to-tell-if-your-partner-is-cheating-on-you-revealed/news-story/dc8311ff76e5444f9d4226df57656fd6
‘Highly offensive’ video shown at school,https://www.news.com.au/lifestyle/parenting/school-life/highly-offensive-video-shown-at-school/news-story/547479c518fd71fb65e2cd1083a17a9f
Dated’: CV cliches making bosses mad,https://www.seek.com.au/career-advice/article/8-things-to-cut-from-your-cover-letter-right-now?tracking=DAC-NAS-NCS_FY23-32190&utm_campaign=NCS_FY23&utm_source=Newcorp&utm_medium=Display&utm_content=Vis_CA_GTJ_AFJ
Worrying reason kids hooked on CoComelon,https://www.kidspot.com.au/lifestyle/entertainment/tiktok-video-shows-how-cocomelon-is-like-an-addictive-drug-for-children/news-story/3f265177602eb4079c07357b21f3beba
Shoppers flock to ‘game changer’ massager,https://www.news.com.au/best-of/best-deals-for-amazon/news-story/e97c9d1a6f9cd925608e49868fe3fe3a
Famous restaurant hits back over $68 pasta,https://www.news.com.au/travel/travel-ideas/food-drink/owner-of-bondi-icebergs-responds-to-68-pasta-scandal/news-story/43a0c174fc42c0e585d13ede7ed1ec09
Flights suspended over entire nation,https://www.news.com.au/travel/travel-updates/incidents/elevated-risk-wizz-air-suspends-flights-over-moldova-due-to-safety-fears-as-tensions-with-russia-rise/news-story/04822aeb64c91c2ac6971e1945ca1bc2
Hostie’s brutal resignation letter goes viral,https://www.news.com.au/travel/travel-updates/flight-attendants-brutal-resignation-letter-goes-viral/news-story/dcbb4ecf2820d9c0bc6c1d4ab08fee86
Aussies baffled by expat’s ‘nuts’ loo discovery,https://www.news.com.au/travel/travel-updates/travel-stories/canadian-expat-reveals-strange-australian-cafe-toilet-discovery/news-story/8aca94c7f62798e9514190d7370cc06a
Huge change to Disney World amid new law,https://www.news.com.au/travel/travel-updates/travel-stories/governor-ends-disneys-selfgoverning-status/news-story/d466e6c41c370c20dafd5b6b7f29efeb
Embarrassing price to hear Harry speak,https://www.news.com.au/entertainment/celebrity-life/royals/embarrassing-ticket-price-to-hear-prince-harry-speak/news-story/45ffdbb765284e3c5841821df9587b0c
MAFS bride’s jaw-dropping bikini pics,https://www.news.com.au/entertainment/tv/reality-tv/married-at-first-sight/mafs-intruder-bride-evelyn-hits-watsons-bay-in-skimpy-bikini/news-story/e26fb6fbda2947123e050bf76bed578e
Spectacular news about popular show,https://www.news.com.au/entertainment/tv/streaming/the-night-manager-season-two-is-finally-in-the-works/news-story/6460d8f76b4fc87e8a71cb8129f0e0ae
Aubrey Plaza reveals truth of viral SAG moment,https://www.news.com.au/entertainment/awards/the-white-lotus-star-reveals-what-really-happened-with-aubrey-plaza-at-sag-awards/news-story/a1f371b8b4b2f2f039cd4dce743ded91
Australian Survivor finally rights its wrongs,https://www.news.com.au/entertainment/tv/reality-tv/australian-survivor/heroes-vs-villains-is-the-perfect-survivor-season/news-story/5de771e7adb226af8d701e5c04d85467
What impact your daily commute has,https://www.news.com.au/national/carbon-emissions-how-every-mode-of-transport-compares/news-story/72a0c7b01d6a5202342762db14de22f9
New car brand reveals plans for Australia,https://www.news.com.au/technology/motoring/motoring-news/renault-eyes-important-new-models-for-australia/news-story/a4729037781f2295f07663a139154fc3
Aussie rapper dropped after ‘paedophile’ rant,https://www.news.com.au/technology/online/social/rapper-spanian-dropped-after-paedophile-rant/news-story/b1f1a0f2436be79aa402b021f9388abb
Autumn chill set to hit as summer ends,https://www.news.com.au/technology/environment/five-degrees-below-average-spell-of-cooler-weather-to-hit-east-while-heatwave-sizzles-the-west/news-story/7a277e84facb9c0176086b776cd95317
"$2,300 off top-rated Lenovo ThinkBook",https://www.news.com.au/best-of/electronics/gadgets/best-laptop-deals-australia/news-story/ceca9380d0eb073de8fac0f8b8748507
Common $230k money mistake Aussies make,https://www.news.com.au/finance/money/investing/common-230k-money-mistake-parents-make/news-story/ebdbe6c36d3a93fa302fd85f187e201d
‘Forced to sell’: New interest rate blow,https://www.news.com.au/finance/economy/interest-rates/interest-rates-warning-mortgage-buffer-spells-trouble-for-homeowners-and-buyers/news-story/2c4414b99868b948aa7a13af00ae54a7
Awkward video as super tax change slammed,https://www.news.com.au/finance/superannuation/video-of-angus-taylor-backing-in-concessional-tax-hikes-emerges-as-changes-slammed/news-story/8acd7d2ead12dc4f98ba800ee875dcb8
Why product killing tradies isn’t banned,https://www.news.com.au/finance/work/at-work/work-health-and-safety-ministers-meet-to-discuss-banning-engineered-stone/news-story/b9195842741c2f4e0b3e8abf0c60c6c5
11 words that could come back to haunt Albo,https://www.news.com.au/finance/superannuation/treasurer-steps-up-push-to-put-tax-cap-on-high-value-superannuation-accounts/news-story/9a9b6d6cac566b97fd8b516055703da6
‘Never’: Novak shatters unthinkable record,https://www.news.com.au/sport/tennis/novak-djokovic-breaks-record-tennis-never-thought-could-be-broken/news-story/a23676ceadcfe36594900a245938eca2
‘Can you believe it?’: Cricket madness stuns,https://www.news.com.au/sport/cricket/can-you-believe-it-insane-test-thriller-makes-cricket-history/news-story/e86c69dfb4f08688f50280d406b8b00a
‘He’s not there’: Major Schumacher update,https://www.news.com.au/sport/motorsport/formula-one/hes-not-there-formula-1-legend-gives-major-schumacher-update/news-story/7bc3166046d6e36d539e9461e3c648bf
"Dog’s training disaster, Wayne axes star",https://www.news.com.au/sport/nrl/nrl-round-1-teams-announced-full-list-of-team-changes-injuries/news-story/46692cb9bd324e5d92c35eed9f1a7cde
Bellamy’s bombshell retirement reveal,https://www.news.com.au/sport/nrl/time-for-the-club-to-have-a-new-coach-bellamys-frank-admission-may-truly-mean-end-is-near/news-story/39089bc51dcfecfe6e13595d16a15d99
‘Toughest time’: NRL star’s family drama,https://www.news.com.au/sport/nrl/its-probably-been-the-toughest-time-in-my-life-hynes-opens-up-on-offfield-tragedy/news-story/8a1c9bf95b8b84d08b760ee1b11afeba
Roosters hit back at salary cap claims,https://www.news.com.au/sport/nrl/you-worry-less-about-money-and-more-about-winning-roosters-players-defend-cap-jokes/news-story/0848ac29f258f272858b64b8c6b4765f
Clarkson’s shock call amid reporter furore,https://www.news.com.au/sport/afl/cant-guarantee-alastair-clarksons-shock-call-after-threatening-comment-to-reporter/news-story/2f58f32818d5658a7bab0eb711e77c7b
Up to 60% off: Huge sale on Tommy Hilfiger,https://www.news.com.au/best-of/sales-and-deals/best-deals-for-the-iconic/news-story/56e74e33c5ac0bc5305bdfce5e76d565
Game on: Nintendo Switch deals not to miss,https://www.news.com.au/best-of/electronics/nintendo-switch-oled/news-story/e82f5092d3d16d8b60e7e436dccc7dbe
"‘Perfect’, ‘durable’ backpack over 18k rate",https://www.news.com.au/best-of/best-backpacks/news-story/d0e10e9b27edbcc46fb2b4fde2643e82
PT’s trick for building muscle fast,https://www.news.com.au/best-of/sports/best-whey-protein-powder/news-story/65684edcc7ceac86f97d140cfbbc194b
‘Solid choice’: Top eReaders for every budget,https://www.news.com.au/best-of/electronics/gadgets/best-ereaders/news-story/ceb25490bdf9956eaa5a998a9856c7fe
Should straight people use the word ‘partner?’,https://www.news.com.au/web-stories/free/news-com-au/relationships-should-straight-people-use-the-word-partner
Australia’s most in-demand jobs,https://www.news.com.au/web-stories/free/news-com-au/australias-most-in-demand-jobs
Iggy Azalea is making a motza on OnlyFans,https://www.news.com.au/web-stories/free/news-com-au/iggy-azalea-joins-onlyfans-opens-up-about-surgery
‘Painful’: Kylie Jenner's secret health struggle,https://www.news.com.au/web-stories/free/news-com-au/painful-kylie-jenner-opens-up-about-post-partum-depression
Billionaire tennis star calls for equal pay,https://www.news.com.au/web-stories/free/news-com-au/sport-billionaire-tennis-star-jessica-pegula-calls-for-equal-pay
'I am': Woman claims she is Madeleine McCann,https://www.news.com.au/web-stories/free/news-com-au/polish-woman-claims-shes-madeleine-mccann-parents-agree-to-dna-test
Harry Styles’ wild act at first Aussie show,https://www.news.com.au/web-stories/free/news-com-au/footage-shows-harry-styles-doing-a-shoey-at-aussie-concert
‘Kick him out’: Prince Andrew facing ‘eviction’,https://www.news.com.au/web-stories/free/news-com-au/prince-andrew-facing-eviction-as-king-charles-cuts-his-annual-grant
Why major building companies are collapsing,https://www.news.com.au/web-stories/free/news-com-au/why-major-building-companies-are-collapsing-in-australia
‘Concerning’ reason penis size has increased,https://www.news.com.au/web-stories/free/news-com-au/penis-length-has-increased-over-the-past-30-years-study-shows
Sex questions you should ask your partner,https://www.news.com.au/web-stories/free/news-com-au/relationships-sex-questions-you-should-ask-your-partner
Rihanna’s genius move will earn her millions,https://www.news.com.au/web-stories/free/news-com-au/rihannas-genius-super-bowl-move-will-earn-her-millions
YouTube star Logan Paul’s biggest controversies,https://www.news.com.au/web-stories/free/news-com-au/youtube-star-logan-pauls-biggest-controversies
Aussie landlord blasted for ‘entitled’ rant,https://www.news.com.au/web-stories/free/news-com-au/renting-crisis-aussie-landlord-blasted-for-entitled-rant
Why are objects getting shot down in the US?,https://www.news.com.au/web-stories/free/news-com-au/us-military-shoots-down-fourth-mystery-object
New way Gen Z are avoiding paying rent,https://www.news.com.au/web-stories/free/news-com-au/what-is-nesteek-new-way-gen-z-are-avoiding-paying-rent
Rihanna’s jaw-dropping halftime show,https://www.news.com.au/web-stories/free/news-com-au/rihanna-shocks-fans-during-super-bowl-2023-performance
Most controversial Super Bowl performances,https://www.news.com.au/web-stories/free/news-com-au/super-bowl-most-controversial-halftime-performances
Is it harder to buy a house now or ‘back in the day?',https://www.news.com.au/web-stories/free/news-com-au/housing-crisis-is-it-harder-to-buy-a-house-now-or-back-in-the-day
US star's wild Margaret Court rant goes viral,https://www.news.com.au/web-stories/free/news-com-au/phoebe-bridgers-labels-margaret-court-stupid-c-at-melbourne-show
Dating app Tinder introduces Incognito mode,https://www.news.com.au/web-stories/free/news-com-au/tinder-introduces-incognito-mode-and-other-safety-features
Man's spectacular flight fail to wrong Sydney,https://www.news.com.au/web-stories/free/news-com-au/man-goes-to-wrong-sydney-after-spectacular-flight-fail
'Crazy': Harry’s Grammys speech sparks backlash,https://www.news.com.au/web-stories/free/news-com-au/grammys-2023-harry-styles-speech-sparks-backlash
Here are Beyonce’s most iconic moments,https://www.news.com.au/web-stories/free/news-com-au/grammys-2023-beyonces-most-iconic-moments
Worst part about flying could soon vanish,https://www.news.com.au/web-stories/free/news-com-au/major-change-to-way-we-fly-in-the-future-emirates-boss-says
Heatwaves and snow to smash Australia,https://www.news.com.au/web-stories/free/news-com-au/australias-wild-week-of-weather
Surprise as Paris isn’t most romantic city,https://www.news.com.au/web-stories/free/news-com-au/paris-is-no-longer-the-worlds-most-romantic-capital-city
Barbie releases first-ever doll with scoliosis,https://www.news.com.au/web-stories/free/news-com-au/first-ever-barbie-doll-with-scoliosis-unveiled
Child star Frankie Muniz's surprise new career,https://www.news.com.au/web-stories/free/news-com-au/frankie-muniz-is-now-a-professional-racing-driver
Five jobs AI is about to take over forever,https://www.news.com.au/web-stories/free/news-com-au/jobs-that-are-at-risk-of-being-replaced-by-ai-technology
World loses it at Novak Djokovic’s 'special' jacket,https://www.news.com.au/web-stories/free/news-com-au/australian-open-world-loses-it-at-novak-djokovics-22-jacket
Star's incredible audition video goes viral,https://www.news.com.au/web-stories/free/news-com-au/everything-everywhere-all-at-once-star-stephanie-hsus-viral-audition-video
11 movies you’ll absolutely froth in 2023,https://www.news.com.au/web-stories/free/news-com-au/11-top-movies-and-films-youll-froth-in-2023
Brisbane woman making $8m a year at just 28,https://www.news.com.au/web-stories/free/news-com-au/baiia-swimwear-brisbane-woman-makes-8m-a-year-at-just-28
Why we're talking about ethical non-monogamy,https://www.news.com.au/web-stories/free/news-com-au/dating-and-relationships-what-is-ethical-non-monogamy
Why is Australia Day on January 26?,https://www.news.com.au/web-stories/free/news-com-au/why-australia-day-falls-on-january-26
Inside Michael Clarke’s love life after wild video,https://www.news.com.au/web-stories/free/news-com-au/michael-clarkes-wild-love-life-after-public-fight-video-released
Backlash over call to pay Indigenous ‘rent’ tax,https://www.news.com.au/web-stories/free/news-com-au/pay-the-rent-push-for-homeowners-to-pay-indigenous-australians
Why Qantas flight made shock mayday call,https://www.news.com.au/web-stories/free/news-com-au/what-is-mayday-qantas-flight-makes-emergency-landing
Who is Kanye West's new Aussie wife?,https://www.news.com.au/web-stories/free/news-com-au/who-is-bianca-censori-kanye-wests-new-australian-wife
"Woman ditches Sydney, doubles salary, buys home",https://www.news.com.au/web-stories/free/news-com-au/midwife-ditches-sydney-for-alice-springs-and-doubles-salary
Drama behind multimillion-dollar divorce,https://www.news.com.au/web-stories/free/news-com-au/tom-brady-gisele-bundchens-multimillion-dollar-divorce
'Dead money': Aussies refusing to buy house,https://www.news.com.au/web-stories/free/news-com-au/millennials-are-ditching-buying-a-house-and-investing-in-shares-instead
New dating trend as 'hook-up' culture dies out,https://www.news.com.au/web-stories/free/news-com-au/is-hook-up-culture-dead-new-gen-z-relationships-say-so
'Designer vagina’ surgery is booming,https://www.news.com.au/web-stories/free/news-com-au/why-designer-vagina-surgery-is-booming
Four reasons men get paid considerably more,https://www.news.com.au/web-stories/free/news-com-au/men-get-paid-considerably-more-for-the-same-job-data-reveals
World’s safest airline for 2023 revealed,https://www.news.com.au/web-stories/free/news-com-au/qantas-named-worlds-safest-airline-2
Trump says Rihanna ‘worst show in history’,https://www.news.com.au/entertainment/music/rihanna-accused-of-worst-lip-sync-ever-at-super-bowl/news-story/c4aed16d73fbf5a0f5109c03d4442381
15 famous sayings with weird origins,https://www.news.com.au/national/15-famous-sayings-with-weird-origins/audio/cd048662ffa2d0fa5170496dbe924698
