title,url
Aussies jump on popular travel trend,https://www.news.com.au/web-stories/free/news-com-au/best-pet-friendly-holiday-homes-in-australia
'Regrettable': Adam Levine cheating scandal explodes,https://www.news.com.au/web-stories/free/news-com-au/adam-levine-accused-of-secret-affair-with-models
Truth about Princess Kate's secret double life,https://www.news.com.au/web-stories/free/news-com-au/the-truth-about-kate-middletons-secret-double-life
Fans accuse Harry of 'disrespectful' act,https://www.news.com.au/web-stories/free/news-com-au/queens-funeral-royal-watchers-slam-harrys-disrespectful-act
'Dead money': Aussies refusing to buy house,https://www.news.com.au/web-stories/free/news-com-au/millennials-are-ditching-buying-a-house-and-investing-in-shares-instead
Meghan request that delayed Fab Four walk,https://www.news.com.au/web-stories/free/news-com-au/queen-death-meghan-markle-request-that-delayed-fab-four-walk
Best looks from Emmy Awards red carpet,https://www.news.com.au/web-stories/free/news-com-au/2022-emmy-awards-fashion-zendaya-leads-best-looks-on-red-carpet
Surprise reaction to Meghan's 'lovely' act,https://www.news.com.au/web-stories/free/news-com-au/queen-death-meghan-reunites-with-harry-will-kate
Sexuality type we don’t talk about,https://www.news.com.au/web-stories/free/news-com-au/asexuality-sexuality-type-we-dont-talk-about-often
'Not the truth': Film's wild drama explained,https://www.news.com.au/web-stories/free/news-com-au/dont-worry-darling-drama-harry-styles-appears-to-spit-on-chris-pine
New dating trend as 'hook-up' culture dies out,https://www.news.com.au/web-stories/free/news-com-au/is-hook-up-culture-dead-new-gen-z-relationships-say-so
Surprise Aussie city wins world’s ‘coolest’ street,https://www.news.com.au/web-stories/free/news-com-au/travel-melbourne-makes-time-outs-coolest-streets-ranking
'Designer vagina’ surgery is booming,https://www.news.com.au/web-stories/free/news-com-au/why-designer-vagina-surgery-is-booming
Four reasons men get paid considerably more,https://www.news.com.au/web-stories/free/news-com-au/men-get-paid-considerably-more-for-the-same-job-data-reveals
Why women everywhere hate this man,https://www.news.com.au/web-stories/free/news-com-au/andrew-tate-warning-over-viral-tiktok-rape-culture-videos
Worst in world: new COVID strain causing concern,https://www.news.com.au/web-stories/free/news-com-au/xbb15-covid-variant-new-york
The bizzare new burial trend sweeping the US,https://www.news.com.au/web-stories/free/news-com-au/human-composting-new-york
World’s safest airline for 2023 revealed,https://www.news.com.au/web-stories/free/news-com-au/qantas-named-worlds-safest-airline-2
Musk drops major Twitter bombshell,https://www.news.com.au/technology/online/social/elon-musk-confirms-bombshell-that-will-change-twitter/news-story/d40ceadd51ea0dd60957ec41af9f2a8d
15 famous sayings with weird origins,https://www.news.com.au/national/15-famous-sayings-with-weird-origins/audio/cd048662ffa2d0fa5170496dbe924698
