title,url
STUNNING RESIGNATION: Essendon CEO quits after only one day in the job,https://www.news.com.au/sport/afl/essendon-ceo-andrew-thornburn-quits-job-after-only-one-day/news-story/cff4ee992bd052ec2c07c2d1fdd8c496
Brittany Higgins breaks down in court,https://www.news.com.au/national/nsw-act/courts-law/brittany-higgins-wipes-tears-away-in-court-on-the-first-day-of-the-trial-of-bruce-lehrmann/news-story/a70a4e6415a31947e5d14769da4d3460
Russia’s best troops defeated by Ukraine,https://www.news.com.au/world/europe/ukraine-says-key-eastern-town-of-lyman-cleared-of-russian-troops-said-to-be-some-of-putins-best/news-story/4dda2c109322ac0d50e2cffba21f7763
$2000 ‘shock’ coming for homeowners,https://www.news.com.au/finance/economy/interest-rates/interest-rates-how-much-the-cash-rate-could-rise-by-2023/news-story/dc2d53fda7f84927a7fa94120c4dab09
Embarrassing detail in new Sussex photo,https://www.news.com.au/entertainment/celebrity-life/new-meghan-and-harry-photos-expose-embarrassing-habit/news-story/d843845d785f4ea6bbecd383462b6040
Huge hint that tax cuts could be scrapped,https://www.news.com.au/finance/money/tax/labor-frontbencher-tanya-plibersek-criticises-uks-scrapped-tax-plan-for-rich/news-story/99b92ed01e8af6f170bf260454efbfdc
New Meghan and Harry pictures released,https://www.news.com.au/entertainment/celebrity-life/royals/meghan-markle-prince-harry-in-professional-behind-the-scenes-photos-from-uk-visit/news-story/b7cf2222c28c1c1afe9e61d62aeba6b1
Bella Hadid turns heads once again,https://www.news.com.au/lifestyle/fashion/fashion-shows/bella-hadid-turns-heads-once-again-in-sheer-gold-one-piece/news-story/d47b49e79b90168e294f224e4c395bf2
Karl’s fury at Jetstar over teen daughter,https://www.news.com.au/travel/travel-updates/incidents/karl-stefanovic-unleashes-on-jetstar-over-treatment-of-teen-daughter/news-story/508381f15514a1631f2b71076445351e
Disgraced Rolf Harris gravely ill with cancer,https://www.news.com.au/entertainment/celebrity-life/paedophile-entertainer-rolf-harris-is-gravely-ill-with-neck-cancer-can-no-longer-speak-and-is-fed-through-a-tube/news-story/3405ea6335d3b1f39d39498e0442525e
‘Wow’: Star’s ‘awkward’ sex request from ex,https://www.news.com.au/lifestyle/relationships/sex/former-bachelor-stars-awkward-sex-request-from-ex-boyfriend/news-story/00ee3df8c12ba5bbb36659ec9535123d
Traveller stunned at Aussie Macca’s,https://www.escape.com.au/destinations/australia/10-things-that-baffle-indians-about-australia/image-gallery/cbc00da8af6daa31927c2593f7a8b071
Indonesia probes elite officers as stadium disaster death toll rises,https://www.news.com.au/breaking-news/indonesia-probes-elite-officers-over-stadium-disaster/news-story/e47257b3ca7d65bca6985d708cc76f28
North Korea fires ballistic missile over Japan,https://www.news.com.au/breaking-news/north-korea-fires-midrange-ballistic-missile-that-flies-over-japan/news-story/6f2b8c8a3223a741a02ef2731c2ef858
Twist after Aussie company cuts 170 jobs,https://www.news.com.au/finance/business/manufacturing/norco-ice-cream-factory-to-be-rebuilt/news-story/117fd66a3a8ae2ac25ee91810c928adc
Bachelor stars’ shocking sex confessions,https://www.news.com.au/national/ive-got-news-for-you/podcast/addc2b261d7ffa5efaf36d1dc52803c0
Levine’s wife supports him amid scandal,https://www.news.com.au/entertainment/celebrity-life/hook-ups-break-ups/behati-prinsloo-supports-adam-levine-at-first-show-since-cheating-scandal/news-story/19468cc2ea841055e5e39a36cc644330
‘Pitiful’: Kanye’s latest stunt slammed,https://www.news.com.au/entertainment/celebrity-life/celebrity-photos/kanye-west-debuts-yeezy-line-with-controversial-white-lives-matter-tshirt/news-story/f4606db297a68418a0aac524c664b12c
Actress steps out in sheer two-piece,https://www.news.com.au/entertainment/celebrity-style/florence-pugh-steps-out-in-showstopping-sheer-valentino-dress/news-story/a030a8c7439d0ca1344e8a1dccf09736
Inside Big Bang co-stars’ on-set romance,https://www.news.com.au/entertainment/celebrity-life/hook-ups-break-ups/kaley-cuoco-and-johnny-galecki-open-up-about-big-bang-theory-romance/news-story/bdb684cae9958e18d32543dfa05ad8d9
Star exits ‘bunker’ for first night out in years,https://www.news.com.au/entertainment/celebrity-life/germaphobe-howard-stern-leaves-bunker-for-first-night-out-with-friends-since-2020/news-story/b0e3597fb83d9e0b7dd5349a5260a6c0
‘Barely lucid’: Jury to be shown Higgins’ texts,https://www.news.com.au/national/nsw-act/courts-law/brittany-higgins-bruce-lerhmann-arrive-at-court-as-trial-begins/news-story/1a7da3c0f82ea6e6c625773d1a6caa1d
‘Nasty’: Severe warnings ahead of record rain,https://www.news.com.au/technology/environment/nasty-rain-and-flooding-in-store-for-australians-this-week/news-story/3c05b99bb2b9762ca8243511c283f50b
‘Tent city’ in elite Sydney suburb up in flames,https://www.news.com.au/national/nsw-act/crime/tent-city-in-affluent-sydney-suburb-dee-why-goes-up-in-flames-police-arrest-two-men-and-seize-machete/news-story/1dc7865c6f3f3787d36fbc105b359632
‘Deeply saddening’: 100 Australian kids die,https://www.news.com.au/lifestyle/real-life/news-life/100-kids-known-to-victorias-child-protection-services-died-in-two-years/news-story/57eebc424f3083b3e68ccc0d306945fa
ASX goes ballistic on best day in two years,https://www.news.com.au/finance/markets/australian-markets/spasx-200-booms-as-rba-confirms-sixth-interest-rate-hike-since-may/news-story/051b77710f0ccfd1ebc326b7eb0f94b9
Pair’s frightening ‘head-on’ shark encounter,https://www.news.com.au/technology/science/animals/truth-about-great-white-sharks-headon-encounter-with-humans/news-story/57d5ee49fe337f87535673c613d0572d
Star’s gruesome injuries after freak accident,https://www.news.com.au/sport/cricket/england-cricketer-ian-bell-shows-off-gruesome-injuries-after-freak-golf-accident/news-story/28654925733c19faf5530cf3222b9c4d
Elon hits back after sparking Ukraine fury,https://www.news.com.au/world/elon-hits-back-after-sparking-ukraine-fury/news-story/dbb915560fc0c459885f0b23fd721e74
Japan evacuates as North Korea fires missile,https://www.news.com.au/technology/innovation/military/japan-tells-residents-to-shelter-as-north-korea-fires-ballistic-missile/news-story/5bf4a38eb1968149bbb1ff3af0a46343
"Trump sues CNN for defamation, seeks $730m",https://www.news.com.au/world/north-america/donald-trump-sues-cnn-claiming-defamation-seeks-730-million/news-story/9e8d64a1eeadf2187e217f4f48cd4988
Unassuming home hides ‘Vogue’ surprise inside,https://www.realestate.com.au/news/stunning-geelong-home-speaks-of-artistry-and-skill/?rsf=syn:news:nca:news:spa:strap
Live in secluded rainforest for under $800K,https://www.realestate.com.au/news/rainforest-retreat-with-studio-and-granny-flat/?rsf=syn:news:nca:news:spa:strap
Surprise good news behind rate rises,https://www.realestate.com.au/news/reserve-banks-unexpected-interest-rate-move-and-what-it-means-for-housing/?rsf=syn:news:nca:rea:news-strap
Star reveals wild note left on her car,https://www.news.com.au/lifestyle/relationships/dating/respect-the-hustle-aussies-response-to-american-dating/news-story/4ec13164f51fd453d5f6ea937338561a
Birthday boy slammed in ruthless note,https://www.news.com.au/lifestyle/real-life/news-life/birthday-boy-slammed-by-neighbour-in-ruthless-letter/news-story/97b07bab72b86526155c834c8bb409fc
Man’s ‘disgusting’ find in Coles,https://www.news.com.au/lifestyle/real-life/news-life/shopper-begs-for-action-after-snapping-photos-of-pigeon-droppings-at-coles-store/news-story/d2fb8addad1a6e2daa3558a551314d3d
X-ray shows fatal issue with household item,https://www.news.com.au/lifestyle/real-life/news-life/xray-shows-danger-of-common-household-item/news-story/15a3270064b8ccd9cf07e5e530de9b91
Aussie star confirms husband rumour,https://www.news.com.au/lifestyle/real-life/news-life/former-miss-universe-australia-confirms-rumours-about-husband/news-story/7d7e5b883a5f8eb4d375a3f932ab7a67
Popular resume design comes with a catch,https://www.seek.com.au/career-advice/article/5-things-employers-wish-they-could-say-about-your-resume?tracking=DAC-NAS-NCS_2020-26893&utm_campaign=NCS_2020&utm_source=Newcorp&utm_medium=Display&utm_content=Vis_CA_AO_R+CL
Toddler’s gorgeous reaction to mum’s adoption,https://www.kidspot.com.au/news/my-toddler-had-a-heartwrenching-reaction-when-i-told-her-i-was-adopted/news-story/4e690599aeac3d4735e9aaa03e597c27
‘Results are fab’: Hair removal tool wows,https://www.news.com.au/best-of/sales-and-deals/best-deals-for-the-iconic/news-story/56e74e33c5ac0bc5305bdfce5e76d565
Woman’s toilet question divides the internet,https://www.news.com.au/travel/travel-updates/travel-stories/womans-hotel-toilet-question-divides-the-internet/news-story/2a94aec4c8a4f9be8b2822efbdd2be25
Fury over woman’s plane ‘health hazard’,https://www.news.com.au/travel/travel-updates/travel-stories/passenger-slammed-for-appalling-health-hazard-on-plane/news-story/fbf3abeeecc1a45d7b6fa770fe986661
Family’s ‘woefully bad’ airline experience,https://www.news.com.au/travel/travel-updates/incidents/frustrated-customers-slams-jetstar-over-woefully-bad-communication-system/news-story/5886d7ef10b9336deecd776b9380b839
‘Radiation risk’: Nuclear threat to Aussies,https://www.news.com.au/travel/travel-updates/warnings/radiation-risk-nuclear-threat-discovered-off-the-wa-coast/news-story/c096a95fc3779c73c24c956b93bddbdb
Woman’s gruesome sight on plane,https://www.news.com.au/travel/travel-updates/travel-stories/i-was-left-gagging-during-my-5hour-flight-after-passenger-decided-to-cut-his-toenails/news-story/89973a2b999c104ab7d27f10a7a774e4
Karl explodes over plan to return ISIS brides,https://www.news.com.au/entertainment/tv/morning-shows/karl-slams-shorten-over-plan-to-repatriate-islamic-state-brides-and-their-children/news-story/e3c29a3fdf31be7afd1aa35387cac224
A-list stars spotted out in Sydney,https://www.news.com.au/entertainment/celebrity-life/celebrity-photos/ryan-gosling-eva-mendes-and-jason-momoa-spotted-out-in-sydney/news-story/9178aa0359cc2013f696f3a26a5c37ab
New Meghan and Harry pictures released,https://www.news.com.au/entertainment/celebrity-life/royals/meghan-markle-prince-harry-in-professional-behind-the-scenes-photos-from-uk-visit/news-story/b7cf2222c28c1c1afe9e61d62aeba6b1
Brutal finish to Farmer Wants A Wife,https://www.news.com.au/entertainment/tv/reality-tv/james-weir-recaps-farmer-wants-a-wife-2022-episode-12-finale/news-story/f7157366c7727d9b63ac3727c2422ddb
Kyle and Jackie O briefly ‘dumped’ from air,https://www.news.com.au/entertainment/tv/radio/kyle-and-jackie-o-dumped-off-air-following-technical-error-on-live-morning-show/news-story/546b10223d5dceb54de21e3b8341ce46
Former ‘war on terror’ advisor retires from top firm,https://www.news.com.au/technology/gaming/911-torture-defender-retires-from-activision-blizzard/news-story/71730aabca8b2380f8e866b2f04dd9cd
Telstra hit with third party data breach,https://www.news.com.au/technology/online/hacking/telstra-reveals-data-breach-hit-30k-employees-after-optus-cyber-attack-reports-claim/news-story/437d4da4d44f560d3dfc9e692a85a301
Surprise at Twitch Con’s unexpected sponsors,https://www.news.com.au/technology/gaming/move-over-energy-drinks-milk-sponsors-twitch-con/news-story/99de835c05f6ab79165e5df4bd932dd9
Infuriating cop car photo enrages drivers,https://www.news.com.au/technology/motoring/on-the-road/drivers-enraged-over-sneaky-police-car-parked-alongside-highway/news-story/c202d85b8eba623f237b457b380d1136
Australia whiffs at League of Legends World Champs,https://www.news.com.au/technology/gaming/australia-whiffs-at-league-of-legends-world-champs/news-story/9212abc8cecfee4e4d3b3ff5e4387736
Twist after Aussie company cuts 170 jobs,https://www.news.com.au/finance/business/manufacturing/norco-ice-cream-factory-to-be-rebuilt/news-story/117fd66a3a8ae2ac25ee91810c928adc
Banks immediately hike interest rates in full,https://www.news.com.au/finance/economy/interest-rates/interest-rates-decision-rba-predicted-to-raise-cash-rate-by-05-per-cent/news-story/a04a25419032a0a8078db4b81fc978ab
Huge hint that tax cuts could be scrapped,https://www.news.com.au/finance/money/tax/labor-frontbencher-tanya-plibersek-criticises-uks-scrapped-tax-plan-for-rich/news-story/99b92ed01e8af6f170bf260454efbfdc
Big question looms over rate hike,https://www.news.com.au/finance/economy/australian-economy/big-question-looms-over-reserve-bank-of-australias-interest-rate-hike/news-story/fa6b807d579cc6003785165372591a98
Kim fined $2m over dodgy crypto scheme,https://www.news.com.au/finance/money/investing/mooners-shakers-bitcoin-bounces-kardashian-fined-126m-for-unlawful-emax-promotion/news-story/374b4524ff13f1d555d2eee293416b82
Ex-NRL star arrested over pitch invasion,https://www.news.com.au/sport/nrl/grand-final-pitch-invader-revealed-to-be-former-raiders-star-mark-mclinden/news-story/8ccc9fa87af6f3eaa7b9acb3a601123d
‘That is a lie’: Big AFL trade news drops,https://www.news.com.au/sport/afl/that-is-a-lie-afl-trade-news-drops-as-jackson-grundy-moves-swirl/news-story/4c3a420c8a8cd3409cca2a6f64278cc9
‘Scary’: NBA reacts as Simmons returns,https://www.news.com.au/sport/american-sports/nba/ben-simmons-returns-to-nba-court-in-first-game-for-brooklyn/news-story/21ebf6450a4763e0fee468d004ed31cd
‘Arrogant’ Panthers are right on the money,https://www.news.com.au/sport/nrl/panthers-legend-says-current-teams-arrogance-is-right-on-the-money/news-story/71c9f52b577287ab9051ff8702351ecf
Phone call puts premiership star in his place,https://www.news.com.au/sport/nrl/been-dealt-with-api-koroisaus-wests-tigers-taunt-falls-flat/news-story/3abe49a00b943f490c903b4f792cb948
Divided Aussies react to Price’s comments,https://www.news.com.au/sport/afl/aflw/aflw-fans-slam-steve-price-while-others-back-the-columnist/news-story/3b5fb6b8f10d12b3fcb19fc9f536ac51
NRL star hit with brutal sledge after scandal,https://www.news.com.au/sport/nrl/panthers/penrith-panthers-star-api-koroisau-taunted-by-woman-at-centre-of-ugly-scandal-just-hours-after-nrl-grand-final-win/news-story/fb36748107ae9e08ce27281d9b69c115
US star doesn’t get it after Aussie miracle,https://www.news.com.au/sport/american-sports/nba/devin-booker-savaged-over-reaction-to-suns-loss-to-adelaide-76ers/news-story/3cdade7ee9a0173c0009d13d24f4d017
‘Enormous value’: Amazon’s sellout beauty calendar,https://www.news.com.au/best-of/gifts/amazon-advent-calendar/news-story/a3d920c9b44f77b91eb483d16a746d6d
‘Results are fab’: Hair removal tool wows,https://www.news.com.au/best-of/sales-and-deals/best-deals-for-the-iconic/news-story/56e74e33c5ac0bc5305bdfce5e76d565
‘High demand’: New Oodie product launches,https://www.news.com.au/best-of/sales-and-deals/best-weekly-deals/news-story/f2e3292f923e682ff447423f9a6c6888
$150.95 off: PlayStation accessory deals,https://www.news.com.au/best-of/electronics/best-playstation-deals-australia/news-story/b5fc04b74062b6b7358de25679c99c41
How $99 hair tool stacks up to Airwrap,https://www.news.com.au/best-of/beauty/dyson-airwrap-multi-styler-review/news-story/97a41e8bb098363079efa5fcd7d06e0e
'Disgusting' act shocks Australian TV star,https://www.news.com.au/web-stories/free/news-com-au/australia-cup-nazi-salute-shocks-australian-tv-star-2
Mum’s ‘experiment’ turns into $3.7m idea,https://www.news.com.au/web-stories/free/news-com-au/melbourne-business-the-australian-natural-soap-company-makes-3-7m
Vegan protester making thousands,https://www.news.com.au/web-stories/free/news-com-au/tash-peterson-vegan-protester-and-onlyfans-stars-notorious-stunts
Millions to go beyond ‘quiet quitting’,https://www.news.com.au/web-stories/free/news-com-au/quiet-quitting-millions-of-australians-to-leave-their-job
Shopping hack Aussie tourists don’t know about,https://www.news.com.au/web-stories/free/news-com-au/tourist-discount-aussies-dont-know-about
Aussie Netflix hit the world is obsessed with,https://www.news.com.au/web-stories/free/news-com-au/heartbreak-high-why-the-world-is-frothing-for-aussie-netflix-hit
Real reason you can't use your phone on plane,https://www.news.com.au/web-stories/free/news-com-au/experts-reveal-why-you-need-to-turn-off-your-phone-on-a-flight
Mystery surrounding sex act finally solved,https://www.news.com.au/web-stories/free/news-com-au/sex-and-relationships-is-squirting-actually-a-thing
'Staggering': Disturbing trend at Aussie brands,https://www.news.com.au/web-stories/free/news-com-au/jb-hi-fi-nick-scali-baby-bunting-disturbing-trend-at-aussie-brands
Queen's biggest wish before her death,https://www.news.com.au/web-stories/free/news-com-au/queen-elizabeths-biggest-wish-was-to-heal-harry-meghan-rift
'Chaos': Rain bomb to smash Australia,https://www.news.com.au/web-stories/free/news-com-au/sydney-weather-australia-smashed-by-rain-band
Proof Keanu Reeves may be the nicest guy on Earth,https://www.news.com.au/web-stories/free/news-com-au/keanu-reeves-may-be-the-nicest-guy-on-earth
Five signs your partner wants a divorce,https://www.news.com.au/web-stories/free/news-com-au/relationships-five-signs-your-partner-wants-a-divorce
Aussies jump on popular travel trend,https://www.news.com.au/web-stories/free/news-com-au/best-pet-friendly-holiday-homes-in-australia
'Regrettable': Adam Levine cheating scandal explodes,https://www.news.com.au/web-stories/free/news-com-au/adam-levine-accused-of-secret-affair-with-models
Truth about Princess Kate's secret double life,https://www.news.com.au/web-stories/free/news-com-au/the-truth-about-kate-middletons-secret-double-life
New law to get Boomers to sell their homes,https://www.news.com.au/web-stories/free/news-com-au/real-estate-new-law-to-get-boomers-to-sell-their-homes
Fans accuse Harry of 'disrespectful' act,https://www.news.com.au/web-stories/free/news-com-au/queens-funeral-royal-watchers-slam-harrys-disrespectful-act
'Return it': War erupts over Queen’s $591m jewel,https://www.news.com.au/web-stories/free/news-com-au/queens-funeral-war-erupts-over-royal-591m-jewel
Meghan blindsided by kids' new titles,https://www.news.com.au/web-stories/free/news-com-au/queens-death-meghan-blindsided-by-archie-and-lilibets-new-royal-titles
'Dead money': Aussies refusing to buy house,https://www.news.com.au/web-stories/free/news-com-au/millennials-are-ditching-buying-a-house-and-investing-in-shares-instead
Emotional scenes as world farewells Queen,https://www.news.com.au/web-stories/free/news-com-au/queens-funeral-world-bids-final-farewell-to-elizabeth-ii
Justin Bieber reveals 'horrible' diagnosis,https://www.news.com.au/web-stories/free/news-com-au/what-is-ramsay-hunt-syndrome-justin-bieber-reveals-diagnosis
Who will inherit Queen's most precious tiaras,https://www.news.com.au/web-stories/free/news-com-au/who-will-inherit-queen-elizabeths-most-famous-tiaras
'Unrelenting': Country on the brink of disaster,https://www.news.com.au/web-stories/free/news-com-au/climate-change-pakistan-on-the-brink-of-disaster
'Incredible': New show everyone is obsessed with,https://www.news.com.au/web-stories/free/news-com-au/jeremy-allen-white-reacts-to-the-bear-thirst-obsession
Meghan request that delayed Fab Four walk,https://www.news.com.au/web-stories/free/news-com-au/queen-death-meghan-markle-request-that-delayed-fab-four-walk
Best looks from Emmy Awards red carpet,https://www.news.com.au/web-stories/free/news-com-au/2022-emmy-awards-fashion-zendaya-leads-best-looks-on-red-carpet
Surprise reaction to Meghan's 'lovely' act,https://www.news.com.au/web-stories/free/news-com-au/queen-death-meghan-reunites-with-harry-will-kate
Fans call out William's behaviour towards Kate,https://www.news.com.au/web-stories/free/news-com-au/queens-death-fans-call-out-prince-williams-behaviour-towards-kate
Queen Elizabeth’s most playful moments,https://www.news.com.au/web-stories/free/news-com-au/good-evening-mr-bond-queen-elizabeths-most-playful-moments
'Much-loved': Harry and William’s touching tribute,https://www.news.com.au/web-stories/free/news-com-au/prince-harry-and-prince-williams-heartwarming-tribute-to-queen
'Finally': Apple reveals huge iPhone change,https://www.news.com.au/web-stories/free/news-com-au/latest-iphone-14-released-by-apple-comes-with-a-hefty-price
Huge change coming to Aussie cash,https://www.news.com.au/web-stories/free/news-com-au/queen-elizabeth-death-what-happens-to-australian-money
The Queen's three most defining moments,https://www.news.com.au/web-stories/free/news-com-au/royals-queen-elizabeth-iis-most-defining-moments
Queen Elizabeth’s iconic life in pictures,https://www.news.com.au/web-stories/free/news-com-au/queen-elizabeth-ii-dies-at-96-a-royal-life-in-pictures
Sexuality type we don’t talk about,https://www.news.com.au/web-stories/free/news-com-au/asexuality-sexuality-type-we-dont-talk-about-often
Woman who identifies as a wolf cops backlash,https://www.news.com.au/web-stories/free/news-com-au/woman-who-identifies-as-wolf-opens-up-about-her-unique-life
‘Rubbish’: Real reason Tracy Grimshaw quit,https://www.news.com.au/web-stories/free/news-com-au/tracy-grimshaw-reveals-why-shes-leaving-a-current-affair
'Not the truth': Film's wild drama explained,https://www.news.com.au/web-stories/free/news-com-au/dont-worry-darling-drama-harry-styles-appears-to-spit-on-chris-pine
Rare weather event 'SAM' to smash Australia,https://www.news.com.au/web-stories/free/news-com-au/what-is-sam-rare-weather-phenomenon-to-smash-australia
Best Nintendo 64 games of all time,https://www.news.com.au/web-stories/free/news-com-au/best-nintendo-64-games-of-all-time
New dating trend as 'hook-up' culture dies out,https://www.news.com.au/web-stories/free/news-com-au/is-hook-up-culture-dead-new-gen-z-relationships-say-so
Surprise Aussie city wins world’s ‘coolest’ street,https://www.news.com.au/web-stories/free/news-com-au/travel-melbourne-makes-time-outs-coolest-streets-ranking
What really killed Princess Diana,https://www.news.com.au/web-stories/free/news-com-au/what-really-killed-princess-diana
Wild new Taylor Swift conspiracy theory,https://www.news.com.au/web-stories/free/news-com-au/midnights-taylor-swift-fans-reveal-wild-kanye-kardashian-theory
'Lyn is dead': Bombshell verdict in murder trial,https://www.news.com.au/web-stories/free/news-com-au/chris-dawson-trial-ex-teacher-guilty-of-murdering-wife-lynette
'Designer vagina’ surgery is booming,https://www.news.com.au/web-stories/free/news-com-au/why-designer-vagina-surgery-is-booming
The Aussie suburbs with ‘ridiculous’ rent hikes,https://www.news.com.au/web-stories/free/news-com-au/the-ridiculous-rent-hikes-in-aussie-suburbs
Four reasons men get paid considerably more,https://www.news.com.au/web-stories/free/news-com-au/men-get-paid-considerably-more-for-the-same-job-data-reveals
'This is it': Why you won't see actor anymore,https://www.news.com.au/web-stories/free/news-com-au/steve-martin-says-he-will-no-longer-seek-acting-work
Scary trap in new 'quiet quitting' trend,https://www.news.com.au/web-stories/free/news-com-au/scary-trap-in-quiet-quitting-trend-in-aussie-offices
Dangerous sex act on the rise,https://www.news.com.au/web-stories/free/news-com-au/sex-and-relationships-scary-condom-trend-on-the-rise
Why women everywhere hate this man,https://www.news.com.au/web-stories/free/news-com-au/andrew-tate-warning-over-viral-tiktok-rape-culture-videos
'Rare event': Aussies brace for six months of rain,https://www.news.com.au/web-stories/free/news-com-au/weather-aussies-brace-for-six-months-of-rain
Aussies saving a motza with 'cash stuffing’ trend,https://www.news.com.au/web-stories/free/news-com-au/what-is-cash-stuffing-millennials-save-thousands-with-money-hack
'Missing' Aussie actor found in LA jail after date,https://www.news.com.au/web-stories/free/news-com-au/australian-actor-laura-mcculloch-found-in-jail-after-online-date
Incredible hurricane moment goes viral,https://www.news.com.au/technology/environment/catastrophic-hurricane-ian-bears-down-on-florida/news-story/26576d37dbe821fddd639399cf422931
15 famous sayings with weird origins,https://www.news.com.au/national/15-famous-sayings-with-weird-origins/audio/cd048662ffa2d0fa5170496dbe924698
