title,url
DRAGGED INTO COURT: Landlord in trouble over bold unit renovation,https://www.news.com.au/finance/real-estate/renting/aussie-landlord-taken-to-court-after-turning-onebedroom-unit-into-five-bedrooms/news-story/1d31e8cf8aa0eef4ea2fab018e5ffa04
Urgent mask call amid Covid surge,https://www.news.com.au/world/coronavirus/health/nsw-health-calls-for-residents-to-wear-masks-indoors/news-story/508b68a08477b28ad72130a31d74a28b
‘Mortifying poo incident changed my life’,https://www.news.com.au/lifestyle/health/health-problems/melbourne-man-loses-30kg-after-horror-incident-in-bosss-bed/news-story/63fba1be967222ea7d1dab631fc6ee8c
F1 driver sacked and replaced in 30 minutes,https://www.news.com.au/sport/motorsport/formula-one/disappointed-mick-schumacher-fired-by-haas-nico-hulkenberg-signs/news-story/2402703cd77300a87505f223de961fa1
Bizarre sight spotted amid Aussie floods,https://www.news.com.au/technology/environment/mitre-10-owner-catching-yabbies-inside-flooded-store/news-story/cb4f84858e0ef8d87329be1b9df5dbdb
Sad truth about Rebel ‘leaving’ her baby,https://www.news.com.au/entertainment/celebrity-life/sad-truth-about-rebel-wilson-leaving-her-baby-to-party/news-story/4c68b0261a7b0355224d1d913955fbd3
Huge election blow for Joe Biden,https://www.news.com.au/world/north-america/us-politics/republicans-win-back-control-of-us-house-after-midterm-elections/news-story/b8b2108c5167337ca827cfc45019a3b5
Ousted far-right leader ‘can’t wear pants’,https://www.news.com.au/world/south-america/brazils-reclusive-bolsonaro-has-a-skin-infection-cannot-wear-pants/news-story/6fece6ead07493a12d30200b7846ab7b
Model flashes nipples in see-through dress,https://www.news.com.au/lifestyle/fashion/celebrity/inside-starstudded-opening-of-cartiers-new-flagship-sydney-store/news-story/f744abee35233972a112f9f04162dbf3
‘That’s crazy’: Aussie star’s unbelievable act,https://www.news.com.au/sport/cricket/australia-vs-england-live-blog-first-odi-at-adelaide-oval/live-coverage/7c32888dbd56b3e3a63da2cdd6de37a9
‘F*** off’: Qantas boss ambushed on street,https://www.news.com.au/travel/travel-updates/health-safety/f-off-qantas-boss-alan-joyce-ambushed-by-aussie-cossack-on-street/news-story/f1712b291aec32b58b363a1c3bcad10c
Save 25% on must-have Converse Chucks,https://www.news.com.au/best-of/sales-and-deals/best-deals-for-the-iconic/news-story/56e74e33c5ac0bc5305bdfce5e76d565
‘Compelling proposition’: Bold bid to get Ronaldo to Australia,https://www.news.com.au/sport/football/compelling-proposition-a-league-bosses-in-bold-bid-to-get-cristiano-ronaldo-to-australia/news-story/95c5cce08f5cf26770785f6b9dc23686
‘Doozy’: Cold storm to whack eastern states,https://www.news.com.au/breaking-news/cold-storm-to-hit-eastern-states-already-suffering-from-floods/news-story/8ca8a1970252c4e43d57b64dab2edde2
Major supermarket’s huge Covid change,https://www.news.com.au/finance/work/mandatory-vaccinations-for-woolworths-staff-to-end/news-story/78ee28e25210cdfdfb59c535566e0f06
The trivia quiz only serious bookworms will pass,https://www.news.com.au/in-the-know-quiz/dashboard
‘A drunk’: Britt slams The Challenge co-star,https://www.news.com.au/entertainment/tv/reality-tv/brittany-hockley-reveals-clash-with-ryan-gallagher-while-filming-the-challenge/news-story/c8eca6c9680b63c6e2d0d3976a65adba
Newspaper slammed for ghastly pic of Kate,https://www.news.com.au/entertainment/celebrity-life/royals/the-mirror-newspaper-slammed-for-photoshopped-kate-middleton-photo/news-story/02f9f87144cfeb0c7ea6d2c5c3078f03
Charles’ ‘slap on the wrist’ to Andrew,https://www.news.com.au/entertainment/celebrity-life/royals/andrew-given-slap-on-the-wrist-by-king-charles-days-before-queens-death/news-story/0b0391e23cefa410bb2e607b179e3e0e
"Ghostbusters star, Playboy model dead",https://www.news.com.au/entertainment/celebrity-life/celebrity-deaths/ghostbusters-star-and-playboy-playmate-kymberly-herrin-dead-aged-65/news-story/725ab211ad69a9e18e25246e98e67eb2
Why Aussies are furious with RnB festival,https://www.news.com.au/entertainment/music/music-festivals/perth-fridayz-live-festival-attendees-rage-at-jay-sean-and-ashantis-performances/news-story/b781ecb1dc6cc119ce78b83457972dcd
Story Australia can’t afford to silence,https://www.news.com.au/lifestyle/real-life/news-life/when-survivors-speak-australia-needs-to-listen/news-story/27441dc15b876cb77ffb625bd9a98194
"‘Broken, traumatised’: Brutal process exposed",https://www.news.com.au/lifestyle/real-life/news-life/broken-and-traumatised-brutal-court-process-exposed/news-story/e3cd4e5976df0efb1d22091ab524d3a0
Major supermarket’s huge Covid change,https://www.news.com.au/finance/work/mandatory-vaccinations-for-woolworths-staff-to-end/news-story/78ee28e25210cdfdfb59c535566e0f06
Huge python’s wild act in Aussie garden,https://www.news.com.au/technology/science/animals/carpet-python-snake-seen-drinking-from-backyard-bird-bath-in-wa/news-story/565f7d09463c846dc94147eb1e0a88db
‘Doozy’: Cold storm to whack eastern states,https://www.news.com.au/breaking-news/cold-storm-to-hit-eastern-states-already-suffering-from-floods/news-story/8ca8a1970252c4e43d57b64dab2edde2
Guy Sebastian’s former manager jailed,https://www.news.com.au/entertainment/music/guy-sebastians-former-manager-titus-day-to-learn-his-fate-over-600k-embezzlement/news-story/1cde79b600149fc40f45c1aef0c432b1
Cricketer on rape charges released from jail,https://www.news.com.au/sport/cricket/sri-lankan-cricket-star-accused-of-rapes-next-move/news-story/efa1572ef18523877791658a4e34d759
‘World’s strongest boy’ now unrecognisable,https://www.news.com.au/sport/sports-life/bodybuilding-sensation-worlds-strongest-boy-now-unrecognisable/news-story/3da62c441b836e88ea472f542e6112aa
‘Bit cheap’: Stingy reward for $7 million find,https://www.news.com.au/lifestyle/real-life/news-life/german-mans-gummy-reward-for-finding-7m-lost-cheque/news-story/e8ae32da9a3c31e756bd2a2b7ec66fcd
"Ferrari implodes, star not talking to boss",https://www.news.com.au/sport/motorsport/formula-one/ferrari-imploding-with-revelation-charles-leclerc-wont-speak-to-team-boss/news-story/de5915205502cdb6dfb35fc0cc66fae8
Huge election blow for Joe Biden,https://www.news.com.au/world/north-america/us-politics/republicans-win-back-control-of-us-house-after-midterm-elections/news-story/b8b2108c5167337ca827cfc45019a3b5
Detained Aussie released in Myanmar,https://www.news.com.au/national/politics/detained-aussie-released-from-myanmar-prison/news-story/21420929473ec946596d6771f3ea5ef3
Beauty business mogul lists iconic $5m farm,https://www.realestate.com.au/news/beaconsfield-upper-businesswoman-gillian-franklins-historic-farm-is-hot-property?rsf=syn:news:nca:news:spa:strap
Hidden perk of cash rate rise for buyers,https://www.realestate.com.au/insights/suburbs-where-homebuyers-now-have-more-power-with-plenty-of-properties-to-choose-from/?rsf=syn:news:nca:rea:insights-strap
Showstopping ex-home of AFL legend hits market,https://www.realestate.com.au/news/paul-roos-former-home-of-afl-great-for-sale-in-elwood/?rsf=syn:news:nca:news:spa:strap
The cancer symptom you can hear,https://www.news.com.au/lifestyle/health/health-problems/the-cancer-symptom-experts-say-you-can-hear/news-story/e32209e8301840847c1599d03cca993a
Surprising offer after disastrous TV overhaul,https://www.news.com.au/lifestyle/food/no-regrets-cafe-to-stick-to-kitchen-nightmares-overhaul-after-turbulent-week/news-story/8ca6ad7d0bcd558bbd29d7d256064fbc
Hidden secret in man’s X-rated confession,https://www.news.com.au/lifestyle/relationships/dating/straight-men-are-using-dating-apps-to-hook-up-with-other-men/news-story/e274abb279ed0aede4097393ceb47e7c
Liz Hurley stuns in skimpy bikini at 57,https://www.news.com.au/lifestyle/beauty/face-body/deal-with-the-devil-liz-hurley-turns-heads-in-green-bikini/news-story/d37ad87c762f032ef55d0f66794b1ded
Woman who married doll makes wild claim,https://www.news.com.au/lifestyle/real-life/news-life/womans-marriage-to-cheating-rag-doll-on-brink-of-collapse/news-story/3b6223c44f497dd97df53caa3cb4d351
CV design misconception finally debunked,https://www.seek.com.au/career-advice/article/this-is-what-a-great-resume-looks-like?tracking=DAC-NAS-NCS_2020-24297&utm_campaign=NCS_2020&utm_source=Newcorp&utm_medium=Display&utm_content=Vis_CA_AO_RES
Adorable $12 onesie parents are going crazy for,https://www.kidspot.com.au/baby/newborn/the-adorable-12-onesie-from-bestless-that-parents-are-losing-their-minds-over/news-story/40321cdce97a5ea8f5fc5b1c41326965
Slash over $300 off top-rated Dyson vacuum,https://www.news.com.au/best-of/sales-and-deals/black-friday-best-early-deals/news-story/b23be204336989a0f61159b52110e3f9
Aussie’s Bali restaurant warning backfires,https://www.news.com.au/travel/travel-updates/health-safety/aussie-refused-service-at-popular-bali-restaurant-over-nut-allergy/news-story/ce8784b502ce4d64c50a73609a1ac50f
Bali tourist hits back at outfit trolls,https://www.news.com.au/travel/australian-tourist-hits-back-at-trolls-who-criticised-her-outfit-while-visiting-an-orphanage-in-bali/news-story/60359c8e3bdeed87b632751f64fb531c
Gruesome discovery on popular beach,https://www.news.com.au/travel/travel-updates/incidents/three-butchered-bodies-wash-ashore-in-mexico-as-tourists-lounge-nearby/news-story/6cc19a9fbe1a0fa087c040f2090f8ddd
‘Appalled’: Laundrie family’s furious demand,https://www.news.com.au/travel/travel-updates/incidents/brian-laundries-family-demands-apology-for-tasteless-jeopardy-clue/news-story/08683dc3b2ecd1d77e84342559c114b2
Bizarre item hostie never travels without,https://www.news.com.au/travel/travel-advice/flights/flight-attendants-never-travel-without-these-items-that-cost-less-than-a-fiver/news-story/8a238cf5a99d842fc1a67d7198ce3d76
Star questions sexuality in wild interview,https://www.news.com.au/entertainment/celebrity-life/julia-fox-says-she-wants-to-start-exploring-her-gay-bone-in-wild-new-interview/news-story/68f12a6d0ed66a9e42443caa491fb7bf
The surprising ‘most watched TV show’,https://www.news.com.au/entertainment/tv/streaming/the-most-popular-tv-show-in-america-and-the-surprising-rise-of-its-creator/news-story/622476eb285935441574e459dbf7a030
Aaron Carter’s death certificate revealed,https://www.news.com.au/entertainment/celebrity-life/celebrity-deaths/aaron-carter-death-certificate-revealed-singer-cremated/news-story/a2e63c39f49a35d3dd7d574445003f9c
Musk taunts Fallon over death hoax,https://www.news.com.au/entertainment/celebrity-life/elon-musk-taunts-jimmy-fallon-over-twitter-death-hoax/news-story/f26780d548e78f8ea756e940228157b5
Another Simpsons prediction comes true,https://www.news.com.au/entertainment/tv/the-simpsons-producer-claims-to-have-predicted-the-future-with-2015-episode/news-story/6af65f17d26832ebd1410e3372ee8e89
Activision Blizzard suspend games in China,https://www.news.com.au/technology/gaming/activision-blizzard-announce-chinese-game-suspensions/news-story/60293c8582add91562018efeb2dad7dc
‘Outback ocean’ not what it seems,https://www.news.com.au/technology/environment/outback-ocean-not-what-it-seems/news-story/26d7ea2449c42e69a1286cd0955e5ccb
‘Speechless’: Fan-made Fallout trailer wows developers,https://www.news.com.au/technology/gaming/fanmade-fallout-trailer-impresses-developers/news-story/42757d12430aab39a2fbe9ebd2db6d2a
Newspaper front page brutally trolls Trump,https://www.news.com.au/finance/business/media/ny-post-front-page-brutally-trolls-donald-trumps-presidential-announcement/news-story/0b8da5dc42a6861dafd3a812e5b91c0d
Last chance to pre-order new Pokémon game,https://www.news.com.au/best-of/electronics/nintendo-switch-oled/news-story/e82f5092d3d16d8b60e7e436dccc7dbe
Fury over ‘racist’ Australia Post sign,https://www.news.com.au/finance/business/retail/australia-post-under-fire-for-racist-sign/news-story/5a8bbffd207f8ec1c4f261f153b1484b
"‘YOU will sit’: Biden’s notes revealed, again",https://www.news.com.au/finance/work/leaders/you-will-sit-joe-biden-again-flashes-detailed-instructions-during-bali-meeting/news-story/f060c787bb06e8511289a88817c3b7b3
‘No safety net’: Warning after Deliveroo collapse,https://www.news.com.au/finance/work/at-work/workers-sacked-after-deliveroo-goes-into-voluntary-administration/news-story/525f6746990f2b82a23c634041332a1a
Target faces mammoth global disaster,https://www.news.com.au/finance/business/retail/target-profits-dive-by-52-as-stressed-shoppers-worry-about-cost-of-living/news-story/dda6a6b6f0458b20aff778d88fcad9ea
Xi Jinping humiliates Canadian PM,https://www.news.com.au/finance/work/leaders/chinese-president-xi-furiously-scolds-canada-pm-trudeau-over-inappropriate-act/news-story/0d1ffdec09603e69de6fc1caee1e7ef7
UFC star arrested trying to leave America,https://www.news.com.au/sport/ufc/ufc-star-israel-adesanya-arrested-at-new-york-airport/news-story/f20895aa467e073cb07b0e7930084f8d
‘Ridiculous’ NBA shot is just plain ‘nuts’,https://www.news.com.au/sport/american-sports/nba/shai-gilgeousalexanders-gamewinner-for-okc-thunder-shows-nbas-newest-star-has-arrived/news-story/5d28b31f32c5ac6d6b78c8e6696b4230
‘No need’: Star rejects Indigenous Cup push,https://www.news.com.au/sport/nrl/no-need-to-divide-it-kangaroos-star-rejects-indigenous-wc-team-push/news-story/b75292a3d8baf47f97e29568d93a7423
‘He was f***ed’: Gallen blasts shock warning,https://www.news.com.au/sport/boxing/paul-gallen-slams-legends-prediction-justin-hodges-will-ko-him-in-huge-upset/news-story/3d654d27fe84872ed912c7365ad26623
AFL star’s photo becomes major issue,https://www.news.com.au/sport/afl/photos-emerge-of-mitch-robinson-and-accused-murderer-us-rapper-blueface/news-story/10783bd12ba1f382f4e7a236d8ec3a40
Beckham’s reputation ruined over Qatar act,https://www.news.com.au/sport/football/world-cup/david-beckhams-billiondollar-dream-turned-him-into-qatars-trained-seal/news-story/33310f71ad701d9919c93d4fa73abc33
"Shaq, Gisele, Osaka sued over $47b ‘deception’",https://www.news.com.au/sport/american-sports/nfl/shaquille-oneal-gisele-bndchen-naomi-osaka-sued-over-47b-scheme/news-story/2d3d2856347e6717953a553918b02e4c
Kyrgios goes ‘full showman’ in ‘bonkers’ win,https://www.news.com.au/sport/tennis/kyrgios-goes-berserk-as-special-ks-pull-off-bonkers-comeback-win-at-atp-finals/news-story/b2b81a7dc2be46167b388ebc5530c70f
Save $350 in early Black Friday Dyson deal,https://www.news.com.au/best-of/electronics/appliances/best-dyson-black-friday-sales/news-story/b10cce03b16dbf67d1216c7328ea2c50
‘Perfect coffee every time’: $191 off top Nespresso machine,https://www.news.com.au/best-of/best-coffee-machines-black-friday-deals/news-story/ccb1477a925b9e816cfc1ff60a6556e7
Pre-orders open on PlayStation VR2,https://www.news.com.au/best-of/electronics/best-playstation-deals-australia/news-story/b5fc04b74062b6b7358de25679c99c41
$110 off AirPods in Black Friday sales,https://www.news.com.au/best-of/electronics/black-friday-apple-airpods/news-story/1d7fe0f44395825f12086ebf7893302e
"$1,200 off: Black Friday laptop deals begin",https://www.news.com.au/best-of/sales-and-deals/black-friday-pcs-laptops-computers/news-story/0fa7d00b015cb0440d54fc56a0b8826b
Why did Deliveroo collapse in Australia?,https://www.news.com.au/web-stories/free/news-com-au/deliveroo-goes-into-voluntary-administration-in-australia
"'Just do it!': 20,000 signatures in eight hours",https://www.news.com.au/web-stories/free/news-com-au/petition-20000-signatures-to-help-child-sexual-abuse-survivors
"‘Um, sorry?’: Rebel slammed over party post",https://www.news.com.au/web-stories/free/news-com-au/rebel-wilson-criticised-for-partying-after-birth-of-daughter
Pete Davidson dating 'A-list model',https://www.news.com.au/web-stories/free/news-com-au/pete-davidson-emily-ratajkowski-are-dating-reports-say
One job tennis star Ash Barty will ‘never’ pursue,https://www.news.com.au/web-stories/free/news-com-au/one-job-tennis-star-ash-barty-will-never-pursue
Charles’ ‘deepest regret’ from Lady Di’s funeral,https://www.news.com.au/web-stories/free/news-com-au/king-charles-deepest-regret-from-princess-dianas-funeral
Sad truth behind Jen Aniston’s ‘pregnancy’,https://www.news.com.au/web-stories/free/news-com-au/jennifer-aniston-opens-up-about-secret-ivf-struggle
Tornado warning as rain band moves in,https://www.news.com.au/web-stories/free/news-com-au/weather-tornado-warning-as-rain-band-moves-towards-nsw
Australia’s $5b phoenix operation set to explode,https://www.news.com.au/web-stories/free/news-com-au/pheonixing-australias-5b-operation-set-to-explode
'Now pay': Chaos over Musk Twitter prank,https://www.news.com.au/web-stories/free/news-com-au/elon-musks-twitter-takeover-backfires-after-celeb-prank
'Miracle': Rebel announces birth of first child,https://www.news.com.au/web-stories/free/news-com-au/rebel-wilson-aussie-actor-announces-birth-of-first-child
Surprise truth about quiet quitting exposed,https://www.news.com.au/web-stories/free/news-com-au/quiet-quitting-australian-expert-reveals-the-truth-about-job-trend
Company's big work day shake-up pays off,https://www.news.com.au/web-stories/free/news-com-au/unilever-australia-to-trial-four-day-work-week
Aussie singer's staggering fortune revealed,https://www.news.com.au/web-stories/free/news-com-au/tones-and-is-staggering-fortune-revealed
Kanye could face financial ruin within 'months',https://www.news.com.au/web-stories/free/news-com-au/kanye-west-could-face-financial-catastrophe-within-months
Hamish and Zoe Foster Blake’s home is wild,https://www.news.com.au/web-stories/free/news-com-au/hamish-and-zoe-foster-blakes-sydney-home-is-wild
Surprise love story of China’s most powerful man,https://www.news.com.au/web-stories/free/news-com-au/surprising-love-story-of-chinas-most-powerful-man
Bizarre plant trend on the rise in Australia,https://www.news.com.au/web-stories/free/news-com-au/plant-parenting-is-a-new-trend-aussies-are-getting-around
21yo earns six figures working just three hours,https://www.news.com.au/web-stories/free/news-com-au/dropshipping-how-21yo-earns-six-figures-working-just-three-hours
What would a recession mean for Australia?,https://www.news.com.au/web-stories/free/news-com-au/what-would-a-recession-mean-for-australia
When the La Nina rain event will end,https://www.news.com.au/web-stories/free/news-com-au/australia-weather-la-nina-when-will-the-rain-stop
Inside the most beautiful Macca's in the world,https://www.news.com.au/web-stories/free/news-com-au/inside-the-most-beautiful-mcdonalds-in-the-world
Hidden Aussie beach better than Byron,https://www.news.com.au/web-stories/free/news-com-au/cellito-beach-hidden-aussie-coastal-town-better-than-byron
Top 3 emojis that make you 'less likeable',https://www.news.com.au/web-stories/free/news-com-au/top-3-phone-emojis-that-make-you-more-likeable
Carrie’s career option no one saw coming,https://www.news.com.au/web-stories/free/news-com-au/carrie-bickmores-next-move-after-leaving-the-project
'Legend': Aussie’s 'insane' $1.5m journey,https://www.news.com.au/web-stories/free/news-com-au/nedd-brockmanns-1-5-million-journey-across-australia
Shock Aussie flight trend revealed,https://www.news.com.au/web-stories/free/news-com-au/aussie-travel-trend-behind-international-flight-searches
‘Beaten down’: Terrible news for Melburnians,https://www.news.com.au/web-stories/free/news-com-au/beaten-down-and-broken-terrible-news-for-melburnians
Aussie town that's home to new big landmark,https://www.news.com.au/web-stories/free/news-com-au/regional-victorian-town-named-home-to-big-rainbow
Drama behind multimillion-dollar divorce,https://www.news.com.au/web-stories/free/news-com-au/tom-brady-gisele-bundchens-multimillion-dollar-divorce
Vegan protester making thousands,https://www.news.com.au/web-stories/free/news-com-au/tash-peterson-vegan-protester-and-onlyfans-stars-notorious-stunts
‘Step up’: Report angering a lot of men,https://www.news.com.au/web-stories/free/news-com-au/rise-of-single-lonely-men-psychologist-slammed-online
Star signs most likely to be serial killers,https://www.news.com.au/web-stories/free/news-com-au/astrology-star-signs-most-likely-to-be-serial-killers
‘Disgusting’: Backlash to Kanye’s wild claim,https://www.news.com.au/web-stories/free/news-com-au/kanye-west-slammed-after-paris-fashion-week-stunt
New ‘R’ car plate for Aussie motorists,https://www.news.com.au/web-stories/free/news-com-au/new-r-car-plate-for-aussie-motorists
Millions to go beyond ‘quiet quitting’,https://www.news.com.au/web-stories/free/news-com-au/quiet-quitting-millions-of-australians-to-leave-their-job
Shopping hack Aussie tourists don’t know about,https://www.news.com.au/web-stories/free/news-com-au/tourist-discount-aussies-dont-know-about
Real reason you can't use your phone on plane,https://www.news.com.au/web-stories/free/news-com-au/experts-reveal-why-you-need-to-turn-off-your-phone-on-a-flight
Mystery surrounding sex act finally solved,https://www.news.com.au/web-stories/free/news-com-au/sex-and-relationships-is-squirting-actually-a-thing
Proof Keanu Reeves may be the nicest guy on Earth,https://www.news.com.au/web-stories/free/news-com-au/keanu-reeves-may-be-the-nicest-guy-on-earth
Five signs your partner wants a divorce,https://www.news.com.au/web-stories/free/news-com-au/relationships-five-signs-your-partner-wants-a-divorce
Aussies jump on popular travel trend,https://www.news.com.au/web-stories/free/news-com-au/best-pet-friendly-holiday-homes-in-australia
'Regrettable': Adam Levine cheating scandal explodes,https://www.news.com.au/web-stories/free/news-com-au/adam-levine-accused-of-secret-affair-with-models
Truth about Princess Kate's secret double life,https://www.news.com.au/web-stories/free/news-com-au/the-truth-about-kate-middletons-secret-double-life
Fans accuse Harry of 'disrespectful' act,https://www.news.com.au/web-stories/free/news-com-au/queens-funeral-royal-watchers-slam-harrys-disrespectful-act
'Dead money': Aussies refusing to buy house,https://www.news.com.au/web-stories/free/news-com-au/millennials-are-ditching-buying-a-house-and-investing-in-shares-instead
Meghan request that delayed Fab Four walk,https://www.news.com.au/web-stories/free/news-com-au/queen-death-meghan-markle-request-that-delayed-fab-four-walk
Best looks from Emmy Awards red carpet,https://www.news.com.au/web-stories/free/news-com-au/2022-emmy-awards-fashion-zendaya-leads-best-looks-on-red-carpet
Surprise reaction to Meghan's 'lovely' act,https://www.news.com.au/web-stories/free/news-com-au/queen-death-meghan-reunites-with-harry-will-kate
Sexuality type we don’t talk about,https://www.news.com.au/web-stories/free/news-com-au/asexuality-sexuality-type-we-dont-talk-about-often
'Not the truth': Film's wild drama explained,https://www.news.com.au/web-stories/free/news-com-au/dont-worry-darling-drama-harry-styles-appears-to-spit-on-chris-pine
New dating trend as 'hook-up' culture dies out,https://www.news.com.au/web-stories/free/news-com-au/is-hook-up-culture-dead-new-gen-z-relationships-say-so
Surprise Aussie city wins world’s ‘coolest’ street,https://www.news.com.au/web-stories/free/news-com-au/travel-melbourne-makes-time-outs-coolest-streets-ranking
What really killed Princess Diana,https://www.news.com.au/web-stories/free/news-com-au/what-really-killed-princess-diana
'Designer vagina’ surgery is booming,https://www.news.com.au/web-stories/free/news-com-au/why-designer-vagina-surgery-is-booming
The Aussie suburbs with ‘ridiculous’ rent hikes,https://www.news.com.au/web-stories/free/news-com-au/the-ridiculous-rent-hikes-in-aussie-suburbs
Four reasons men get paid considerably more,https://www.news.com.au/web-stories/free/news-com-au/men-get-paid-considerably-more-for-the-same-job-data-reveals
Why women everywhere hate this man,https://www.news.com.au/web-stories/free/news-com-au/andrew-tate-warning-over-viral-tiktok-rape-culture-videos
Xi Jinping humiliates Canadian PM,https://www.news.com.au/finance/work/leaders/chinese-president-xi-furiously-scolds-canada-pm-trudeau-over-inappropriate-act/news-story/0d1ffdec09603e69de6fc1caee1e7ef7
15 famous sayings with weird origins,https://www.news.com.au/national/15-famous-sayings-with-weird-origins/audio/cd048662ffa2d0fa5170496dbe924698
